root@lamp-ubuntu-s-1vcpu-1gb-tor1-01:~# tcpdump -i eth0 port 22
tcpdump: verbose output suppressed, use -v or -vv for full protocol decode
listening on eth0, link-type EN10MB (Ethernet), capture size 262144 bytes
21:41:20.437449 IP lamp-ubuntu-s-1vcpu-1gb-tor1-01.ssh > 38.113.181.243.53135: Flags [P.], seq 1877274793:1877274901, ack 2209524252, win 501, length 108
21:41:20.437515 IP lamp-ubuntu-s-1vcpu-1gb-tor1-01.ssh > 38.113.181.243.53135: Flags [P.], seq 108:144, ack 1, win 501, length 36
21:41:20.437527 IP lamp-ubuntu-s-1vcpu-1gb-tor1-01.ssh > 38.113.181.243.53135: Flags [P.], seq 144:252, ack 1, win 501, length 108
21:41:20.437561 IP lamp-ubuntu-s-1vcpu-1gb-tor1-01.ssh > 38.113.181.243.53135: Flags [P.], seq 252:288, ack 1, win 501, length 36
21:41:20.443958 IP lamp-ubuntu-s-1vcpu-1gb-tor1-01.ssh > 38.113.181.243.53135: Flags [P.], seq 288:476, ack 1, win 501, length 188
21:41:20.444003 IP lamp-ubuntu-s-1vcpu-1gb-tor1-01.ssh > 38.113.181.243.53135: Flags [P.], seq 476:512, ack 1, win 501, length 36
21:41:20.444048 IP lamp-ubuntu-s-1vcpu-1gb-tor1-01.ssh > 38.113.181.243.53135: Flags [P.], seq 512:676, ack 1, win 501, length 164
21:41:20.444078 IP lamp-ubuntu-s-1vcpu-1gb-tor1-01.ssh > 38.113.181.243.53135: Flags [P.], seq 676:712, ack 1, win 501, length 36
21:41:20.444113 IP lamp-ubuntu-s-1vcpu-1gb-tor1-01.ssh > 38.113.181.243.53135: Flags [P.], seq 712:876, ack 1, win 501, length 164
21:41:20.466026 IP 38.113.181.243.53135 > lamp-ubuntu-s-1vcpu-1gb-tor1-01.ssh: Flags [.], ack 288, win 8243, length 0
21:41:20.466090 IP lamp-ubuntu-s-1vcpu-1gb-tor1-01.ssh > 38.113.181.243.53135: Flags [P.], seq 876:2112, ack 1, win 501, length 1236
21:41:20.466235 IP lamp-ubuntu-s-1vcpu-1gb-tor1-01.ssh > 38.113.181.243.53135: Flags [P.], seq 2112:2268, ack 1, win 501, length 156
21:41:20.466271 IP lamp-ubuntu-s-1vcpu-1gb-tor1-01.ssh > 38.113.181.243.53135: Flags [P.], seq 2268:2304, ack 1, win 501, length 36
21:41:20.466310 IP lamp-ubuntu-s-1vcpu-1gb-tor1-01.ssh > 38.113.181.243.53135: Flags [P.], seq 2304:2476, ack 1, win 501, length 172
21:41:20.466338 IP lamp-ubuntu-s-1vcpu-1gb-tor1-01.ssh > 38.113.181.243.53135: Flags [P.], seq 2476:2512, ack 1, win 501, length 36
21:41:20.466372 IP lamp-ubuntu-s-1vcpu-1gb-tor1-01.ssh > 38.113.181.243.53135: Flags [P.], seq 2512:2684, ack 1, win 501, length 172
21:41:20.466400 IP lamp-ubuntu-s-1vcpu-1gb-tor1-01.ssh > 38.113.181.243.53135: Flags [P.], seq 2684:2720, ack 1, win 501, length 36
21:41:20.466432 IP lamp-ubuntu-s-1vcpu-1gb-tor1-01.ssh > 38.113.181.243.53135: Flags [P.], seq 2720:2892, ack 1, win 501, length 172
21:41:20.466457 IP lamp-ubuntu-s-1vcpu-1gb-tor1-01.ssh > 38.113.181.243.53135: Flags [P.], seq 2892:2928, ack 1, win 501, length 36
21:41:20.466507 IP lamp-ubuntu-s-1vcpu-1gb-tor1-01.ssh > 38.113.181.243.53135: Flags [P.], seq 2928:3100, ack 1, win 501, length 172
21:41:20.471203 IP 38.113.181.243.53135 > lamp-ubuntu-s-1vcpu-1gb-tor1-01.ssh: Flags [.], ack 476, win 8242, length 0
21:41:20.471203 IP 38.113.181.243.53135 > lamp-ubuntu-s-1vcpu-1gb-tor1-01.ssh: Flags [.], ack 876, win 8241, length 0
21:41:20.471265 IP lamp-ubuntu-s-1vcpu-1gb-tor1-01.ssh > 38.113.181.243.53135: Flags [P.], seq 3100:4384, ack 1, win 501, length 1284
21:41:20.471406 IP lamp-ubuntu-s-1vcpu-1gb-tor1-01.ssh > 38.113.181.243.53135: Flags [P.], seq 4384:4540, ack 1, win 501, length 156
21:41:20.471459 IP lamp-ubuntu-s-1vcpu-1gb-tor1-01.ssh > 38.113.181.243.53135: Flags [P.], seq 4540:4576, ack 1, win 501, length 36
21:41:20.471496 IP lamp-ubuntu-s-1vcpu-1gb-tor1-01.ssh > 38.113.181.243.53135: Flags [P.], seq 4576:4732, ack 1, win 501, length 156
21:41:20.471538 IP lamp-ubuntu-s-1vcpu-1gb-tor1-01.ssh > 38.113.181.243.53135: Flags [P.], seq 4732:4768, ack 1, win 501, length 36
21:41:20.471555 IP lamp-ubuntu-s-1vcpu-1gb-tor1-01.ssh > 38.113.181.243.53135: Flags [P.], seq 4768:4940, ack 1, win 501, length 172
21:41:20.471589 IP lamp-ubuntu-s-1vcpu-1gb-tor1-01.ssh > 38.113.181.243.53135: Flags [P.], seq 4940:4976, ack 1, win 501, length 36
21:41:20.471625 IP lamp-ubuntu-s-1vcpu-1gb-tor1-01.ssh > 38.113.181.243.53135: Flags [P.], seq 4976:5148, ack 1, win 501, length 172
21:41:20.471650 IP lamp-ubuntu-s-1vcpu-1gb-tor1-01.ssh > 38.113.181.243.53135: Flags [P.], seq 5148:5184, ack 1, win 501, length 36
21:41:20.471682 IP lamp-ubuntu-s-1vcpu-1gb-tor1-01.ssh > 38.113.181.243.53135: Flags [P.], seq 5184:5356, ack 1, win 501, length 172
21:41:20.493332 IP 38.113.181.243.53135 > lamp-ubuntu-s-1vcpu-1gb-tor1-01.ssh: Flags [.], ack 3100, win 8246, length 0
21:41:20.493397 IP lamp-ubuntu-s-1vcpu-1gb-tor1-01.ssh > 38.113.181.243.53135: Flags [P.], seq 5356:6848, ack 1, win 501, length 1492
21:41:20.493532 IP lamp-ubuntu-s-1vcpu-1gb-tor1-01.ssh > 38.113.181.243.53135: Flags [P.], seq 6848:7004, ack 1, win 501, length 156
21:41:20.493569 IP lamp-ubuntu-s-1vcpu-1gb-tor1-01.ssh > 38.113.181.243.53135: Flags [P.], seq 7004:7040, ack 1, win 501, length 36
21:41:20.493608 IP lamp-ubuntu-s-1vcpu-1gb-tor1-01.ssh > 38.113.181.243.53135: Flags [P.], seq 7040:7212, ack 1, win 501, length 172
21:41:20.493635 IP lamp-ubuntu-s-1vcpu-1gb-tor1-01.ssh > 38.113.181.243.53135: Flags [P.], seq 7212:7248, ack 1, win 501, length 36
21:41:20.493669 IP lamp-ubuntu-s-1vcpu-1gb-tor1-01.ssh > 38.113.181.243.53135: Flags [P.], seq 7248:7420, ack 1, win 501, length 172
21:41:20.493697 IP lamp-ubuntu-s-1vcpu-1gb-tor1-01.ssh > 38.113.181.243.53135: Flags [P.], seq 7420:7456, ack 1, win 501, length 36
21:41:20.493730 IP lamp-ubuntu-s-1vcpu-1gb-tor1-01.ssh > 38.113.181.243.53135: Flags [P.], seq 7456:7628, ack 1, win 501, length 172
21:41:20.493757 IP lamp-ubuntu-s-1vcpu-1gb-tor1-01.ssh > 38.113.181.243.53135: Flags [P.], seq 7628:7664, ack 1, win 501, length 36
21:41:20.493789 IP lamp-ubuntu-s-1vcpu-1gb-tor1-01.ssh > 38.113.181.243.53135: Flags [P.], seq 7664:7836, ack 1, win 501, length 172
21:41:20.493818 IP lamp-ubuntu-s-1vcpu-1gb-tor1-01.ssh > 38.113.181.243.53135: Flags [P.], seq 7836:7872, ack 1, win 501, length 36
21:41:20.493868 IP lamp-ubuntu-s-1vcpu-1gb-tor1-01.ssh > 38.113.181.243.53135: Flags [P.], seq 7872:8044, ack 1, win 501, length 172
21:41:20.493913 IP lamp-ubuntu-s-1vcpu-1gb-tor1-01.ssh > 38.113.181.243.53135: Flags [P.], seq 8044:8252, ack 1, win 501, length 208
21:41:20.493947 IP lamp-ubuntu-s-1vcpu-1gb-tor1-01.ssh > 38.113.181.243.53135: Flags [P.], seq 8252:8288, ack 1, win 501, length 36
21:41:20.493981 IP lamp-ubuntu-s-1vcpu-1gb-tor1-01.ssh > 38.113.181.243.53135: Flags [P.], seq 8288:8460, ack 1, win 501, length 172
21:41:20.494009 IP lamp-ubuntu-s-1vcpu-1gb-tor1-01.ssh > 38.113.181.243.53135: Flags [P.], seq 8460:8496, ack 1, win 501, length 36
21:41:20.494043 IP lamp-ubuntu-s-1vcpu-1gb-tor1-01.ssh > 38.113.181.243.53135: Flags [P.], seq 8496:8668, ack 1, win 501, length 172
21:41:20.494070 IP lamp-ubuntu-s-1vcpu-1gb-tor1-01.ssh > 38.113.181.243.53135: Flags [P.], seq 8668:8704, ack 1, win 501, length 36
21:41:20.494105 IP lamp-ubuntu-s-1vcpu-1gb-tor1-01.ssh > 38.113.181.243.53135: Flags [P.], seq 8704:8876, ack 1, win 501, length 172
21:41:20.498199 IP 38.113.181.243.53135 > lamp-ubuntu-s-1vcpu-1gb-tor1-01.ssh: Flags [.], ack 5356, win 8246, length 0
21:41:20.498251 IP lamp-ubuntu-s-1vcpu-1gb-tor1-01.ssh > 38.113.181.243.53135: Flags [P.], seq 8876:10992, ack 1, win 501, length 2116
21:41:20.498399 IP lamp-ubuntu-s-1vcpu-1gb-tor1-01.ssh > 38.113.181.243.53135: Flags [P.], seq 10992:11148, ack 1, win 501, length 156
21:41:20.498452 IP lamp-ubuntu-s-1vcpu-1gb-tor1-01.ssh > 38.113.181.243.53135: Flags [P.], seq 11148:11184, ack 1, win 501, length 36
21:41:20.498511 IP lamp-ubuntu-s-1vcpu-1gb-tor1-01.ssh > 38.113.181.243.53135: Flags [P.], seq 11184:11356, ack 1, win 501, length 172
21:41:20.498553 IP lamp-ubuntu-s-1vcpu-1gb-tor1-01.ssh > 38.113.181.243.53135: Flags [P.], seq 11356:11392, ack 1, win 501, length 36
21:41:20.498623 IP lamp-ubuntu-s-1vcpu-1gb-tor1-01.ssh > 38.113.181.243.53135: Flags [P.], seq 11392:11564, ack 1, win 501, length 172
21:41:20.498668 IP lamp-ubuntu-s-1vcpu-1gb-tor1-01.ssh > 38.113.181.243.53135: Flags [P.], seq 11564:11600, ack 1, win 501, length 36
21:41:20.498716 IP lamp-ubuntu-s-1vcpu-1gb-tor1-01.ssh > 38.113.181.243.53135: Flags [P.], seq 11600:11772, ack 1, win 501, length 172
21:41:20.498747 IP lamp-ubuntu-s-1vcpu-1gb-tor1-01.ssh > 38.113.181.243.53135: Flags [P.], seq 11772:11808, ack 1, win 501, length 36
21:41:20.498781 IP lamp-ubuntu-s-1vcpu-1gb-tor1-01.ssh > 38.113.181.243.53135: Flags [P.], seq 11808:11980, ack 1, win 501, length 172
21:41:20.498808 IP lamp-ubuntu-s-1vcpu-1gb-tor1-01.ssh > 38.113.181.243.53135: Flags [P.], seq 11980:12016, ack 1, win 501, length 36
21:41:20.498848 IP lamp-ubuntu-s-1vcpu-1gb-tor1-01.ssh > 38.113.181.243.53135: Flags [P.], seq 12016:12188, ack 1, win 501, length 172
21:41:20.498889 IP lamp-ubuntu-s-1vcpu-1gb-tor1-01.ssh > 38.113.181.243.53135: Flags [P.], seq 12188:12224, ack 1, win 501, length 36
21:41:20.498928 IP lamp-ubuntu-s-1vcpu-1gb-tor1-01.ssh > 38.113.181.243.53135: Flags [P.], seq 12224:12396, ack 1, win 501, length 172
21:41:20.498956 IP lamp-ubuntu-s-1vcpu-1gb-tor1-01.ssh > 38.113.181.243.53135: Flags [P.], seq 12396:12432, ack 1, win 501, length 36
21:41:20.498991 IP lamp-ubuntu-s-1vcpu-1gb-tor1-01.ssh > 38.113.181.243.53135: Flags [P.], seq 12432:12604, ack 1, win 501, length 172
21:41:20.499017 IP lamp-ubuntu-s-1vcpu-1gb-tor1-01.ssh > 38.113.181.243.53135: Flags [P.], seq 12604:12640, ack 1, win 501, length 36
21:41:20.499051 IP lamp-ubuntu-s-1vcpu-1gb-tor1-01.ssh > 38.113.181.243.53135: Flags [P.], seq 12640:12812, ack 1, win 501, length 172
21:41:20.499084 IP lamp-ubuntu-s-1vcpu-1gb-tor1-01.ssh > 38.113.181.243.53135: Flags [P.], seq 12812:12848, ack 1, win 501, length 36
21:41:20.520588 IP 38.113.181.243.53135 > lamp-ubuntu-s-1vcpu-1gb-tor1-01.ssh: Flags [.], ack 8876, win 8246, length 0
21:41:20.520661 IP lamp-ubuntu-s-1vcpu-1gb-tor1-01.ssh > 38.113.181.243.53135: Flags [P.], seq 12848:15136, ack 1, win 501, length 2288
21:41:20.520800 IP lamp-ubuntu-s-1vcpu-1gb-tor1-01.ssh > 38.113.181.243.53135: Flags [P.], seq 15136:15292, ack 1, win 501, length 156
21:41:20.520838 IP lamp-ubuntu-s-1vcpu-1gb-tor1-01.ssh > 38.113.181.243.53135: Flags [P.], seq 15292:15328, ack 1, win 501, length 36
21:41:20.520875 IP lamp-ubuntu-s-1vcpu-1gb-tor1-01.ssh > 38.113.181.243.53135: Flags [P.], seq 15328:15500, ack 1, win 501, length 172
21:41:20.520903 IP lamp-ubuntu-s-1vcpu-1gb-tor1-01.ssh > 38.113.181.243.53135: Flags [P.], seq 15500:15536, ack 1, win 501, length 36
21:41:20.520937 IP lamp-ubuntu-s-1vcpu-1gb-tor1-01.ssh > 38.113.181.243.53135: Flags [P.], seq 15536:15708, ack 1, win 501, length 172
21:41:20.520964 IP lamp-ubuntu-s-1vcpu-1gb-tor1-01.ssh > 38.113.181.243.53135: Flags [P.], seq 15708:15744, ack 1, win 501, length 36
21:41:20.520997 IP lamp-ubuntu-s-1vcpu-1gb-tor1-01.ssh > 38.113.181.243.53135: Flags [P.], seq 15744:15916, ack 1, win 501, length 172
21:41:20.521023 IP lamp-ubuntu-s-1vcpu-1gb-tor1-01.ssh > 38.113.181.243.53135: Flags [P.], seq 15916:15952, ack 1, win 501, length 36
21:41:20.521055 IP lamp-ubuntu-s-1vcpu-1gb-tor1-01.ssh > 38.113.181.243.53135: Flags [P.], seq 15952:16124, ack 1, win 501, length 172
21:41:20.521094 IP lamp-ubuntu-s-1vcpu-1gb-tor1-01.ssh > 38.113.181.243.53135: Flags [P.], seq 16124:16332, ack 1, win 501, length 208
21:41:20.521133 IP lamp-ubuntu-s-1vcpu-1gb-tor1-01.ssh > 38.113.181.243.53135: Flags [P.], seq 16332:16368, ack 1, win 501, length 36
21:41:20.521179 IP lamp-ubuntu-s-1vcpu-1gb-tor1-01.ssh > 38.113.181.243.53135: Flags [P.], seq 16368:16540, ack 1, win 501, length 172
21:41:20.521211 IP lamp-ubuntu-s-1vcpu-1gb-tor1-01.ssh > 38.113.181.243.53135: Flags [P.], seq 16540:16576, ack 1, win 501, length 36
21:41:20.521251 IP lamp-ubuntu-s-1vcpu-1gb-tor1-01.ssh > 38.113.181.243.53135: Flags [P.], seq 16576:16748, ack 1, win 501, length 172
21:41:20.521288 IP lamp-ubuntu-s-1vcpu-1gb-tor1-01.ssh > 38.113.181.243.53135: Flags [P.], seq 16748:16784, ack 1, win 501, length 36
21:41:20.521335 IP lamp-ubuntu-s-1vcpu-1gb-tor1-01.ssh > 38.113.181.243.53135: Flags [P.], seq 16784:16956, ack 1, win 501, length 172
21:41:20.521372 IP lamp-ubuntu-s-1vcpu-1gb-tor1-01.ssh > 38.113.181.243.53135: Flags [P.], seq 16956:16992, ack 1, win 501, length 36
21:41:20.521420 IP lamp-ubuntu-s-1vcpu-1gb-tor1-01.ssh > 38.113.181.243.53135: Flags [P.], seq 16992:17164, ack 1, win 501, length 172
21:41:20.521456 IP lamp-ubuntu-s-1vcpu-1gb-tor1-01.ssh > 38.113.181.243.53135: Flags [P.], seq 17164:17200, ack 1, win 501, length 36
21:41:20.521503 IP lamp-ubuntu-s-1vcpu-1gb-tor1-01.ssh > 38.113.181.243.53135: Flags [P.], seq 17200:17372, ack 1, win 501, length 172
21:41:20.521535 IP lamp-ubuntu-s-1vcpu-1gb-tor1-01.ssh > 38.113.181.243.53135: Flags [P.], seq 17372:17408, ack 1, win 501, length 36
21:41:20.521571 IP lamp-ubuntu-s-1vcpu-1gb-tor1-01.ssh > 38.113.181.243.53135: Flags [P.], seq 17408:17580, ack 1, win 501, length 172
21:41:20.521599 IP lamp-ubuntu-s-1vcpu-1gb-tor1-01.ssh > 38.113.181.243.53135: Flags [P.], seq 17580:17616, ack 1, win 501, length 36
21:41:20.521631 IP lamp-ubuntu-s-1vcpu-1gb-tor1-01.ssh > 38.113.181.243.53135: Flags [P.], seq 17616:17788, ack 1, win 501, length 172
21:41:20.521657 IP lamp-ubuntu-s-1vcpu-1gb-tor1-01.ssh > 38.113.181.243.53135: Flags [P.], seq 17788:17824, ack 1, win 501, length 36
21:41:20.521692 IP lamp-ubuntu-s-1vcpu-1gb-tor1-01.ssh > 38.113.181.243.53135: Flags [P.], seq 17824:17996, ack 1, win 501, length 172
21:41:20.521718 IP lamp-ubuntu-s-1vcpu-1gb-tor1-01.ssh > 38.113.181.243.53135: Flags [P.], seq 17996:18032, ack 1, win 501, length 36
21:41:20.521751 IP lamp-ubuntu-s-1vcpu-1gb-tor1-01.ssh > 38.113.181.243.53135: Flags [P.], seq 18032:18204, ack 1, win 501, length 172
21:41:20.521778 IP lamp-ubuntu-s-1vcpu-1gb-tor1-01.ssh > 38.113.181.243.53135: Flags [P.], seq 18204:18240, ack 1, win 501, length 36
21:41:20.521811 IP lamp-ubuntu-s-1vcpu-1gb-tor1-01.ssh > 38.113.181.243.53135: Flags [P.], seq 18240:18412, ack 1, win 501, length 172
21:41:20.521838 IP lamp-ubuntu-s-1vcpu-1gb-tor1-01.ssh > 38.113.181.243.53135: Flags [P.], seq 18412:18448, ack 1, win 501, length 36
21:41:20.521881 IP lamp-ubuntu-s-1vcpu-1gb-tor1-01.ssh > 38.113.181.243.53135: Flags [P.], seq 18448:18620, ack 1, win 501, length 172
21:41:20.521911 IP lamp-ubuntu-s-1vcpu-1gb-tor1-01.ssh > 38.113.181.243.53135: Flags [P.], seq 18620:18656, ack 1, win 501, length 36
21:41:20.521947 IP lamp-ubuntu-s-1vcpu-1gb-tor1-01.ssh > 38.113.181.243.53135: Flags [P.], seq 18656:18828, ack 1, win 501, length 172
21:41:20.521996 IP lamp-ubuntu-s-1vcpu-1gb-tor1-01.ssh > 38.113.181.243.53135: Flags [P.], seq 18828:18864, ack 1, win 501, length 36
21:41:20.522013 IP lamp-ubuntu-s-1vcpu-1gb-tor1-01.ssh > 38.113.181.243.53135: Flags [P.], seq 18864:19036, ack 1, win 501, length 172
21:41:20.522042 IP lamp-ubuntu-s-1vcpu-1gb-tor1-01.ssh > 38.113.181.243.53135: Flags [P.], seq 19036:19072, ack 1, win 501, length 36
21:41:20.522076 IP lamp-ubuntu-s-1vcpu-1gb-tor1-01.ssh > 38.113.181.243.53135: Flags [P.], seq 19072:19244, ack 1, win 501, length 172
21:41:20.525669 IP 38.113.181.243.53135 > lamp-ubuntu-s-1vcpu-1gb-tor1-01.ssh: Flags [.], ack 10992, win 8246, length 0
21:41:20.525708 IP lamp-ubuntu-s-1vcpu-1gb-tor1-01.ssh > 38.113.181.243.53135: Flags [P.], seq 19244:23440, ack 1, win 501, length 4196
21:41:20.525807 IP lamp-ubuntu-s-1vcpu-1gb-tor1-01.ssh > 38.113.181.243.53135: Flags [P.], seq 23440:23596, ack 1, win 501, length 156
21:41:20.525846 IP 38.113.181.243.53135 > lamp-ubuntu-s-1vcpu-1gb-tor1-01.ssh: Flags [.], ack 12848, win 8246, length 0
21:41:20.525862 IP lamp-ubuntu-s-1vcpu-1gb-tor1-01.ssh > 38.113.181.243.53135: Flags [P.], seq 23596:23632, ack 1, win 501, length 36
21:41:20.525899 IP lamp-ubuntu-s-1vcpu-1gb-tor1-01.ssh > 38.113.181.243.53135: Flags [P.], seq 23632:23804, ack 1, win 501, length 172
21:41:20.525927 IP lamp-ubuntu-s-1vcpu-1gb-tor1-01.ssh > 38.113.181.243.53135: Flags [P.], seq 23804:23840, ack 1, win 501, length 36
21:41:20.525962 IP lamp-ubuntu-s-1vcpu-1gb-tor1-01.ssh > 38.113.181.243.53135: Flags [P.], seq 23840:24012, ack 1, win 501, length 172
21:41:20.525989 IP lamp-ubuntu-s-1vcpu-1gb-tor1-01.ssh > 38.113.181.243.53135: Flags [P.], seq 24012:24048, ack 1, win 501, length 36
21:41:20.526044 IP lamp-ubuntu-s-1vcpu-1gb-tor1-01.ssh > 38.113.181.243.53135: Flags [P.], seq 24048:24204, ack 1, win 501, length 156
21:41:20.526082 IP lamp-ubuntu-s-1vcpu-1gb-tor1-01.ssh > 38.113.181.243.53135: Flags [P.], seq 24204:24240, ack 1, win 501, length 36
21:41:20.526135 IP lamp-ubuntu-s-1vcpu-1gb-tor1-01.ssh > 38.113.181.243.53135: Flags [P.], seq 24240:24412, ack 1, win 501, length 172
21:41:20.526175 IP lamp-ubuntu-s-1vcpu-1gb-tor1-01.ssh > 38.113.181.243.53135: Flags [P.], seq 24412:24448, ack 1, win 501, length 36
21:41:20.526222 IP lamp-ubuntu-s-1vcpu-1gb-tor1-01.ssh > 38.113.181.243.53135: Flags [P.], seq 24448:24620, ack 1, win 501, length 172
21:41:20.526267 IP lamp-ubuntu-s-1vcpu-1gb-tor1-01.ssh > 38.113.181.243.53135: Flags [P.], seq 24620:24656, ack 1, win 501, length 36
21:41:20.526326 IP lamp-ubuntu-s-1vcpu-1gb-tor1-01.ssh > 38.113.181.243.53135: Flags [P.], seq 24656:24828, ack 1, win 501, length 172
21:41:20.526362 IP lamp-ubuntu-s-1vcpu-1gb-tor1-01.ssh > 38.113.181.243.53135: Flags [P.], seq 24828:24864, ack 1, win 501, length 36
21:41:20.526398 IP lamp-ubuntu-s-1vcpu-1gb-tor1-01.ssh > 38.113.181.243.53135: Flags [P.], seq 24864:25036, ack 1, win 501, length 172
21:41:20.526426 IP lamp-ubuntu-s-1vcpu-1gb-tor1-01.ssh > 38.113.181.243.53135: Flags [P.], seq 25036:25072, ack 1, win 501, length 36
21:41:20.526461 IP lamp-ubuntu-s-1vcpu-1gb-tor1-01.ssh > 38.113.181.243.53135: Flags [P.], seq 25072:25244, ack 1, win 501, length 172
21:41:20.526506 IP lamp-ubuntu-s-1vcpu-1gb-tor1-01.ssh > 38.113.181.243.53135: Flags [P.], seq 25244:25280, ack 1, win 501, length 36
21:41:20.526545 IP lamp-ubuntu-s-1vcpu-1gb-tor1-01.ssh > 38.113.181.243.53135: Flags [P.], seq 25280:25452, ack 1, win 501, length 172
21:41:20.526573 IP lamp-ubuntu-s-1vcpu-1gb-tor1-01.ssh > 38.113.181.243.53135: Flags [P.], seq 25452:25488, ack 1, win 501, length 36
21:41:20.526624 IP lamp-ubuntu-s-1vcpu-1gb-tor1-01.ssh > 38.113.181.243.53135: Flags [P.], seq 25488:25660, ack 1, win 501, length 172
21:41:20.526658 IP lamp-ubuntu-s-1vcpu-1gb-tor1-01.ssh > 38.113.181.243.53135: Flags [P.], seq 25660:25696, ack 1, win 501, length 36
21:41:20.526762 IP lamp-ubuntu-s-1vcpu-1gb-tor1-01.ssh > 38.113.181.243.53135: Flags [P.], seq 25696:26276, ack 1, win 501, length 580
21:41:20.526890 IP lamp-ubuntu-s-1vcpu-1gb-tor1-01.ssh > 38.113.181.243.53135: Flags [P.], seq 26276:27536, ack 1, win 501, length 1260
21:41:20.526952 IP lamp-ubuntu-s-1vcpu-1gb-tor1-01.ssh > 38.113.181.243.53135: Flags [P.], seq 27536:27980, ack 1, win 501, length 444
21:41:20.526995 IP lamp-ubuntu-s-1vcpu-1gb-tor1-01.ssh > 38.113.181.243.53135: Flags [P.], seq 27980:28152, ack 1, win 501, length 172
21:41:20.527035 IP lamp-ubuntu-s-1vcpu-1gb-tor1-01.ssh > 38.113.181.243.53135: Flags [P.], seq 28152:28324, ack 1, win 501, length 172
21:41:20.527074 IP lamp-ubuntu-s-1vcpu-1gb-tor1-01.ssh > 38.113.181.243.53135: Flags [P.], seq 28324:28496, ack 1, win 501, length 172
21:41:20.527114 IP lamp-ubuntu-s-1vcpu-1gb-tor1-01.ssh > 38.113.181.243.53135: Flags [P.], seq 28496:28668, ack 1, win 501, length 172
21:41:20.527155 IP lamp-ubuntu-s-1vcpu-1gb-tor1-01.ssh > 38.113.181.243.53135: Flags [P.], seq 28668:28840, ack 1, win 501, length 172
21:41:20.527199 IP lamp-ubuntu-s-1vcpu-1gb-tor1-01.ssh > 38.113.181.243.53135: Flags [P.], seq 28840:29012, ack 1, win 501, length 172
21:41:20.527239 IP lamp-ubuntu-s-1vcpu-1gb-tor1-01.ssh > 38.113.181.243.53135: Flags [P.], seq 29012:29184, ack 1, win 501, length 172
21:41:20.527279 IP lamp-ubuntu-s-1vcpu-1gb-tor1-01.ssh > 38.113.181.243.53135: Flags [P.], seq 29184:29356, ack 1, win 501, length 172
21:41:20.527319 IP lamp-ubuntu-s-1vcpu-1gb-tor1-01.ssh > 38.113.181.243.53135: Flags [P.], seq 29356:29528, ack 1, win 501, length 172
21:41:20.527358 IP lamp-ubuntu-s-1vcpu-1gb-tor1-01.ssh > 38.113.181.243.53135: Flags [P.], seq 29528:29700, ack 1, win 501, length 172
21:41:20.527396 IP lamp-ubuntu-s-1vcpu-1gb-tor1-01.ssh > 38.113.181.243.53135: Flags [P.], seq 29700:29872, ack 1, win 501, length 172
21:41:20.527436 IP lamp-ubuntu-s-1vcpu-1gb-tor1-01.ssh > 38.113.181.243.53135: Flags [P.], seq 29872:30044, ack 1, win 501, length 172
21:41:20.547940 IP 38.113.181.243.53135 > lamp-ubuntu-s-1vcpu-1gb-tor1-01.ssh: Flags [.], ack 17580, win 8246, length 0
21:41:20.548025 IP lamp-ubuntu-s-1vcpu-1gb-tor1-01.ssh > 38.113.181.243.53135: Flags [P.], seq 30044:30216, ack 1, win 501, length 172
21:41:20.548227 IP lamp-ubuntu-s-1vcpu-1gb-tor1-01.ssh > 38.113.181.243.53135: Flags [P.], seq 30216:30372, ack 1, win 501, length 156
21:41:20.548354 IP lamp-ubuntu-s-1vcpu-1gb-tor1-01.ssh > 38.113.181.243.53135: Flags [P.], seq 30372:30680, ack 1, win 501, length 308
21:41:20.548399 IP lamp-ubuntu-s-1vcpu-1gb-tor1-01.ssh > 38.113.181.243.53135: Flags [P.], seq 30680:30852, ack 1, win 501, length 172
21:41:20.548440 IP lamp-ubuntu-s-1vcpu-1gb-tor1-01.ssh > 38.113.181.243.53135: Flags [P.], seq 30852:31024, ack 1, win 501, length 172
21:41:20.548480 IP lamp-ubuntu-s-1vcpu-1gb-tor1-01.ssh > 38.113.181.243.53135: Flags [P.], seq 31024:31196, ack 1, win 501, length 172
21:41:20.548519 IP lamp-ubuntu-s-1vcpu-1gb-tor1-01.ssh > 38.113.181.243.53135: Flags [P.], seq 31196:31368, ack 1, win 501, length 172
21:41:20.548564 IP lamp-ubuntu-s-1vcpu-1gb-tor1-01.ssh > 38.113.181.243.53135: Flags [P.], seq 31368:31540, ack 1, win 501, length 172
21:41:20.548604 IP lamp-ubuntu-s-1vcpu-1gb-tor1-01.ssh > 38.113.181.243.53135: Flags [P.], seq 31540:31712, ack 1, win 501, length 172
21:41:20.548645 IP lamp-ubuntu-s-1vcpu-1gb-tor1-01.ssh > 38.113.181.243.53135: Flags [P.], seq 31712:31884, ack 1, win 501, length 172
21:41:20.548686 IP lamp-ubuntu-s-1vcpu-1gb-tor1-01.ssh > 38.113.181.243.53135: Flags [P.], seq 31884:32056, ack 1, win 501, length 172
21:41:20.548726 IP lamp-ubuntu-s-1vcpu-1gb-tor1-01.ssh > 38.113.181.243.53135: Flags [P.], seq 32056:32228, ack 1, win 501, length 172
21:41:20.548766 IP lamp-ubuntu-s-1vcpu-1gb-tor1-01.ssh > 38.113.181.243.53135: Flags [P.], seq 32228:32400, ack 1, win 501, length 172
21:41:20.548814 IP lamp-ubuntu-s-1vcpu-1gb-tor1-01.ssh > 38.113.181.243.53135: Flags [P.], seq 32400:32572, ack 1, win 501, length 172
21:41:20.548867 IP lamp-ubuntu-s-1vcpu-1gb-tor1-01.ssh > 38.113.181.243.53135: Flags [P.], seq 32572:32744, ack 1, win 501, length 172
21:41:20.548907 IP lamp-ubuntu-s-1vcpu-1gb-tor1-01.ssh > 38.113.181.243.53135: Flags [P.], seq 32744:32916, ack 1, win 501, length 172
21:41:20.548939 IP 38.113.181.243.53135 > lamp-ubuntu-s-1vcpu-1gb-tor1-01.ssh: Flags [.], ack 19244, win 8246, length 0
21:41:20.548986 IP lamp-ubuntu-s-1vcpu-1gb-tor1-01.ssh > 38.113.181.243.53135: Flags [P.], seq 32916:33208, ack 1, win 501, length 292
21:41:20.549027 IP lamp-ubuntu-s-1vcpu-1gb-tor1-01.ssh > 38.113.181.243.53135: Flags [P.], seq 33208:33380, ack 1, win 501, length 172
21:41:20.549066 IP lamp-ubuntu-s-1vcpu-1gb-tor1-01.ssh > 38.113.181.243.53135: Flags [P.], seq 33380:33552, ack 1, win 501, length 172
21:41:20.549107 IP lamp-ubuntu-s-1vcpu-1gb-tor1-01.ssh > 38.113.181.243.53135: Flags [P.], seq 33552:33724, ack 1, win 501, length 172
21:41:20.549147 IP lamp-ubuntu-s-1vcpu-1gb-tor1-01.ssh > 38.113.181.243.53135: Flags [P.], seq 33724:33896, ack 1, win 501, length 172
21:41:20.549198 IP lamp-ubuntu-s-1vcpu-1gb-tor1-01.ssh > 38.113.181.243.53135: Flags [P.], seq 33896:34068, ack 1, win 501, length 172
21:41:20.549239 IP lamp-ubuntu-s-1vcpu-1gb-tor1-01.ssh > 38.113.181.243.53135: Flags [P.], seq 34068:34240, ack 1, win 501, length 172
21:41:20.549342 IP lamp-ubuntu-s-1vcpu-1gb-tor1-01.ssh > 38.113.181.243.53135: Flags [P.], seq 34240:34412, ack 1, win 501, length 172
21:41:20.549389 IP lamp-ubuntu-s-1vcpu-1gb-tor1-01.ssh > 38.113.181.243.53135: Flags [P.], seq 34412:34584, ack 1, win 501, length 172
21:41:20.549429 IP lamp-ubuntu-s-1vcpu-1gb-tor1-01.ssh > 38.113.181.243.53135: Flags [P.], seq 34584:34756, ack 1, win 501, length 172
21:41:20.549488 IP lamp-ubuntu-s-1vcpu-1gb-tor1-01.ssh > 38.113.181.243.53135: Flags [P.], seq 34756:34928, ack 1, win 501, length 172
21:41:20.549533 IP lamp-ubuntu-s-1vcpu-1gb-tor1-01.ssh > 38.113.181.243.53135: Flags [P.], seq 34928:35100, ack 1, win 501, length 172
21:41:20.549573 IP lamp-ubuntu-s-1vcpu-1gb-tor1-01.ssh > 38.113.181.243.53135: Flags [P.], seq 35100:35272, ack 1, win 501, length 172
21:41:20.549613 IP lamp-ubuntu-s-1vcpu-1gb-tor1-01.ssh > 38.113.181.243.53135: Flags [P.], seq 35272:35444, ack 1, win 501, length 172
21:41:20.549652 IP lamp-ubuntu-s-1vcpu-1gb-tor1-01.ssh > 38.113.181.243.53135: Flags [P.], seq 35444:35616, ack 1, win 501, length 172
21:41:20.549691 IP lamp-ubuntu-s-1vcpu-1gb-tor1-01.ssh > 38.113.181.243.53135: Flags [P.], seq 35616:35788, ack 1, win 501, length 172
21:41:20.549729 IP lamp-ubuntu-s-1vcpu-1gb-tor1-01.ssh > 38.113.181.243.53135: Flags [P.], seq 35788:35960, ack 1, win 501, length 172
21:41:20.549767 IP lamp-ubuntu-s-1vcpu-1gb-tor1-01.ssh > 38.113.181.243.53135: Flags [P.], seq 35960:36132, ack 1, win 501, length 172
21:41:20.549804 IP lamp-ubuntu-s-1vcpu-1gb-tor1-01.ssh > 38.113.181.243.53135: Flags [P.], seq 36132:36304, ack 1, win 501, length 172
21:41:20.549897 IP lamp-ubuntu-s-1vcpu-1gb-tor1-01.ssh > 38.113.181.243.53135: Flags [P.], seq 36304:36476, ack 1, win 501, length 172
21:41:20.549936 IP lamp-ubuntu-s-1vcpu-1gb-tor1-01.ssh > 38.113.181.243.53135: Flags [P.], seq 36476:36648, ack 1, win 501, length 172
21:41:20.549973 IP lamp-ubuntu-s-1vcpu-1gb-tor1-01.ssh > 38.113.181.243.53135: Flags [P.], seq 36648:36820, ack 1, win 501, length 172
21:41:20.550061 IP lamp-ubuntu-s-1vcpu-1gb-tor1-01.ssh > 38.113.181.243.53135: Flags [P.], seq 36820:36992, ack 1, win 501, length 172
21:41:20.550105 IP lamp-ubuntu-s-1vcpu-1gb-tor1-01.ssh > 38.113.181.243.53135: Flags [P.], seq 36992:37164, ack 1, win 501, length 172
21:41:20.550148 IP lamp-ubuntu-s-1vcpu-1gb-tor1-01.ssh > 38.113.181.243.53135: Flags [P.], seq 37164:37336, ack 1, win 501, length 172
21:41:20.550187 IP lamp-ubuntu-s-1vcpu-1gb-tor1-01.ssh > 38.113.181.243.53135: Flags [P.], seq 37336:37508, ack 1, win 501, length 172
21:41:20.550227 IP lamp-ubuntu-s-1vcpu-1gb-tor1-01.ssh > 38.113.181.243.53135: Flags [P.], seq 37508:37680, ack 1, win 501, length 172
21:41:20.550265 IP lamp-ubuntu-s-1vcpu-1gb-tor1-01.ssh > 38.113.181.243.53135: Flags [P.], seq 37680:37852, ack 1, win 501, length 172
21:41:20.550302 IP lamp-ubuntu-s-1vcpu-1gb-tor1-01.ssh > 38.113.181.243.53135: Flags [P.], seq 37852:38024, ack 1, win 501, length 172
21:41:20.550342 IP lamp-ubuntu-s-1vcpu-1gb-tor1-01.ssh > 38.113.181.243.53135: Flags [P.], seq 38024:38196, ack 1, win 501, length 172
21:41:20.550381 IP lamp-ubuntu-s-1vcpu-1gb-tor1-01.ssh > 38.113.181.243.53135: Flags [P.], seq 38196:38368, ack 1, win 501, length 172
21:41:20.550419 IP lamp-ubuntu-s-1vcpu-1gb-tor1-01.ssh > 38.113.181.243.53135: Flags [P.], seq 38368:38540, ack 1, win 501, length 172
21:41:20.550460 IP lamp-ubuntu-s-1vcpu-1gb-tor1-01.ssh > 38.113.181.243.53135: Flags [P.], seq 38540:38712, ack 1, win 501, length 172
21:41:20.550501 IP lamp-ubuntu-s-1vcpu-1gb-tor1-01.ssh > 38.113.181.243.53135: Flags [P.], seq 38712:38884, ack 1, win 501, length 172
21:41:20.550540 IP lamp-ubuntu-s-1vcpu-1gb-tor1-01.ssh > 38.113.181.243.53135: Flags [P.], seq 38884:39056, ack 1, win 501, length 172
21:41:20.550643 IP lamp-ubuntu-s-1vcpu-1gb-tor1-01.ssh > 38.113.181.243.53135: Flags [P.], seq 39056:39228, ack 1, win 501, length 172
21:41:20.550684 IP lamp-ubuntu-s-1vcpu-1gb-tor1-01.ssh > 38.113.181.243.53135: Flags [P.], seq 39228:39400, ack 1, win 501, length 172
21:41:20.550722 IP lamp-ubuntu-s-1vcpu-1gb-tor1-01.ssh > 38.113.181.243.53135: Flags [P.], seq 39400:39572, ack 1, win 501, length 172
21:41:20.550853 IP lamp-ubuntu-s-1vcpu-1gb-tor1-01.ssh > 38.113.181.243.53135: Flags [P.], seq 39572:39744, ack 1, win 501, length 172
21:41:20.550902 IP lamp-ubuntu-s-1vcpu-1gb-tor1-01.ssh > 38.113.181.243.53135: Flags [P.], seq 39744:39916, ack 1, win 501, length 172
21:41:20.550945 IP lamp-ubuntu-s-1vcpu-1gb-tor1-01.ssh > 38.113.181.243.53135: Flags [P.], seq 39916:40088, ack 1, win 501, length 172
21:41:20.551037 IP lamp-ubuntu-s-1vcpu-1gb-tor1-01.ssh > 38.113.181.243.53135: Flags [P.], seq 40088:40260, ack 1, win 501, length 172
21:41:20.551088 IP lamp-ubuntu-s-1vcpu-1gb-tor1-01.ssh > 38.113.181.243.53135: Flags [P.], seq 40260:40432, ack 1, win 501, length 172
21:41:20.551212 IP lamp-ubuntu-s-1vcpu-1gb-tor1-01.ssh > 38.113.181.243.53135: Flags [P.], seq 40432:40604, ack 1, win 501, length 172
21:41:20.551256 IP lamp-ubuntu-s-1vcpu-1gb-tor1-01.ssh > 38.113.181.243.53135: Flags [P.], seq 40604:40776, ack 1, win 501, length 172
21:41:20.551296 IP lamp-ubuntu-s-1vcpu-1gb-tor1-01.ssh > 38.113.181.243.53135: Flags [P.], seq 40776:40948, ack 1, win 501, length 172
21:41:20.551336 IP lamp-ubuntu-s-1vcpu-1gb-tor1-01.ssh > 38.113.181.243.53135: Flags [P.], seq 40948:41120, ack 1, win 501, length 172
21:41:20.551377 IP lamp-ubuntu-s-1vcpu-1gb-tor1-01.ssh > 38.113.181.243.53135: Flags [P.], seq 41120:41292, ack 1, win 501, length 172
21:41:20.551434 IP lamp-ubuntu-s-1vcpu-1gb-tor1-01.ssh > 38.113.181.243.53135: Flags [P.], seq 41292:41464, ack 1, win 501, length 172
21:41:20.551473 IP lamp-ubuntu-s-1vcpu-1gb-tor1-01.ssh > 38.113.181.243.53135: Flags [P.], seq 41464:41636, ack 1, win 501, length 172
21:41:20.551529 IP lamp-ubuntu-s-1vcpu-1gb-tor1-01.ssh > 38.113.181.243.53135: Flags [P.], seq 41636:41808, ack 1, win 501, length 172
21:41:20.551569 IP lamp-ubuntu-s-1vcpu-1gb-tor1-01.ssh > 38.113.181.243.53135: Flags [P.], seq 41808:41980, ack 1, win 501, length 172
21:41:20.551609 IP lamp-ubuntu-s-1vcpu-1gb-tor1-01.ssh > 38.113.181.243.53135: Flags [P.], seq 41980:42152, ack 1, win 501, length 172
21:41:20.551648 IP lamp-ubuntu-s-1vcpu-1gb-tor1-01.ssh > 38.113.181.243.53135: Flags [P.], seq 42152:42324, ack 1, win 501, length 172
21:41:20.551702 IP lamp-ubuntu-s-1vcpu-1gb-tor1-01.ssh > 38.113.181.243.53135: Flags [P.], seq 42324:42496, ack 1, win 501, length 172
21:41:20.551765 IP lamp-ubuntu-s-1vcpu-1gb-tor1-01.ssh > 38.113.181.243.53135: Flags [P.], seq 42496:42668, ack 1, win 501, length 172
21:41:20.551823 IP lamp-ubuntu-s-1vcpu-1gb-tor1-01.ssh > 38.113.181.243.53135: Flags [P.], seq 42668:42840, ack 1, win 501, length 172
21:41:20.551886 IP lamp-ubuntu-s-1vcpu-1gb-tor1-01.ssh > 38.113.181.243.53135: Flags [P.], seq 42840:43012, ack 1, win 501, length 172
21:41:20.551937 IP lamp-ubuntu-s-1vcpu-1gb-tor1-01.ssh > 38.113.181.243.53135: Flags [P.], seq 43012:43184, ack 1, win 501, length 172
21:41:20.551992 IP lamp-ubuntu-s-1vcpu-1gb-tor1-01.ssh > 38.113.181.243.53135: Flags [P.], seq 43184:43356, ack 1, win 501, length 172
21:41:20.552037 IP lamp-ubuntu-s-1vcpu-1gb-tor1-01.ssh > 38.113.181.243.53135: Flags [P.], seq 43356:43528, ack 1, win 501, length 172
21:41:20.552079 IP lamp-ubuntu-s-1vcpu-1gb-tor1-01.ssh > 38.113.181.243.53135: Flags [P.], seq 43528:43700, ack 1, win 501, length 172
21:41:20.552118 IP lamp-ubuntu-s-1vcpu-1gb-tor1-01.ssh > 38.113.181.243.53135: Flags [P.], seq 43700:43872, ack 1, win 501, length 172
21:41:20.552154 IP lamp-ubuntu-s-1vcpu-1gb-tor1-01.ssh > 38.113.181.243.53135: Flags [P.], seq 43872:44044, ack 1, win 501, length 172
21:41:20.552660 IP 38.113.181.243.53135 > lamp-ubuntu-s-1vcpu-1gb-tor1-01.ssh: Flags [.], ack 22164, win 8246, length 0
21:41:20.552672 IP lamp-ubuntu-s-1vcpu-1gb-tor1-01.ssh > 38.113.181.243.53135: Flags [P.], seq 44044:44216, ack 1, win 501, length 172
21:41:20.552727 IP lamp-ubuntu-s-1vcpu-1gb-tor1-01.ssh > 38.113.181.243.53135: Flags [P.], seq 44216:44508, ack 1, win 501, length 292
21:41:20.552766 IP lamp-ubuntu-s-1vcpu-1gb-tor1-01.ssh > 38.113.181.243.53135: Flags [P.], seq 44508:44680, ack 1, win 501, length 172
21:41:20.552802 IP lamp-ubuntu-s-1vcpu-1gb-tor1-01.ssh > 38.113.181.243.53135: Flags [P.], seq 44680:44852, ack 1, win 501, length 172
21:41:20.552899 IP 38.113.181.243.53135 > lamp-ubuntu-s-1vcpu-1gb-tor1-01.ssh: Flags [.], ack 24864, win 8246, length 0
21:41:20.552920 IP lamp-ubuntu-s-1vcpu-1gb-tor1-01.ssh > 38.113.181.243.53135: Flags [P.], seq 44852:45024, ack 1, win 501, length 172
21:41:20.552983 IP lamp-ubuntu-s-1vcpu-1gb-tor1-01.ssh > 38.113.181.243.53135: Flags [P.], seq 45024:45316, ack 1, win 501, length 292
21:41:20.553025 IP lamp-ubuntu-s-1vcpu-1gb-tor1-01.ssh > 38.113.181.243.53135: Flags [P.], seq 45316:45488, ack 1, win 501, length 172
21:41:20.553065 IP lamp-ubuntu-s-1vcpu-1gb-tor1-01.ssh > 38.113.181.243.53135: Flags [P.], seq 45488:45660, ack 1, win 501, length 172
21:41:20.553103 IP lamp-ubuntu-s-1vcpu-1gb-tor1-01.ssh > 38.113.181.243.53135: Flags [P.], seq 45660:45832, ack 1, win 501, length 172
21:41:20.553140 IP lamp-ubuntu-s-1vcpu-1gb-tor1-01.ssh > 38.113.181.243.53135: Flags [P.], seq 45832:46004, ack 1, win 501, length 172
21:41:20.553177 IP lamp-ubuntu-s-1vcpu-1gb-tor1-01.ssh > 38.113.181.243.53135: Flags [P.], seq 46004:46176, ack 1, win 501, length 172
21:41:20.553214 IP lamp-ubuntu-s-1vcpu-1gb-tor1-01.ssh > 38.113.181.243.53135: Flags [P.], seq 46176:46348, ack 1, win 501, length 172
21:41:20.553264 IP lamp-ubuntu-s-1vcpu-1gb-tor1-01.ssh > 38.113.181.243.53135: Flags [P.], seq 46348:46520, ack 1, win 501, length 172
21:41:20.553304 IP lamp-ubuntu-s-1vcpu-1gb-tor1-01.ssh > 38.113.181.243.53135: Flags [P.], seq 46520:46692, ack 1, win 501, length 172
21:41:20.553341 IP lamp-ubuntu-s-1vcpu-1gb-tor1-01.ssh > 38.113.181.243.53135: Flags [P.], seq 46692:46864, ack 1, win 501, length 172
21:41:20.553378 IP lamp-ubuntu-s-1vcpu-1gb-tor1-01.ssh > 38.113.181.243.53135: Flags [P.], seq 46864:47036, ack 1, win 501, length 172
21:41:20.553415 IP lamp-ubuntu-s-1vcpu-1gb-tor1-01.ssh > 38.113.181.243.53135: Flags [P.], seq 47036:47208, ack 1, win 501, length 172
21:41:20.553455 IP lamp-ubuntu-s-1vcpu-1gb-tor1-01.ssh > 38.113.181.243.53135: Flags [P.], seq 47208:47380, ack 1, win 501, length 172
21:41:20.553492 IP lamp-ubuntu-s-1vcpu-1gb-tor1-01.ssh > 38.113.181.243.53135: Flags [P.], seq 47380:47552, ack 1, win 501, length 172
21:41:20.553506 IP 38.113.181.243.53135 > lamp-ubuntu-s-1vcpu-1gb-tor1-01.ssh: Flags [P.], seq 1:37, ack 24864, win 8246, length 36
21:41:20.553574 IP lamp-ubuntu-s-1vcpu-1gb-tor1-01.ssh > 38.113.181.243.53135: Flags [P.], seq 47552:47860, ack 37, win 501, length 308
21:41:20.553632 IP lamp-ubuntu-s-1vcpu-1gb-tor1-01.ssh > 38.113.181.243.53135: Flags [P.], seq 47860:48032, ack 37, win 501, length 172
21:41:20.553690 IP lamp-ubuntu-s-1vcpu-1gb-tor1-01.ssh > 38.113.181.243.53135: Flags [P.], seq 48032:48204, ack 37, win 501, length 172
21:41:20.553748 IP lamp-ubuntu-s-1vcpu-1gb-tor1-01.ssh > 38.113.181.243.53135: Flags [P.], seq 48204:48376, ack 37, win 501, length 172
21:41:20.553804 IP lamp-ubuntu-s-1vcpu-1gb-tor1-01.ssh > 38.113.181.243.53135: Flags [P.], seq 48376:48548, ack 37, win 501, length 172
21:41:20.553859 IP lamp-ubuntu-s-1vcpu-1gb-tor1-01.ssh > 38.113.181.243.53135: Flags [P.], seq 48548:48720, ack 37, win 501, length 172
21:41:20.553913 IP lamp-ubuntu-s-1vcpu-1gb-tor1-01.ssh > 38.113.181.243.53135: Flags [P.], seq 48720:48892, ack 37, win 501, length 172
21:41:20.553970 IP lamp-ubuntu-s-1vcpu-1gb-tor1-01.ssh > 38.113.181.243.53135: Flags [P.], seq 48892:49064, ack 37, win 501, length 172
21:41:20.554015 IP lamp-ubuntu-s-1vcpu-1gb-tor1-01.ssh > 38.113.181.243.53135: Flags [P.], seq 49064:49236, ack 37, win 501, length 172
21:41:20.554067 IP lamp-ubuntu-s-1vcpu-1gb-tor1-01.ssh > 38.113.181.243.53135: Flags [P.], seq 49236:49408, ack 37, win 501, length 172
21:41:20.554110 IP 38.113.181.243.53135 > lamp-ubuntu-s-1vcpu-1gb-tor1-01.ssh: Flags [.], ack 28840, win 8246, length 0
21:41:20.554148 IP lamp-ubuntu-s-1vcpu-1gb-tor1-01.ssh > 38.113.181.243.53135: Flags [P.], seq 49408:49580, ack 37, win 501, length 172
21:41:20.554275 IP lamp-ubuntu-s-1vcpu-1gb-tor1-01.ssh > 38.113.181.243.53135: Flags [P.], seq 49580:49736, ack 37, win 501, length 156
21:41:20.554294 IP lamp-ubuntu-s-1vcpu-1gb-tor1-01.ssh > 38.113.181.243.53135: Flags [P.], seq 49736:49908, ack 37, win 501, length 172
21:41:20.554346 IP lamp-ubuntu-s-1vcpu-1gb-tor1-01.ssh > 38.113.181.243.53135: Flags [P.], seq 49908:50216, ack 37, win 501, length 308
21:41:20.554358 IP 38.113.181.243.53135 > lamp-ubuntu-s-1vcpu-1gb-tor1-01.ssh: Flags [.], ack 30044, win 8242, length 0
21:41:20.554406 IP lamp-ubuntu-s-1vcpu-1gb-tor1-01.ssh > 38.113.181.243.53135: Flags [P.], seq 50216:50508, ack 37, win 501, length 292
21:41:20.554446 IP lamp-ubuntu-s-1vcpu-1gb-tor1-01.ssh > 38.113.181.243.53135: Flags [P.], seq 50508:50680, ack 37, win 501, length 172
21:41:20.554484 IP lamp-ubuntu-s-1vcpu-1gb-tor1-01.ssh > 38.113.181.243.53135: Flags [P.], seq 50680:50852, ack 37, win 501, length 172
21:41:20.554520 IP lamp-ubuntu-s-1vcpu-1gb-tor1-01.ssh > 38.113.181.243.53135: Flags [P.], seq 50852:51024, ack 37, win 501, length 172
21:41:20.554556 IP lamp-ubuntu-s-1vcpu-1gb-tor1-01.ssh > 38.113.181.243.53135: Flags [P.], seq 51024:51196, ack 37, win 501, length 172
21:41:20.554606 IP lamp-ubuntu-s-1vcpu-1gb-tor1-01.ssh > 38.113.181.243.53135: Flags [P.], seq 51196:51368, ack 37, win 501, length 172
21:41:20.554643 IP lamp-ubuntu-s-1vcpu-1gb-tor1-01.ssh > 38.113.181.243.53135: Flags [P.], seq 51368:51540, ack 37, win 501, length 172
21:41:20.554679 IP lamp-ubuntu-s-1vcpu-1gb-tor1-01.ssh > 38.113.181.243.53135: Flags [P.], seq 51540:51712, ack 37, win 501, length 172
21:41:20.554716 IP lamp-ubuntu-s-1vcpu-1gb-tor1-01.ssh > 38.113.181.243.53135: Flags [P.], seq 51712:51884, ack 37, win 501, length 172
21:41:20.554753 IP lamp-ubuntu-s-1vcpu-1gb-tor1-01.ssh > 38.113.181.243.53135: Flags [P.], seq 51884:52056, ack 37, win 501, length 172
21:41:20.554790 IP lamp-ubuntu-s-1vcpu-1gb-tor1-01.ssh > 38.113.181.243.53135: Flags [P.], seq 52056:52228, ack 37, win 501, length 172
21:41:20.554827 IP lamp-ubuntu-s-1vcpu-1gb-tor1-01.ssh > 38.113.181.243.53135: Flags [P.], seq 52228:52400, ack 37, win 501, length 172
21:41:20.554863 IP lamp-ubuntu-s-1vcpu-1gb-tor1-01.ssh > 38.113.181.243.53135: Flags [P.], seq 52400:52572, ack 37, win 501, length 172
21:41:20.554899 IP lamp-ubuntu-s-1vcpu-1gb-tor1-01.ssh > 38.113.181.243.53135: Flags [P.], seq 52572:52744, ack 37, win 501, length 172
21:41:20.554936 IP lamp-ubuntu-s-1vcpu-1gb-tor1-01.ssh > 38.113.181.243.53135: Flags [P.], seq 52744:52916, ack 37, win 501, length 172
21:41:20.554972 IP lamp-ubuntu-s-1vcpu-1gb-tor1-01.ssh > 38.113.181.243.53135: Flags [P.], seq 52916:53088, ack 37, win 501, length 172
21:41:20.555009 IP lamp-ubuntu-s-1vcpu-1gb-tor1-01.ssh > 38.113.181.243.53135: Flags [P.], seq 53088:53260, ack 37, win 501, length 172
21:41:20.555113 IP lamp-ubuntu-s-1vcpu-1gb-tor1-01.ssh > 38.113.181.243.53135: Flags [P.], seq 53260:53432, ack 37, win 501, length 172
21:41:20.555154 IP lamp-ubuntu-s-1vcpu-1gb-tor1-01.ssh > 38.113.181.243.53135: Flags [P.], seq 53432:53604, ack 37, win 501, length 172
21:41:20.555192 IP lamp-ubuntu-s-1vcpu-1gb-tor1-01.ssh > 38.113.181.243.53135: Flags [P.], seq 53604:53776, ack 37, win 501, length 172
21:41:20.555229 IP lamp-ubuntu-s-1vcpu-1gb-tor1-01.ssh > 38.113.181.243.53135: Flags [P.], seq 53776:53948, ack 37, win 501, length 172
21:41:20.555269 IP lamp-ubuntu-s-1vcpu-1gb-tor1-01.ssh > 38.113.181.243.53135: Flags [P.], seq 53948:54120, ack 37, win 501, length 172
21:41:20.555330 IP lamp-ubuntu-s-1vcpu-1gb-tor1-01.ssh > 38.113.181.243.53135: Flags [P.], seq 54120:54292, ack 37, win 501, length 172
21:41:20.555373 IP lamp-ubuntu-s-1vcpu-1gb-tor1-01.ssh > 38.113.181.243.53135: Flags [P.], seq 54292:54464, ack 37, win 501, length 172
21:41:20.575226 IP 38.113.181.243.53135 > lamp-ubuntu-s-1vcpu-1gb-tor1-01.ssh: Flags [.], ack 32400, win 8246, length 0
21:41:20.575290 IP lamp-ubuntu-s-1vcpu-1gb-tor1-01.ssh > 38.113.181.243.53135: Flags [P.], seq 54464:54636, ack 37, win 501, length 172
21:41:20.575475 IP lamp-ubuntu-s-1vcpu-1gb-tor1-01.ssh > 38.113.181.243.53135: Flags [P.], seq 54636:54928, ack 37, win 501, length 292
21:41:20.575553 IP lamp-ubuntu-s-1vcpu-1gb-tor1-01.ssh > 38.113.181.243.53135: Flags [P.], seq 54928:55100, ack 37, win 501, length 172
21:41:20.575594 IP lamp-ubuntu-s-1vcpu-1gb-tor1-01.ssh > 38.113.181.243.53135: Flags [P.], seq 55100:55272, ack 37, win 501, length 172
21:41:20.575633 IP lamp-ubuntu-s-1vcpu-1gb-tor1-01.ssh > 38.113.181.243.53135: Flags [P.], seq 55272:55444, ack 37, win 501, length 172
21:41:20.575672 IP lamp-ubuntu-s-1vcpu-1gb-tor1-01.ssh > 38.113.181.243.53135: Flags [P.], seq 55444:55616, ack 37, win 501, length 172
21:41:20.575710 IP lamp-ubuntu-s-1vcpu-1gb-tor1-01.ssh > 38.113.181.243.53135: Flags [P.], seq 55616:55788, ack 37, win 501, length 172
21:41:20.575748 IP lamp-ubuntu-s-1vcpu-1gb-tor1-01.ssh > 38.113.181.243.53135: Flags [P.], seq 55788:55960, ack 37, win 501, length 172
21:41:20.575786 IP lamp-ubuntu-s-1vcpu-1gb-tor1-01.ssh > 38.113.181.243.53135: Flags [P.], seq 55960:56132, ack 37, win 501, length 172
21:41:20.575822 IP lamp-ubuntu-s-1vcpu-1gb-tor1-01.ssh > 38.113.181.243.53135: Flags [P.], seq 56132:56304, ack 37, win 501, length 172
21:41:20.575859 IP lamp-ubuntu-s-1vcpu-1gb-tor1-01.ssh > 38.113.181.243.53135: Flags [P.], seq 56304:56476, ack 37, win 501, length 172
21:41:20.575905 IP lamp-ubuntu-s-1vcpu-1gb-tor1-01.ssh > 38.113.181.243.53135: Flags [P.], seq 56476:56648, ack 37, win 501, length 172
21:41:20.575958 IP lamp-ubuntu-s-1vcpu-1gb-tor1-01.ssh > 38.113.181.243.53135: Flags [P.], seq 56648:56820, ack 37, win 501, length 172
21:41:20.576429 IP 38.113.181.243.53135 > lamp-ubuntu-s-1vcpu-1gb-tor1-01.ssh: Flags [.], ack 34240, win 8246, length 0
21:41:20.576452 IP lamp-ubuntu-s-1vcpu-1gb-tor1-01.ssh > 38.113.181.243.53135: Flags [P.], seq 56820:56992, ack 37, win 501, length 172
21:41:20.576523 IP lamp-ubuntu-s-1vcpu-1gb-tor1-01.ssh > 38.113.181.243.53135: Flags [P.], seq 56992:57284, ack 37, win 501, length 292
21:41:20.576580 IP lamp-ubuntu-s-1vcpu-1gb-tor1-01.ssh > 38.113.181.243.53135: Flags [P.], seq 57284:57456, ack 37, win 501, length 172
21:41:20.576621 IP lamp-ubuntu-s-1vcpu-1gb-tor1-01.ssh > 38.113.181.243.53135: Flags [P.], seq 57456:57628, ack 37, win 501, length 172
21:41:20.576658 IP lamp-ubuntu-s-1vcpu-1gb-tor1-01.ssh > 38.113.181.243.53135: Flags [P.], seq 57628:57800, ack 37, win 501, length 172
21:41:20.576695 IP lamp-ubuntu-s-1vcpu-1gb-tor1-01.ssh > 38.113.181.243.53135: Flags [P.], seq 57800:57972, ack 37, win 501, length 172
21:41:20.576731 IP lamp-ubuntu-s-1vcpu-1gb-tor1-01.ssh > 38.113.181.243.53135: Flags [P.], seq 57972:58144, ack 37, win 501, length 172
21:41:20.576768 IP lamp-ubuntu-s-1vcpu-1gb-tor1-01.ssh > 38.113.181.243.53135: Flags [P.], seq 58144:58316, ack 37, win 501, length 172
21:41:20.576828 IP lamp-ubuntu-s-1vcpu-1gb-tor1-01.ssh > 38.113.181.243.53135: Flags [P.], seq 58316:58488, ack 37, win 501, length 172
21:41:20.576885 IP lamp-ubuntu-s-1vcpu-1gb-tor1-01.ssh > 38.113.181.243.53135: Flags [P.], seq 58488:58660, ack 37, win 501, length 172
21:41:20.576934 IP lamp-ubuntu-s-1vcpu-1gb-tor1-01.ssh > 38.113.181.243.53135: Flags [P.], seq 58660:58832, ack 37, win 501, length 172
21:41:20.577287 IP 38.113.181.243.53135 > lamp-ubuntu-s-1vcpu-1gb-tor1-01.ssh: Flags [.], ack 34928, win 8244, length 0
21:41:20.577305 IP lamp-ubuntu-s-1vcpu-1gb-tor1-01.ssh > 38.113.181.243.53135: Flags [P.], seq 58832:59004, ack 37, win 501, length 172
21:41:20.577380 IP lamp-ubuntu-s-1vcpu-1gb-tor1-01.ssh > 38.113.181.243.53135: Flags [P.], seq 59004:59296, ack 37, win 501, length 292
21:41:20.577420 IP lamp-ubuntu-s-1vcpu-1gb-tor1-01.ssh > 38.113.181.243.53135: Flags [P.], seq 59296:59468, ack 37, win 501, length 172
21:41:20.577465 IP lamp-ubuntu-s-1vcpu-1gb-tor1-01.ssh > 38.113.181.243.53135: Flags [P.], seq 59468:59640, ack 37, win 501, length 172
21:41:20.578468 IP 38.113.181.243.53135 > lamp-ubuntu-s-1vcpu-1gb-tor1-01.ssh: Flags [.], ack 41636, win 8246, length 0
21:41:20.578510 IP lamp-ubuntu-s-1vcpu-1gb-tor1-01.ssh > 38.113.181.243.53135: Flags [P.], seq 59640:59812, ack 37, win 501, length 172
21:41:20.578614 IP lamp-ubuntu-s-1vcpu-1gb-tor1-01.ssh > 38.113.181.243.53135: Flags [P.], seq 59812:60104, ack 37, win 501, length 292
21:41:20.578656 IP lamp-ubuntu-s-1vcpu-1gb-tor1-01.ssh > 38.113.181.243.53135: Flags [P.], seq 60104:60276, ack 37, win 501, length 172
21:41:20.578704 IP lamp-ubuntu-s-1vcpu-1gb-tor1-01.ssh > 38.113.181.243.53135: Flags [P.], seq 60276:60448, ack 37, win 501, length 172
21:41:20.578748 IP lamp-ubuntu-s-1vcpu-1gb-tor1-01.ssh > 38.113.181.243.53135: Flags [P.], seq 60448:60620, ack 37, win 501, length 172
21:41:20.578763 IP 38.113.181.243.53135 > lamp-ubuntu-s-1vcpu-1gb-tor1-01.ssh: Flags [.], ack 44044, win 8246, length 0
21:41:20.578814 IP lamp-ubuntu-s-1vcpu-1gb-tor1-01.ssh > 38.113.181.243.53135: Flags [P.], seq 60620:60912, ack 37, win 501, length 292
21:41:20.578855 IP lamp-ubuntu-s-1vcpu-1gb-tor1-01.ssh > 38.113.181.243.53135: Flags [P.], seq 60912:61084, ack 37, win 501, length 172
21:41:20.578893 IP lamp-ubuntu-s-1vcpu-1gb-tor1-01.ssh > 38.113.181.243.53135: Flags [P.], seq 61084:61256, ack 37, win 501, length 172
21:41:20.578957 IP lamp-ubuntu-s-1vcpu-1gb-tor1-01.ssh > 38.113.181.243.53135: Flags [P.], seq 61256:61428, ack 37, win 501, length 172
21:41:20.579016 IP lamp-ubuntu-s-1vcpu-1gb-tor1-01.ssh > 38.113.181.243.53135: Flags [P.], seq 61428:61600, ack 37, win 501, length 172
21:41:20.579070 IP lamp-ubuntu-s-1vcpu-1gb-tor1-01.ssh > 38.113.181.243.53135: Flags [P.], seq 61600:61772, ack 37, win 501, length 172
21:41:20.579123 IP lamp-ubuntu-s-1vcpu-1gb-tor1-01.ssh > 38.113.181.243.53135: Flags [P.], seq 61772:61944, ack 37, win 501, length 172
21:41:20.579173 IP lamp-ubuntu-s-1vcpu-1gb-tor1-01.ssh > 38.113.181.243.53135: Flags [P.], seq 61944:62116, ack 37, win 501, length 172
21:41:20.579219 IP lamp-ubuntu-s-1vcpu-1gb-tor1-01.ssh > 38.113.181.243.53135: Flags [P.], seq 62116:62288, ack 37, win 501, length 172
21:41:20.579258 IP lamp-ubuntu-s-1vcpu-1gb-tor1-01.ssh > 38.113.181.243.53135: Flags [P.], seq 62288:62460, ack 37, win 501, length 172
21:41:20.579294 IP lamp-ubuntu-s-1vcpu-1gb-tor1-01.ssh > 38.113.181.243.53135: Flags [P.], seq 62460:62632, ack 37, win 501, length 172
21:41:20.579338 IP lamp-ubuntu-s-1vcpu-1gb-tor1-01.ssh > 38.113.181.243.53135: Flags [P.], seq 62632:62804, ack 37, win 501, length 172
21:41:20.579377 IP lamp-ubuntu-s-1vcpu-1gb-tor1-01.ssh > 38.113.181.243.53135: Flags [P.], seq 62804:62976, ack 37, win 501, length 172
21:41:20.579424 IP lamp-ubuntu-s-1vcpu-1gb-tor1-01.ssh > 38.113.181.243.53135: Flags [P.], seq 62976:63148, ack 37, win 501, length 172
21:41:20.579502 IP lamp-ubuntu-s-1vcpu-1gb-tor1-01.ssh > 38.113.181.243.53135: Flags [P.], seq 63148:63320, ack 37, win 501, length 172
21:41:20.579557 IP lamp-ubuntu-s-1vcpu-1gb-tor1-01.ssh > 38.113.181.243.53135: Flags [P.], seq 63320:63492, ack 37, win 501, length 172
21:41:20.579601 IP lamp-ubuntu-s-1vcpu-1gb-tor1-01.ssh > 38.113.181.243.53135: Flags [P.], seq 63492:63664, ack 37, win 501, length 172
21:41:20.579640 IP lamp-ubuntu-s-1vcpu-1gb-tor1-01.ssh > 38.113.181.243.53135: Flags [P.], seq 63664:63836, ack 37, win 501, length 172
21:41:20.579677 IP lamp-ubuntu-s-1vcpu-1gb-tor1-01.ssh > 38.113.181.243.53135: Flags [P.], seq 63836:64008, ack 37, win 501, length 172
21:41:20.579712 IP lamp-ubuntu-s-1vcpu-1gb-tor1-01.ssh > 38.113.181.243.53135: Flags [P.], seq 64008:64180, ack 37, win 501, length 172
21:41:20.579748 IP lamp-ubuntu-s-1vcpu-1gb-tor1-01.ssh > 38.113.181.243.53135: Flags [P.], seq 64180:64352, ack 37, win 501, length 172
21:41:20.579786 IP lamp-ubuntu-s-1vcpu-1gb-tor1-01.ssh > 38.113.181.243.53135: Flags [P.], seq 64352:64524, ack 37, win 501, length 172
21:41:20.579824 IP lamp-ubuntu-s-1vcpu-1gb-tor1-01.ssh > 38.113.181.243.53135: Flags [P.], seq 64524:64696, ack 37, win 501, length 172
21:41:20.579860 IP lamp-ubuntu-s-1vcpu-1gb-tor1-01.ssh > 38.113.181.243.53135: Flags [P.], seq 64696:64868, ack 37, win 501, length 172
21:41:20.579897 IP lamp-ubuntu-s-1vcpu-1gb-tor1-01.ssh > 38.113.181.243.53135: Flags [P.], seq 64868:65040, ack 37, win 501, length 172
21:41:20.579934 IP lamp-ubuntu-s-1vcpu-1gb-tor1-01.ssh > 38.113.181.243.53135: Flags [P.], seq 65040:65212, ack 37, win 501, length 172
21:41:20.579969 IP lamp-ubuntu-s-1vcpu-1gb-tor1-01.ssh > 38.113.181.243.53135: Flags [P.], seq 65212:65384, ack 37, win 501, length 172
21:41:20.580015 IP lamp-ubuntu-s-1vcpu-1gb-tor1-01.ssh > 38.113.181.243.53135: Flags [P.], seq 65384:65556, ack 37, win 501, length 172
21:41:20.580055 IP 38.113.181.243.53135 > lamp-ubuntu-s-1vcpu-1gb-tor1-01.ssh: Flags [.], ack 47380, win 8246, length 0
21:41:20.580087 IP lamp-ubuntu-s-1vcpu-1gb-tor1-01.ssh > 38.113.181.243.53135: Flags [P.], seq 65556:65728, ack 37, win 501, length 172
21:41:20.580157 IP lamp-ubuntu-s-1vcpu-1gb-tor1-01.ssh > 38.113.181.243.53135: Flags [P.], seq 65728:66020, ack 37, win 501, length 292
21:41:20.580223 IP lamp-ubuntu-s-1vcpu-1gb-tor1-01.ssh > 38.113.181.243.53135: Flags [P.], seq 66020:66192, ack 37, win 501, length 172
21:41:20.580297 IP lamp-ubuntu-s-1vcpu-1gb-tor1-01.ssh > 38.113.181.243.53135: Flags [P.], seq 66192:66364, ack 37, win 501, length 172
21:41:20.580361 IP lamp-ubuntu-s-1vcpu-1gb-tor1-01.ssh > 38.113.181.243.53135: Flags [P.], seq 66364:66536, ack 37, win 501, length 172
21:41:20.580412 IP lamp-ubuntu-s-1vcpu-1gb-tor1-01.ssh > 38.113.181.243.53135: Flags [P.], seq 66536:66708, ack 37, win 501, length 172
21:41:20.580465 IP lamp-ubuntu-s-1vcpu-1gb-tor1-01.ssh > 38.113.181.243.53135: Flags [P.], seq 66708:66880, ack 37, win 501, length 172
21:41:20.580515 IP lamp-ubuntu-s-1vcpu-1gb-tor1-01.ssh > 38.113.181.243.53135: Flags [P.], seq 66880:67052, ack 37, win 501, length 172
21:41:20.580568 IP lamp-ubuntu-s-1vcpu-1gb-tor1-01.ssh > 38.113.181.243.53135: Flags [P.], seq 67052:67224, ack 37, win 501, length 172
21:41:20.580619 IP lamp-ubuntu-s-1vcpu-1gb-tor1-01.ssh > 38.113.181.243.53135: Flags [P.], seq 67224:67396, ack 37, win 501, length 172
21:41:20.580674 IP lamp-ubuntu-s-1vcpu-1gb-tor1-01.ssh > 38.113.181.243.53135: Flags [P.], seq 67396:67568, ack 37, win 501, length 172
21:41:20.580729 IP lamp-ubuntu-s-1vcpu-1gb-tor1-01.ssh > 38.113.181.243.53135: Flags [P.], seq 67568:67740, ack 37, win 501, length 172
21:41:20.580779 IP lamp-ubuntu-s-1vcpu-1gb-tor1-01.ssh > 38.113.181.243.53135: Flags [P.], seq 67740:67912, ack 37, win 501, length 172
21:41:20.580796 IP 38.113.181.243.53135 > lamp-ubuntu-s-1vcpu-1gb-tor1-01.ssh: Flags [.], ack 48892, win 8246, length 0
21:41:20.580869 IP lamp-ubuntu-s-1vcpu-1gb-tor1-01.ssh > 38.113.181.243.53135: Flags [P.], seq 67912:68204, ack 37, win 501, length 292
21:41:20.580925 IP lamp-ubuntu-s-1vcpu-1gb-tor1-01.ssh > 38.113.181.243.53135: Flags [P.], seq 68204:68376, ack 37, win 501, length 172
21:41:20.580975 IP lamp-ubuntu-s-1vcpu-1gb-tor1-01.ssh > 38.113.181.243.53135: Flags [P.], seq 68376:68548, ack 37, win 501, length 172
21:41:20.581026 IP lamp-ubuntu-s-1vcpu-1gb-tor1-01.ssh > 38.113.181.243.53135: Flags [P.], seq 68548:68720, ack 37, win 501, length 172
21:41:20.581075 IP lamp-ubuntu-s-1vcpu-1gb-tor1-01.ssh > 38.113.181.243.53135: Flags [P.], seq 68720:68892, ack 37, win 501, length 172
21:41:20.581126 IP lamp-ubuntu-s-1vcpu-1gb-tor1-01.ssh > 38.113.181.243.53135: Flags [P.], seq 68892:69064, ack 37, win 501, length 172
21:41:20.581180 IP lamp-ubuntu-s-1vcpu-1gb-tor1-01.ssh > 38.113.181.243.53135: Flags [P.], seq 69064:69236, ack 37, win 501, length 172
21:41:20.581231 IP lamp-ubuntu-s-1vcpu-1gb-tor1-01.ssh > 38.113.181.243.53135: Flags [P.], seq 69236:69408, ack 37, win 501, length 172
21:41:20.581282 IP lamp-ubuntu-s-1vcpu-1gb-tor1-01.ssh > 38.113.181.243.53135: Flags [P.], seq 69408:69580, ack 37, win 501, length 172
21:41:20.581332 IP lamp-ubuntu-s-1vcpu-1gb-tor1-01.ssh > 38.113.181.243.53135: Flags [P.], seq 69580:69752, ack 37, win 501, length 172
21:41:20.581383 IP lamp-ubuntu-s-1vcpu-1gb-tor1-01.ssh > 38.113.181.243.53135: Flags [P.], seq 69752:69924, ack 37, win 501, length 172
21:41:20.581435 IP lamp-ubuntu-s-1vcpu-1gb-tor1-01.ssh > 38.113.181.243.53135: Flags [P.], seq 69924:70096, ack 37, win 501, length 172
21:41:20.581487 IP lamp-ubuntu-s-1vcpu-1gb-tor1-01.ssh > 38.113.181.243.53135: Flags [P.], seq 70096:70268, ack 37, win 501, length 172
21:41:20.581537 IP lamp-ubuntu-s-1vcpu-1gb-tor1-01.ssh > 38.113.181.243.53135: Flags [P.], seq 70268:70440, ack 37, win 501, length 172
21:41:20.581587 IP lamp-ubuntu-s-1vcpu-1gb-tor1-01.ssh > 38.113.181.243.53135: Flags [P.], seq 70440:70612, ack 37, win 501, length 172
21:41:20.581638 IP lamp-ubuntu-s-1vcpu-1gb-tor1-01.ssh > 38.113.181.243.53135: Flags [P.], seq 70612:70784, ack 37, win 501, length 172
21:41:20.581686 IP lamp-ubuntu-s-1vcpu-1gb-tor1-01.ssh > 38.113.181.243.53135: Flags [P.], seq 70784:70956, ack 37, win 501, length 172
21:41:20.581738 IP lamp-ubuntu-s-1vcpu-1gb-tor1-01.ssh > 38.113.181.243.53135: Flags [P.], seq 70956:71128, ack 37, win 501, length 172
21:41:20.581776 IP 38.113.181.243.53135 > lamp-ubuntu-s-1vcpu-1gb-tor1-01.ssh: Flags [.], ack 54120, win 8246, length 0
21:41:20.581847 IP lamp-ubuntu-s-1vcpu-1gb-tor1-01.ssh > 38.113.181.243.53135: Flags [P.], seq 71128:71420, ack 37, win 501, length 292
21:41:20.581912 IP lamp-ubuntu-s-1vcpu-1gb-tor1-01.ssh > 38.113.181.243.53135: Flags [P.], seq 71420:71592, ack 37, win 501, length 172
21:41:20.581968 IP lamp-ubuntu-s-1vcpu-1gb-tor1-01.ssh > 38.113.181.243.53135: Flags [P.], seq 71592:71764, ack 37, win 501, length 172
21:41:20.582020 IP lamp-ubuntu-s-1vcpu-1gb-tor1-01.ssh > 38.113.181.243.53135: Flags [P.], seq 71764:71936, ack 37, win 501, length 172
21:41:20.582072 IP lamp-ubuntu-s-1vcpu-1gb-tor1-01.ssh > 38.113.181.243.53135: Flags [P.], seq 71936:72108, ack 37, win 501, length 172
21:41:20.582123 IP lamp-ubuntu-s-1vcpu-1gb-tor1-01.ssh > 38.113.181.243.53135: Flags [P.], seq 72108:72280, ack 37, win 501, length 172
21:41:20.582221 IP lamp-ubuntu-s-1vcpu-1gb-tor1-01.ssh > 38.113.181.243.53135: Flags [P.], seq 72280:72452, ack 37, win 501, length 172
21:41:20.582290 IP lamp-ubuntu-s-1vcpu-1gb-tor1-01.ssh > 38.113.181.243.53135: Flags [P.], seq 72452:72624, ack 37, win 501, length 172
21:41:20.582344 IP lamp-ubuntu-s-1vcpu-1gb-tor1-01.ssh > 38.113.181.243.53135: Flags [P.], seq 72624:72796, ack 37, win 501, length 172
21:41:20.582395 IP lamp-ubuntu-s-1vcpu-1gb-tor1-01.ssh > 38.113.181.243.53135: Flags [P.], seq 72796:72968, ack 37, win 501, length 172
21:41:20.582445 IP lamp-ubuntu-s-1vcpu-1gb-tor1-01.ssh > 38.113.181.243.53135: Flags [P.], seq 72968:73140, ack 37, win 501, length 172
21:41:20.582504 IP lamp-ubuntu-s-1vcpu-1gb-tor1-01.ssh > 38.113.181.243.53135: Flags [P.], seq 73140:73312, ack 37, win 501, length 172
21:41:20.582558 IP lamp-ubuntu-s-1vcpu-1gb-tor1-01.ssh > 38.113.181.243.53135: Flags [P.], seq 73312:73484, ack 37, win 501, length 172
21:41:20.582625 IP lamp-ubuntu-s-1vcpu-1gb-tor1-01.ssh > 38.113.181.243.53135: Flags [P.], seq 73484:73656, ack 37, win 501, length 172
21:41:20.582676 IP lamp-ubuntu-s-1vcpu-1gb-tor1-01.ssh > 38.113.181.243.53135: Flags [P.], seq 73656:73828, ack 37, win 501, length 172
21:41:20.582727 IP lamp-ubuntu-s-1vcpu-1gb-tor1-01.ssh > 38.113.181.243.53135: Flags [P.], seq 73828:74000, ack 37, win 501, length 172
21:41:20.582785 IP lamp-ubuntu-s-1vcpu-1gb-tor1-01.ssh > 38.113.181.243.53135: Flags [P.], seq 74000:74172, ack 37, win 501, length 172
21:41:20.582842 IP lamp-ubuntu-s-1vcpu-1gb-tor1-01.ssh > 38.113.181.243.53135: Flags [P.], seq 74172:74344, ack 37, win 501, length 172
21:41:20.582897 IP lamp-ubuntu-s-1vcpu-1gb-tor1-01.ssh > 38.113.181.243.53135: Flags [P.], seq 74344:74516, ack 37, win 501, length 172
21:41:20.582955 IP lamp-ubuntu-s-1vcpu-1gb-tor1-01.ssh > 38.113.181.243.53135: Flags [P.], seq 74516:74688, ack 37, win 501, length 172
21:41:20.583009 IP lamp-ubuntu-s-1vcpu-1gb-tor1-01.ssh > 38.113.181.243.53135: Flags [P.], seq 74688:74860, ack 37, win 501, length 172
21:41:20.583065 IP lamp-ubuntu-s-1vcpu-1gb-tor1-01.ssh > 38.113.181.243.53135: Flags [P.], seq 74860:75032, ack 37, win 501, length 172
21:41:20.583126 IP lamp-ubuntu-s-1vcpu-1gb-tor1-01.ssh > 38.113.181.243.53135: Flags [P.], seq 75032:75204, ack 37, win 501, length 172
21:41:20.583154 IP 38.113.181.243.53135 > lamp-ubuntu-s-1vcpu-1gb-tor1-01.ssh: Flags [.], ack 54464, win 8245, length 0
21:41:20.583220 IP lamp-ubuntu-s-1vcpu-1gb-tor1-01.ssh > 38.113.181.243.53135: Flags [P.], seq 75204:75496, ack 37, win 501, length 292
21:41:20.583275 IP lamp-ubuntu-s-1vcpu-1gb-tor1-01.ssh > 38.113.181.243.53135: Flags [P.], seq 75496:75668, ack 37, win 501, length 172
21:41:20.583325 IP lamp-ubuntu-s-1vcpu-1gb-tor1-01.ssh > 38.113.181.243.53135: Flags [P.], seq 75668:75840, ack 37, win 501, length 172
21:41:20.583375 IP lamp-ubuntu-s-1vcpu-1gb-tor1-01.ssh > 38.113.181.243.53135: Flags [P.], seq 75840:76012, ack 37, win 501, length 172
21:41:20.583427 IP lamp-ubuntu-s-1vcpu-1gb-tor1-01.ssh > 38.113.181.243.53135: Flags [P.], seq 76012:76184, ack 37, win 501, length 172
21:41:20.583498 IP lamp-ubuntu-s-1vcpu-1gb-tor1-01.ssh > 38.113.181.243.53135: Flags [P.], seq 76184:76356, ack 37, win 501, length 172
21:41:20.583559 IP lamp-ubuntu-s-1vcpu-1gb-tor1-01.ssh > 38.113.181.243.53135: Flags [P.], seq 76356:76528, ack 37, win 501, length 172
21:41:20.583614 IP lamp-ubuntu-s-1vcpu-1gb-tor1-01.ssh > 38.113.181.243.53135: Flags [P.], seq 76528:76700, ack 37, win 501, length 172
21:41:20.583664 IP lamp-ubuntu-s-1vcpu-1gb-tor1-01.ssh > 38.113.181.243.53135: Flags [P.], seq 76700:76872, ack 37, win 501, length 172
21:41:20.583717 IP lamp-ubuntu-s-1vcpu-1gb-tor1-01.ssh > 38.113.181.243.53135: Flags [P.], seq 76872:77044, ack 37, win 501, length 172
21:41:20.583774 IP lamp-ubuntu-s-1vcpu-1gb-tor1-01.ssh > 38.113.181.243.53135: Flags [P.], seq 77044:77216, ack 37, win 501, length 172
21:41:20.583828 IP lamp-ubuntu-s-1vcpu-1gb-tor1-01.ssh > 38.113.181.243.53135: Flags [P.], seq 77216:77388, ack 37, win 501, length 172
21:41:20.583882 IP lamp-ubuntu-s-1vcpu-1gb-tor1-01.ssh > 38.113.181.243.53135: Flags [P.], seq 77388:77560, ack 37, win 501, length 172
21:41:20.583934 IP lamp-ubuntu-s-1vcpu-1gb-tor1-01.ssh > 38.113.181.243.53135: Flags [P.], seq 77560:77732, ack 37, win 501, length 172
21:41:20.583989 IP lamp-ubuntu-s-1vcpu-1gb-tor1-01.ssh > 38.113.181.243.53135: Flags [P.], seq 77732:77904, ack 37, win 501, length 172
21:41:20.584041 IP lamp-ubuntu-s-1vcpu-1gb-tor1-01.ssh > 38.113.181.243.53135: Flags [P.], seq 77904:78076, ack 37, win 501, length 172
21:41:20.584093 IP lamp-ubuntu-s-1vcpu-1gb-tor1-01.ssh > 38.113.181.243.53135: Flags [P.], seq 78076:78248, ack 37, win 501, length 172
21:41:20.584143 IP lamp-ubuntu-s-1vcpu-1gb-tor1-01.ssh > 38.113.181.243.53135: Flags [P.], seq 78248:78420, ack 37, win 501, length 172
21:41:20.584195 IP lamp-ubuntu-s-1vcpu-1gb-tor1-01.ssh > 38.113.181.243.53135: Flags [P.], seq 78420:78592, ack 37, win 501, length 172
21:41:20.584245 IP lamp-ubuntu-s-1vcpu-1gb-tor1-01.ssh > 38.113.181.243.53135: Flags [P.], seq 78592:78764, ack 37, win 501, length 172
21:41:20.584295 IP lamp-ubuntu-s-1vcpu-1gb-tor1-01.ssh > 38.113.181.243.53135: Flags [P.], seq 78764:78936, ack 37, win 501, length 172
21:41:20.584349 IP lamp-ubuntu-s-1vcpu-1gb-tor1-01.ssh > 38.113.181.243.53135: Flags [P.], seq 78936:79108, ack 37, win 501, length 172
21:41:20.584406 IP lamp-ubuntu-s-1vcpu-1gb-tor1-01.ssh > 38.113.181.243.53135: Flags [P.], seq 79108:79280, ack 37, win 501, length 172
21:41:20.584457 IP lamp-ubuntu-s-1vcpu-1gb-tor1-01.ssh > 38.113.181.243.53135: Flags [P.], seq 79280:79452, ack 37, win 501, length 172
21:41:20.584511 IP lamp-ubuntu-s-1vcpu-1gb-tor1-01.ssh > 38.113.181.243.53135: Flags [P.], seq 79452:79624, ack 37, win 501, length 172
21:41:20.584565 IP lamp-ubuntu-s-1vcpu-1gb-tor1-01.ssh > 38.113.181.243.53135: Flags [P.], seq 79624:79796, ack 37, win 501, length 172
21:41:20.584620 IP lamp-ubuntu-s-1vcpu-1gb-tor1-01.ssh > 38.113.181.243.53135: Flags [P.], seq 79796:79968, ack 37, win 501, length 172
21:41:20.603417 IP 38.113.181.243.53135 > lamp-ubuntu-s-1vcpu-1gb-tor1-01.ssh: Flags [.], ack 58832, win 8246, length 0
21:41:20.603507 IP lamp-ubuntu-s-1vcpu-1gb-tor1-01.ssh > 38.113.181.243.53135: Flags [P.], seq 79968:80140, ack 37, win 501, length 172
21:41:20.603693 IP lamp-ubuntu-s-1vcpu-1gb-tor1-01.ssh > 38.113.181.243.53135: Flags [P.], seq 80140:80432, ack 37, win 501, length 292
21:41:20.603750 IP lamp-ubuntu-s-1vcpu-1gb-tor1-01.ssh > 38.113.181.243.53135: Flags [P.], seq 80432:80604, ack 37, win 501, length 172
21:41:20.603794 IP lamp-ubuntu-s-1vcpu-1gb-tor1-01.ssh > 38.113.181.243.53135: Flags [P.], seq 80604:80776, ack 37, win 501, length 172
21:41:20.603834 IP lamp-ubuntu-s-1vcpu-1gb-tor1-01.ssh > 38.113.181.243.53135: Flags [P.], seq 80776:80948, ack 37, win 501, length 172
21:41:20.603867 IP 38.113.181.243.53135 > lamp-ubuntu-s-1vcpu-1gb-tor1-01.ssh: Flags [.], ack 59468, win 8244, length 0
21:41:20.603903 IP lamp-ubuntu-s-1vcpu-1gb-tor1-01.ssh > 38.113.181.243.53135: Flags [P.], seq 80948:81240, ack 37, win 501, length 292
21:41:20.603945 IP lamp-ubuntu-s-1vcpu-1gb-tor1-01.ssh > 38.113.181.243.53135: Flags [P.], seq 81240:81412, ack 37, win 501, length 172
21:41:20.603984 IP lamp-ubuntu-s-1vcpu-1gb-tor1-01.ssh > 38.113.181.243.53135: Flags [P.], seq 81412:81584, ack 37, win 501, length 172
21:41:20.604023 IP lamp-ubuntu-s-1vcpu-1gb-tor1-01.ssh > 38.113.181.243.53135: Flags [P.], seq 81584:81756, ack 37, win 501, length 172
21:41:20.604065 IP lamp-ubuntu-s-1vcpu-1gb-tor1-01.ssh > 38.113.181.243.53135: Flags [P.], seq 81756:81928, ack 37, win 501, length 172
21:41:20.604106 IP lamp-ubuntu-s-1vcpu-1gb-tor1-01.ssh > 38.113.181.243.53135: Flags [P.], seq 81928:82100, ack 37, win 501, length 172
21:41:20.604146 IP lamp-ubuntu-s-1vcpu-1gb-tor1-01.ssh > 38.113.181.243.53135: Flags [P.], seq 82100:82272, ack 37, win 501, length 172
21:41:20.604186 IP lamp-ubuntu-s-1vcpu-1gb-tor1-01.ssh > 38.113.181.243.53135: Flags [P.], seq 82272:82444, ack 37, win 501, length 172
21:41:20.604224 IP lamp-ubuntu-s-1vcpu-1gb-tor1-01.ssh > 38.113.181.243.53135: Flags [P.], seq 82444:82616, ack 37, win 501, length 172
21:41:20.604254 IP 38.113.181.243.53135 > lamp-ubuntu-s-1vcpu-1gb-tor1-01.ssh: Flags [.], ack 59640, win 8243, length 0
21:41:20.604285 IP lamp-ubuntu-s-1vcpu-1gb-tor1-01.ssh > 38.113.181.243.53135: Flags [P.], seq 82616:82908, ack 37, win 501, length 292
21:41:20.604323 IP lamp-ubuntu-s-1vcpu-1gb-tor1-01.ssh > 38.113.181.243.53135: Flags [P.], seq 82908:83080, ack 37, win 501, length 172
21:41:20.604362 IP lamp-ubuntu-s-1vcpu-1gb-tor1-01.ssh > 38.113.181.243.53135: Flags [P.], seq 83080:83252, ack 37, win 501, length 172
21:41:20.604401 IP lamp-ubuntu-s-1vcpu-1gb-tor1-01.ssh > 38.113.181.243.53135: Flags [P.], seq 83252:83424, ack 37, win 501, length 172
21:41:20.604438 IP lamp-ubuntu-s-1vcpu-1gb-tor1-01.ssh > 38.113.181.243.53135: Flags [P.], seq 83424:83596, ack 37, win 501, length 172
21:41:20.604474 IP lamp-ubuntu-s-1vcpu-1gb-tor1-01.ssh > 38.113.181.243.53135: Flags [P.], seq 83596:83768, ack 37, win 501, length 172
21:41:20.604513 IP lamp-ubuntu-s-1vcpu-1gb-tor1-01.ssh > 38.113.181.243.53135: Flags [P.], seq 83768:83940, ack 37, win 501, length 172
21:41:20.604549 IP lamp-ubuntu-s-1vcpu-1gb-tor1-01.ssh > 38.113.181.243.53135: Flags [P.], seq 83940:84112, ack 37, win 501, length 172
21:41:20.604597 IP lamp-ubuntu-s-1vcpu-1gb-tor1-01.ssh > 38.113.181.243.53135: Flags [P.], seq 84112:84284, ack 37, win 501, length 172
21:41:20.604636 IP lamp-ubuntu-s-1vcpu-1gb-tor1-01.ssh > 38.113.181.243.53135: Flags [P.], seq 84284:84456, ack 37, win 501, length 172
21:41:20.604682 IP lamp-ubuntu-s-1vcpu-1gb-tor1-01.ssh > 38.113.181.243.53135: Flags [P.], seq 84456:84628, ack 37, win 501, length 172
21:41:20.604719 IP lamp-ubuntu-s-1vcpu-1gb-tor1-01.ssh > 38.113.181.243.53135: Flags [P.], seq 84628:84800, ack 37, win 501, length 172
21:41:20.604757 IP lamp-ubuntu-s-1vcpu-1gb-tor1-01.ssh > 38.113.181.243.53135: Flags [P.], seq 84800:84972, ack 37, win 501, length 172
21:41:20.604794 IP lamp-ubuntu-s-1vcpu-1gb-tor1-01.ssh > 38.113.181.243.53135: Flags [P.], seq 84972:85144, ack 37, win 501, length 172
21:41:20.605102 IP 38.113.181.243.53135 > lamp-ubuntu-s-1vcpu-1gb-tor1-01.ssh: Flags [.], ack 60104, win 8241, length 0
21:41:20.605111 IP lamp-ubuntu-s-1vcpu-1gb-tor1-01.ssh > 38.113.181.243.53135: Flags [P.], seq 85144:85316, ack 37, win 501, length 172
21:41:20.605163 IP lamp-ubuntu-s-1vcpu-1gb-tor1-01.ssh > 38.113.181.243.53135: Flags [P.], seq 85316:85608, ack 37, win 501, length 292
21:41:20.605932 IP 38.113.181.243.53135 > lamp-ubuntu-s-1vcpu-1gb-tor1-01.ssh: Flags [.], ack 61944, win 8246, length 0
21:41:20.605963 IP lamp-ubuntu-s-1vcpu-1gb-tor1-01.ssh > 38.113.181.243.53135: Flags [P.], seq 85608:85780, ack 37, win 501, length 172
21:41:20.606079 IP lamp-ubuntu-s-1vcpu-1gb-tor1-01.ssh > 38.113.181.243.53135: Flags [P.], seq 85780:86072, ack 37, win 501, length 292
21:41:20.606120 IP lamp-ubuntu-s-1vcpu-1gb-tor1-01.ssh > 38.113.181.243.53135: Flags [P.], seq 86072:86244, ack 37, win 501, length 172
21:41:20.606157 IP lamp-ubuntu-s-1vcpu-1gb-tor1-01.ssh > 38.113.181.243.53135: Flags [P.], seq 86244:86416, ack 37, win 501, length 172
21:41:20.606192 IP lamp-ubuntu-s-1vcpu-1gb-tor1-01.ssh > 38.113.181.243.53135: Flags [P.], seq 86416:86588, ack 37, win 501, length 172
21:41:20.606229 IP lamp-ubuntu-s-1vcpu-1gb-tor1-01.ssh > 38.113.181.243.53135: Flags [P.], seq 86588:86760, ack 37, win 501, length 172
21:41:20.606264 IP lamp-ubuntu-s-1vcpu-1gb-tor1-01.ssh > 38.113.181.243.53135: Flags [P.], seq 86760:86932, ack 37, win 501, length 172
21:41:20.606301 IP lamp-ubuntu-s-1vcpu-1gb-tor1-01.ssh > 38.113.181.243.53135: Flags [P.], seq 86932:87104, ack 37, win 501, length 172
21:41:20.606337 IP lamp-ubuntu-s-1vcpu-1gb-tor1-01.ssh > 38.113.181.243.53135: Flags [P.], seq 87104:87276, ack 37, win 501, length 172
21:41:20.606374 IP lamp-ubuntu-s-1vcpu-1gb-tor1-01.ssh > 38.113.181.243.53135: Flags [P.], seq 87276:87448, ack 37, win 501, length 172
21:41:20.607335 IP 38.113.181.243.53135 > lamp-ubuntu-s-1vcpu-1gb-tor1-01.ssh: Flags [.], ack 67224, win 8246, length 0
21:41:20.607373 IP lamp-ubuntu-s-1vcpu-1gb-tor1-01.ssh > 38.113.181.243.53135: Flags [P.], seq 87448:87620, ack 37, win 501, length 172
21:41:20.607465 IP lamp-ubuntu-s-1vcpu-1gb-tor1-01.ssh > 38.113.181.243.53135: Flags [P.], seq 87620:87912, ack 37, win 501, length 292
21:41:20.607533 IP lamp-ubuntu-s-1vcpu-1gb-tor1-01.ssh > 38.113.181.243.53135: Flags [P.], seq 87912:88084, ack 37, win 501, length 172
21:41:20.607586 IP lamp-ubuntu-s-1vcpu-1gb-tor1-01.ssh > 38.113.181.243.53135: Flags [P.], seq 88084:88256, ack 37, win 501, length 172
21:41:20.607627 IP lamp-ubuntu-s-1vcpu-1gb-tor1-01.ssh > 38.113.181.243.53135: Flags [P.], seq 88256:88428, ack 37, win 501, length 172
21:41:20.607666 IP lamp-ubuntu-s-1vcpu-1gb-tor1-01.ssh > 38.113.181.243.53135: Flags [P.], seq 88428:88600, ack 37, win 501, length 172
21:41:20.607702 IP lamp-ubuntu-s-1vcpu-1gb-tor1-01.ssh > 38.113.181.243.53135: Flags [P.], seq 88600:88772, ack 37, win 501, length 172
21:41:20.607755 IP lamp-ubuntu-s-1vcpu-1gb-tor1-01.ssh > 38.113.181.243.53135: Flags [P.], seq 88772:88944, ack 37, win 501, length 172
21:41:20.607800 IP lamp-ubuntu-s-1vcpu-1gb-tor1-01.ssh > 38.113.181.243.53135: Flags [P.], seq 88944:89116, ack 37, win 501, length 172
21:41:20.607840 IP lamp-ubuntu-s-1vcpu-1gb-tor1-01.ssh > 38.113.181.243.53135: Flags [P.], seq 89116:89288, ack 37, win 501, length 172
21:41:20.607878 IP lamp-ubuntu-s-1vcpu-1gb-tor1-01.ssh > 38.113.181.243.53135: Flags [P.], seq 89288:89460, ack 37, win 501, length 172
21:41:20.607934 IP lamp-ubuntu-s-1vcpu-1gb-tor1-01.ssh > 38.113.181.243.53135: Flags [P.], seq 89460:89632, ack 37, win 501, length 172
21:41:20.607993 IP lamp-ubuntu-s-1vcpu-1gb-tor1-01.ssh > 38.113.181.243.53135: Flags [P.], seq 89632:89804, ack 37, win 501, length 172
21:41:20.608035 IP lamp-ubuntu-s-1vcpu-1gb-tor1-01.ssh > 38.113.181.243.53135: Flags [P.], seq 89804:89976, ack 37, win 501, length 172
21:41:20.608074 IP lamp-ubuntu-s-1vcpu-1gb-tor1-01.ssh > 38.113.181.243.53135: Flags [P.], seq 89976:90148, ack 37, win 501, length 172
21:41:20.608113 IP lamp-ubuntu-s-1vcpu-1gb-tor1-01.ssh > 38.113.181.243.53135: Flags [P.], seq 90148:90320, ack 37, win 501, length 172
21:41:20.608170 IP lamp-ubuntu-s-1vcpu-1gb-tor1-01.ssh > 38.113.181.243.53135: Flags [P.], seq 90320:90492, ack 37, win 501, length 172
21:41:20.608226 IP lamp-ubuntu-s-1vcpu-1gb-tor1-01.ssh > 38.113.181.243.53135: Flags [P.], seq 90492:90664, ack 37, win 501, length 172
21:41:20.608269 IP lamp-ubuntu-s-1vcpu-1gb-tor1-01.ssh > 38.113.181.243.53135: Flags [P.], seq 90664:90836, ack 37, win 501, length 172
21:41:20.608308 IP lamp-ubuntu-s-1vcpu-1gb-tor1-01.ssh > 38.113.181.243.53135: Flags [P.], seq 90836:91008, ack 37, win 501, length 172
21:41:20.608347 IP lamp-ubuntu-s-1vcpu-1gb-tor1-01.ssh > 38.113.181.243.53135: Flags [P.], seq 91008:91180, ack 37, win 501, length 172
21:41:20.608385 IP lamp-ubuntu-s-1vcpu-1gb-tor1-01.ssh > 38.113.181.243.53135: Flags [P.], seq 91180:91352, ack 37, win 501, length 172
21:41:20.608422 IP lamp-ubuntu-s-1vcpu-1gb-tor1-01.ssh > 38.113.181.243.53135: Flags [P.], seq 91352:91524, ack 37, win 501, length 172
21:41:20.608471 IP lamp-ubuntu-s-1vcpu-1gb-tor1-01.ssh > 38.113.181.243.53135: Flags [P.], seq 91524:91696, ack 37, win 501, length 172
21:41:20.608526 IP lamp-ubuntu-s-1vcpu-1gb-tor1-01.ssh > 38.113.181.243.53135: Flags [P.], seq 91696:91868, ack 37, win 501, length 172
21:41:20.608577 IP lamp-ubuntu-s-1vcpu-1gb-tor1-01.ssh > 38.113.181.243.53135: Flags [P.], seq 91868:92040, ack 37, win 501, length 172
21:41:20.608630 IP lamp-ubuntu-s-1vcpu-1gb-tor1-01.ssh > 38.113.181.243.53135: Flags [P.], seq 92040:92212, ack 37, win 501, length 172
21:41:20.608647 IP 38.113.181.243.53135 > lamp-ubuntu-s-1vcpu-1gb-tor1-01.ssh: Flags [.], ack 71592, win 8246, length 0
21:41:20.608730 IP lamp-ubuntu-s-1vcpu-1gb-tor1-01.ssh > 38.113.181.243.53135: Flags [P.], seq 92212:92504, ack 37, win 501, length 292
21:41:20.608786 IP lamp-ubuntu-s-1vcpu-1gb-tor1-01.ssh > 38.113.181.243.53135: Flags [P.], seq 92504:92676, ack 37, win 501, length 172
21:41:20.608833 IP lamp-ubuntu-s-1vcpu-1gb-tor1-01.ssh > 38.113.181.243.53135: Flags [P.], seq 92676:92848, ack 37, win 501, length 172
21:41:20.608871 IP lamp-ubuntu-s-1vcpu-1gb-tor1-01.ssh > 38.113.181.243.53135: Flags [P.], seq 92848:93020, ack 37, win 501, length 172
21:41:20.608906 IP lamp-ubuntu-s-1vcpu-1gb-tor1-01.ssh > 38.113.181.243.53135: Flags [P.], seq 93020:93192, ack 37, win 501, length 172
21:41:20.608914 IP 38.113.181.243.53135 > lamp-ubuntu-s-1vcpu-1gb-tor1-01.ssh: Flags [.], ack 72796, win 8242, length 0
21:41:20.608963 IP lamp-ubuntu-s-1vcpu-1gb-tor1-01.ssh > 38.113.181.243.53135: Flags [P.], seq 93192:93484, ack 37, win 501, length 292
21:41:20.609001 IP lamp-ubuntu-s-1vcpu-1gb-tor1-01.ssh > 38.113.181.243.53135: Flags [P.], seq 93484:93656, ack 37, win 501, length 172
21:41:20.609038 IP lamp-ubuntu-s-1vcpu-1gb-tor1-01.ssh > 38.113.181.243.53135: Flags [P.], seq 93656:93828, ack 37, win 501, length 172
21:41:20.609075 IP lamp-ubuntu-s-1vcpu-1gb-tor1-01.ssh > 38.113.181.243.53135: Flags [P.], seq 93828:94000, ack 37, win 501, length 172
21:41:20.609111 IP lamp-ubuntu-s-1vcpu-1gb-tor1-01.ssh > 38.113.181.243.53135: Flags [P.], seq 94000:94172, ack 37, win 501, length 172
21:41:20.609147 IP lamp-ubuntu-s-1vcpu-1gb-tor1-01.ssh > 38.113.181.243.53135: Flags [P.], seq 94172:94344, ack 37, win 501, length 172
21:41:20.609184 IP lamp-ubuntu-s-1vcpu-1gb-tor1-01.ssh > 38.113.181.243.53135: Flags [P.], seq 94344:94516, ack 37, win 501, length 172
21:41:20.609221 IP lamp-ubuntu-s-1vcpu-1gb-tor1-01.ssh > 38.113.181.243.53135: Flags [P.], seq 94516:94688, ack 37, win 501, length 172
21:41:20.609257 IP lamp-ubuntu-s-1vcpu-1gb-tor1-01.ssh > 38.113.181.243.53135: Flags [P.], seq 94688:94860, ack 37, win 501, length 172
21:41:20.609293 IP lamp-ubuntu-s-1vcpu-1gb-tor1-01.ssh > 38.113.181.243.53135: Flags [P.], seq 94860:95032, ack 37, win 501, length 172
21:41:20.609330 IP lamp-ubuntu-s-1vcpu-1gb-tor1-01.ssh > 38.113.181.243.53135: Flags [P.], seq 95032:95204, ack 37, win 501, length 172
21:41:20.609366 IP lamp-ubuntu-s-1vcpu-1gb-tor1-01.ssh > 38.113.181.243.53135: Flags [P.], seq 95204:95376, ack 37, win 501, length 172
21:41:20.609404 IP lamp-ubuntu-s-1vcpu-1gb-tor1-01.ssh > 38.113.181.243.53135: Flags [P.], seq 95376:95548, ack 37, win 501, length 172
21:41:20.609468 IP lamp-ubuntu-s-1vcpu-1gb-tor1-01.ssh > 38.113.181.243.53135: Flags [P.], seq 95548:95720, ack 37, win 501, length 172
21:41:20.609524 IP lamp-ubuntu-s-1vcpu-1gb-tor1-01.ssh > 38.113.181.243.53135: Flags [P.], seq 95720:95892, ack 37, win 501, length 172
21:41:20.609564 IP lamp-ubuntu-s-1vcpu-1gb-tor1-01.ssh > 38.113.181.243.53135: Flags [P.], seq 95892:96064, ack 37, win 501, length 172
21:41:20.609602 IP lamp-ubuntu-s-1vcpu-1gb-tor1-01.ssh > 38.113.181.243.53135: Flags [P.], seq 96064:96236, ack 37, win 501, length 172
21:41:20.609640 IP lamp-ubuntu-s-1vcpu-1gb-tor1-01.ssh > 38.113.181.243.53135: Flags [P.], seq 96236:96408, ack 37, win 501, length 172
21:41:20.609676 IP lamp-ubuntu-s-1vcpu-1gb-tor1-01.ssh > 38.113.181.243.53135: Flags [P.], seq 96408:96580, ack 37, win 501, length 172
21:41:20.609714 IP lamp-ubuntu-s-1vcpu-1gb-tor1-01.ssh > 38.113.181.243.53135: Flags [P.], seq 96580:96752, ack 37, win 501, length 172
21:41:20.609751 IP lamp-ubuntu-s-1vcpu-1gb-tor1-01.ssh > 38.113.181.243.53135: Flags [P.], seq 96752:96924, ack 37, win 501, length 172
21:41:20.609787 IP lamp-ubuntu-s-1vcpu-1gb-tor1-01.ssh > 38.113.181.243.53135: Flags [P.], seq 96924:97096, ack 37, win 501, length 172
21:41:20.609824 IP lamp-ubuntu-s-1vcpu-1gb-tor1-01.ssh > 38.113.181.243.53135: Flags [P.], seq 97096:97268, ack 37, win 501, length 172
21:41:20.609860 IP lamp-ubuntu-s-1vcpu-1gb-tor1-01.ssh > 38.113.181.243.53135: Flags [P.], seq 97268:97440, ack 37, win 501, length 172
21:41:20.609897 IP lamp-ubuntu-s-1vcpu-1gb-tor1-01.ssh > 38.113.181.243.53135: Flags [P.], seq 97440:97612, ack 37, win 501, length 172
21:41:20.609959 IP lamp-ubuntu-s-1vcpu-1gb-tor1-01.ssh > 38.113.181.243.53135: Flags [P.], seq 97612:97784, ack 37, win 501, length 172
21:41:20.610015 IP lamp-ubuntu-s-1vcpu-1gb-tor1-01.ssh > 38.113.181.243.53135: Flags [P.], seq 97784:97956, ack 37, win 501, length 172
21:41:20.610061 IP lamp-ubuntu-s-1vcpu-1gb-tor1-01.ssh > 38.113.181.243.53135: Flags [P.], seq 97956:98128, ack 37, win 501, length 172
21:41:20.610120 IP lamp-ubuntu-s-1vcpu-1gb-tor1-01.ssh > 38.113.181.243.53135: Flags [P.], seq 98128:98300, ack 37, win 501, length 172
21:41:20.610157 IP 38.113.181.243.53135 > lamp-ubuntu-s-1vcpu-1gb-tor1-01.ssh: Flags [.], ack 76872, win 8246, length 0
21:41:20.610200 IP lamp-ubuntu-s-1vcpu-1gb-tor1-01.ssh > 38.113.181.243.53135: Flags [P.], seq 98300:98592, ack 37, win 501, length 292
21:41:20.610238 IP lamp-ubuntu-s-1vcpu-1gb-tor1-01.ssh > 38.113.181.243.53135: Flags [P.], seq 98592:98764, ack 37, win 501, length 172
21:41:20.610274 IP lamp-ubuntu-s-1vcpu-1gb-tor1-01.ssh > 38.113.181.243.53135: Flags [P.], seq 98764:98936, ack 37, win 501, length 172
21:41:20.610318 IP lamp-ubuntu-s-1vcpu-1gb-tor1-01.ssh > 38.113.181.243.53135: Flags [P.], seq 98936:99108, ack 37, win 501, length 172
21:41:20.610367 IP lamp-ubuntu-s-1vcpu-1gb-tor1-01.ssh > 38.113.181.243.53135: Flags [P.], seq 99108:99280, ack 37, win 501, length 172
21:41:20.610442 IP lamp-ubuntu-s-1vcpu-1gb-tor1-01.ssh > 38.113.181.243.53135: Flags [P.], seq 99280:99452, ack 37, win 501, length 172
21:41:20.610500 IP lamp-ubuntu-s-1vcpu-1gb-tor1-01.ssh > 38.113.181.243.53135: Flags [P.], seq 99452:99624, ack 37, win 501, length 172
21:41:20.610554 IP lamp-ubuntu-s-1vcpu-1gb-tor1-01.ssh > 38.113.181.243.53135: Flags [P.], seq 99624:99796, ack 37, win 501, length 172
21:41:20.610637 IP lamp-ubuntu-s-1vcpu-1gb-tor1-01.ssh > 38.113.181.243.53135: Flags [P.], seq 99796:99968, ack 37, win 501, length 172
21:41:20.610693 IP lamp-ubuntu-s-1vcpu-1gb-tor1-01.ssh > 38.113.181.243.53135: Flags [P.], seq 99968:100140, ack 37, win 501, length 172
21:41:20.610755 IP lamp-ubuntu-s-1vcpu-1gb-tor1-01.ssh > 38.113.181.243.53135: Flags [P.], seq 100140:100312, ack 37, win 501, length 172
21:41:20.610813 IP lamp-ubuntu-s-1vcpu-1gb-tor1-01.ssh > 38.113.181.243.53135: Flags [P.], seq 100312:100492, ack 37, win 501, length 180
21:41:20.610855 IP lamp-ubuntu-s-1vcpu-1gb-tor1-01.ssh > 38.113.181.243.53135: Flags [P.], seq 100492:100672, ack 37, win 501, length 180
21:41:20.610892 IP lamp-ubuntu-s-1vcpu-1gb-tor1-01.ssh > 38.113.181.243.53135: Flags [P.], seq 100672:100852, ack 37, win 501, length 180
21:41:20.610929 IP lamp-ubuntu-s-1vcpu-1gb-tor1-01.ssh > 38.113.181.243.53135: Flags [P.], seq 100852:101032, ack 37, win 501, length 180
21:41:20.610966 IP lamp-ubuntu-s-1vcpu-1gb-tor1-01.ssh > 38.113.181.243.53135: Flags [P.], seq 101032:101212, ack 37, win 501, length 180
21:41:20.611026 IP lamp-ubuntu-s-1vcpu-1gb-tor1-01.ssh > 38.113.181.243.53135: Flags [P.], seq 101212:101392, ack 37, win 501, length 180
21:41:20.611089 IP lamp-ubuntu-s-1vcpu-1gb-tor1-01.ssh > 38.113.181.243.53135: Flags [P.], seq 101392:101572, ack 37, win 501, length 180
21:41:20.611145 IP lamp-ubuntu-s-1vcpu-1gb-tor1-01.ssh > 38.113.181.243.53135: Flags [P.], seq 101572:101752, ack 37, win 501, length 180
21:41:20.611203 IP lamp-ubuntu-s-1vcpu-1gb-tor1-01.ssh > 38.113.181.243.53135: Flags [P.], seq 101752:101932, ack 37, win 501, length 180
21:41:20.611251 IP lamp-ubuntu-s-1vcpu-1gb-tor1-01.ssh > 38.113.181.243.53135: Flags [P.], seq 101932:102112, ack 37, win 501, length 180
21:41:20.611290 IP lamp-ubuntu-s-1vcpu-1gb-tor1-01.ssh > 38.113.181.243.53135: Flags [P.], seq 102112:102292, ack 37, win 501, length 180
21:41:20.611328 IP lamp-ubuntu-s-1vcpu-1gb-tor1-01.ssh > 38.113.181.243.53135: Flags [P.], seq 102292:102472, ack 37, win 501, length 180
21:41:20.611364 IP lamp-ubuntu-s-1vcpu-1gb-tor1-01.ssh > 38.113.181.243.53135: Flags [P.], seq 102472:102652, ack 37, win 501, length 180
21:41:20.611794 IP 38.113.181.243.53135 > lamp-ubuntu-s-1vcpu-1gb-tor1-01.ssh: Flags [.], ack 79796, win 8246, length 0
21:41:20.611820 IP lamp-ubuntu-s-1vcpu-1gb-tor1-01.ssh > 38.113.181.243.53135: Flags [P.], seq 102652:102832, ack 37, win 501, length 180
21:41:20.611909 IP lamp-ubuntu-s-1vcpu-1gb-tor1-01.ssh > 38.113.181.243.53135: Flags [P.], seq 102832:103132, ack 37, win 501, length 300
21:41:20.611948 IP lamp-ubuntu-s-1vcpu-1gb-tor1-01.ssh > 38.113.181.243.53135: Flags [P.], seq 103132:103312, ack 37, win 501, length 180
21:41:20.611985 IP lamp-ubuntu-s-1vcpu-1gb-tor1-01.ssh > 38.113.181.243.53135: Flags [P.], seq 103312:103492, ack 37, win 501, length 180
21:41:20.612022 IP lamp-ubuntu-s-1vcpu-1gb-tor1-01.ssh > 38.113.181.243.53135: Flags [P.], seq 103492:103672, ack 37, win 501, length 180
21:41:20.612059 IP lamp-ubuntu-s-1vcpu-1gb-tor1-01.ssh > 38.113.181.243.53135: Flags [P.], seq 103672:103852, ack 37, win 501, length 180
21:41:20.612096 IP lamp-ubuntu-s-1vcpu-1gb-tor1-01.ssh > 38.113.181.243.53135: Flags [P.], seq 103852:104032, ack 37, win 501, length 180
21:41:20.612132 IP lamp-ubuntu-s-1vcpu-1gb-tor1-01.ssh > 38.113.181.243.53135: Flags [P.], seq 104032:104212, ack 37, win 501, length 180
21:41:20.612168 IP lamp-ubuntu-s-1vcpu-1gb-tor1-01.ssh > 38.113.181.243.53135: Flags [P.], seq 104212:104392, ack 37, win 501, length 180
21:41:20.612205 IP lamp-ubuntu-s-1vcpu-1gb-tor1-01.ssh > 38.113.181.243.53135: Flags [P.], seq 104392:104572, ack 37, win 501, length 180
21:41:20.612241 IP lamp-ubuntu-s-1vcpu-1gb-tor1-01.ssh > 38.113.181.243.53135: Flags [P.], seq 104572:104752, ack 37, win 501, length 180
21:41:20.612277 IP lamp-ubuntu-s-1vcpu-1gb-tor1-01.ssh > 38.113.181.243.53135: Flags [P.], seq 104752:104932, ack 37, win 501, length 180
21:41:20.612285 IP 38.113.181.243.53135 > lamp-ubuntu-s-1vcpu-1gb-tor1-01.ssh: Flags [.], ack 79968, win 8246, length 0
21:41:20.612342 IP lamp-ubuntu-s-1vcpu-1gb-tor1-01.ssh > 38.113.181.243.53135: Flags [P.], seq 104932:105232, ack 37, win 501, length 300
21:41:20.612400 IP lamp-ubuntu-s-1vcpu-1gb-tor1-01.ssh > 38.113.181.243.53135: Flags [P.], seq 105232:105412, ack 37, win 501, length 180
21:41:20.612457 IP lamp-ubuntu-s-1vcpu-1gb-tor1-01.ssh > 38.113.181.243.53135: Flags [P.], seq 105412:105592, ack 37, win 501, length 180
21:41:20.612518 IP lamp-ubuntu-s-1vcpu-1gb-tor1-01.ssh > 38.113.181.243.53135: Flags [P.], seq 105592:105772, ack 37, win 501, length 180
21:41:20.612564 IP lamp-ubuntu-s-1vcpu-1gb-tor1-01.ssh > 38.113.181.243.53135: Flags [P.], seq 105772:105952, ack 37, win 501, length 180
21:41:20.612624 IP lamp-ubuntu-s-1vcpu-1gb-tor1-01.ssh > 38.113.181.243.53135: Flags [P.], seq 105952:106132, ack 37, win 501, length 180
21:41:20.612668 IP lamp-ubuntu-s-1vcpu-1gb-tor1-01.ssh > 38.113.181.243.53135: Flags [P.], seq 106132:106312, ack 37, win 501, length 180
21:41:20.630906 IP 38.113.181.243.53135 > lamp-ubuntu-s-1vcpu-1gb-tor1-01.ssh: Flags [.], ack 80432, win 8244, length 0
21:41:20.630906 IP 38.113.181.243.53135 > lamp-ubuntu-s-1vcpu-1gb-tor1-01.ssh: Flags [.], ack 82908, win 8246, length 0
21:41:20.630906 IP 38.113.181.243.53135 > lamp-ubuntu-s-1vcpu-1gb-tor1-01.ssh: Flags [P.], seq 37:73, ack 82908, win 8246, length 36
21:41:20.630969 IP lamp-ubuntu-s-1vcpu-1gb-tor1-01.ssh > 38.113.181.243.53135: Flags [P.], seq 106312:106492, ack 37, win 501, length 180
21:41:20.631075 IP 38.113.181.243.53135 > lamp-ubuntu-s-1vcpu-1gb-tor1-01.ssh: Flags [.], ack 85144, win 8246, length 0
^C
607 packets captured
607 packets received by filter
0 packets dropped by kernel
root@lamp-ubuntu-s-1vcpu-1gb-tor1-01:~#
