root@lamp-ubuntu-s-1vcpu-1gb-tor1-01:~# tcpdump -n -i eth0
tcpdump: verbose output suppressed, use -v or -vv for full protocol decode
listening on eth0, link-type EN10MB (Ethernet), capture size 262144 bytes
21:37:57.755865 IP 138.197.151.155.22 > 38.113.181.243.53135: Flags [P.], seq 1872334769:1872334805, ack 2209518728, win 501, length 36
21:37:57.756492 IP 138.197.151.155.22 > 38.113.181.243.53135: Flags [P.], seq 36:144, ack 1, win 501, length 108
21:37:57.756567 IP 138.197.151.155.22 > 38.113.181.243.53135: Flags [P.], seq 144:288, ack 1, win 501, length 144
21:37:57.756666 IP 138.197.151.155.22 > 38.113.181.243.53135: Flags [P.], seq 288:324, ack 1, win 501, length 36
21:37:57.756756 IP 138.197.151.155.22 > 38.113.181.243.53135: Flags [P.], seq 324:496, ack 1, win 501, length 172
21:37:57.756803 IP 138.197.151.155.22 > 38.113.181.243.53135: Flags [P.], seq 496:532, ack 1, win 501, length 36
21:37:57.756861 IP 138.197.151.155.22 > 38.113.181.243.53135: Flags [P.], seq 532:680, ack 1, win 501, length 148
21:37:57.756902 IP 138.197.151.155.22 > 38.113.181.243.53135: Flags [P.], seq 680:716, ack 1, win 501, length 36
21:37:57.756954 IP 138.197.151.155.22 > 38.113.181.243.53135: Flags [P.], seq 716:864, ack 1, win 501, length 148
21:37:57.756990 IP 138.197.151.155.22 > 38.113.181.243.53135: Flags [P.], seq 864:900, ack 1, win 501, length 36
21:37:57.783443 IP 38.113.181.243.53135 > 138.197.151.155.22: Flags [.], ack 144, win 8243, length 0
21:37:57.783521 IP 138.197.151.155.22 > 38.113.181.243.53135: Flags [P.], seq 900:2188, ack 1, win 501, length 1288
21:37:57.783707 IP 138.197.151.155.22 > 38.113.181.243.53135: Flags [P.], seq 2188:2328, ack 1, win 501, length 140
21:37:57.783757 IP 138.197.151.155.22 > 38.113.181.243.53135: Flags [P.], seq 2328:2364, ack 1, win 501, length 36
21:37:57.783811 IP 138.197.151.155.22 > 38.113.181.243.53135: Flags [P.], seq 2364:2520, ack 1, win 501, length 156
21:37:57.784471 IP 38.113.181.243.53135 > 138.197.151.155.22: Flags [.], ack 900, win 8246, length 0
21:37:57.784494 IP 138.197.151.155.22 > 38.113.181.243.53135: Flags [P.], seq 2520:3124, ack 1, win 501, length 604
21:37:57.784566 IP 138.197.151.155.22 > 38.113.181.243.53135: Flags [P.], seq 3124:3264, ack 1, win 501, length 140
21:37:57.784607 IP 138.197.151.155.22 > 38.113.181.243.53135: Flags [P.], seq 3264:3300, ack 1, win 501, length 36
21:37:57.784654 IP 138.197.151.155.22 > 38.113.181.243.53135: Flags [P.], seq 3300:3456, ack 1, win 501, length 156
21:37:57.784689 IP 138.197.151.155.22 > 38.113.181.243.53135: Flags [P.], seq 3456:3492, ack 1, win 501, length 36
21:37:57.784733 IP 138.197.151.155.22 > 38.113.181.243.53135: Flags [P.], seq 3492:3648, ack 1, win 501, length 156
21:37:57.784769 IP 138.197.151.155.22 > 38.113.181.243.53135: Flags [P.], seq 3648:3684, ack 1, win 501, length 36
21:37:57.784813 IP 138.197.151.155.22 > 38.113.181.243.53135: Flags [P.], seq 3684:3832, ack 1, win 501, length 148
21:37:57.784849 IP 138.197.151.155.22 > 38.113.181.243.53135: Flags [P.], seq 3832:3868, ack 1, win 501, length 36
21:37:57.784892 IP 138.197.151.155.22 > 38.113.181.243.53135: Flags [P.], seq 3868:4024, ack 1, win 501, length 156
21:37:57.784929 IP 138.197.151.155.22 > 38.113.181.243.53135: Flags [P.], seq 4024:4060, ack 1, win 501, length 36
21:37:57.784975 IP 138.197.151.155.22 > 38.113.181.243.53135: Flags [P.], seq 4060:4208, ack 1, win 501, length 148
21:37:57.785012 IP 138.197.151.155.22 > 38.113.181.243.53135: Flags [P.], seq 4208:4244, ack 1, win 501, length 36
21:37:57.785058 IP 138.197.151.155.22 > 38.113.181.243.53135: Flags [P.], seq 4244:4400, ack 1, win 501, length 156
21:37:57.785094 IP 138.197.151.155.22 > 38.113.181.243.53135: Flags [P.], seq 4400:4436, ack 1, win 501, length 36
21:37:57.785138 IP 138.197.151.155.22 > 38.113.181.243.53135: Flags [P.], seq 4436:4584, ack 1, win 501, length 148
21:37:57.810967 IP 38.113.181.243.53135 > 138.197.151.155.22: Flags [.], ack 2520, win 8246, length 0
21:37:57.811026 IP 138.197.151.155.22 > 38.113.181.243.53135: Flags [P.], seq 4584:6316, ack 1, win 501, length 1732
21:37:57.811175 IP 138.197.151.155.22 > 38.113.181.243.53135: Flags [P.], seq 6316:6456, ack 1, win 501, length 140
21:37:57.811229 IP 138.197.151.155.22 > 38.113.181.243.53135: Flags [P.], seq 6456:6492, ack 1, win 501, length 36
21:37:57.811279 IP 138.197.151.155.22 > 38.113.181.243.53135: Flags [P.], seq 6492:6648, ack 1, win 501, length 156
21:37:57.811320 IP 138.197.151.155.22 > 38.113.181.243.53135: Flags [P.], seq 6648:6684, ack 1, win 501, length 36
21:37:57.811363 IP 138.197.151.155.22 > 38.113.181.243.53135: Flags [P.], seq 6684:6840, ack 1, win 501, length 156
21:37:57.811403 IP 138.197.151.155.22 > 38.113.181.243.53135: Flags [P.], seq 6840:6876, ack 1, win 501, length 36
21:37:57.811891 IP 38.113.181.243.53135 > 138.197.151.155.22: Flags [.], ack 4584, win 8246, length 0
21:37:57.811931 IP 138.197.151.155.22 > 38.113.181.243.53135: Flags [P.], seq 6876:7812, ack 1, win 501, length 936
21:37:57.812029 IP 138.197.151.155.22 > 38.113.181.243.53135: Flags [P.], seq 7812:7952, ack 1, win 501, length 140
21:37:57.812064 IP 138.197.151.155.22 > 38.113.181.243.53135: Flags [P.], seq 7952:7988, ack 1, win 501, length 36
21:37:57.812104 IP 138.197.151.155.22 > 38.113.181.243.53135: Flags [P.], seq 7988:8144, ack 1, win 501, length 156
21:37:57.812132 IP 138.197.151.155.22 > 38.113.181.243.53135: Flags [P.], seq 8144:8180, ack 1, win 501, length 36
21:37:57.812167 IP 138.197.151.155.22 > 38.113.181.243.53135: Flags [P.], seq 8180:8336, ack 1, win 501, length 156
21:37:57.812194 IP 138.197.151.155.22 > 38.113.181.243.53135: Flags [P.], seq 8336:8372, ack 1, win 501, length 36
21:37:57.812225 IP 138.197.151.155.22 > 38.113.181.243.53135: Flags [P.], seq 8372:8520, ack 1, win 501, length 148
21:37:57.812253 IP 138.197.151.155.22 > 38.113.181.243.53135: Flags [P.], seq 8520:8556, ack 1, win 501, length 36
21:37:57.812286 IP 138.197.151.155.22 > 38.113.181.243.53135: Flags [P.], seq 8556:8712, ack 1, win 501, length 156
21:37:57.812313 IP 138.197.151.155.22 > 38.113.181.243.53135: Flags [P.], seq 8712:8748, ack 1, win 501, length 36
21:37:57.812345 IP 138.197.151.155.22 > 38.113.181.243.53135: Flags [P.], seq 8748:8896, ack 1, win 501, length 148
21:37:57.812373 IP 138.197.151.155.22 > 38.113.181.243.53135: Flags [P.], seq 8896:8932, ack 1, win 501, length 36
21:37:57.812412 IP 138.197.151.155.22 > 38.113.181.243.53135: Flags [P.], seq 8932:9088, ack 1, win 501, length 156
21:37:57.812439 IP 138.197.151.155.22 > 38.113.181.243.53135: Flags [P.], seq 9088:9124, ack 1, win 501, length 36
21:37:57.812478 IP 138.197.151.155.22 > 38.113.181.243.53135: Flags [P.], seq 9124:9272, ack 1, win 501, length 148
21:37:57.812524 IP 138.197.151.155.22 > 38.113.181.243.53135: Flags [P.], seq 9272:9464, ack 1, win 501, length 192
21:37:57.812564 IP 138.197.151.155.22 > 38.113.181.243.53135: Flags [P.], seq 9464:9500, ack 1, win 501, length 36
21:37:57.812592 IP 138.197.151.155.22 > 38.113.181.243.53135: Flags [P.], seq 9500:9648, ack 1, win 501, length 148
21:37:57.812630 IP 138.197.151.155.22 > 38.113.181.243.53135: Flags [P.], seq 9648:9684, ack 1, win 501, length 36
21:37:57.812662 IP 138.197.151.155.22 > 38.113.181.243.53135: Flags [P.], seq 9684:9840, ack 1, win 501, length 156
21:37:57.812688 IP 138.197.151.155.22 > 38.113.181.243.53135: Flags [P.], seq 9840:9876, ack 1, win 501, length 36
21:37:57.812720 IP 138.197.151.155.22 > 38.113.181.243.53135: Flags [P.], seq 9876:10024, ack 1, win 501, length 148
21:37:57.812748 IP 138.197.151.155.22 > 38.113.181.243.53135: Flags [P.], seq 10024:10060, ack 1, win 501, length 36
21:37:57.812781 IP 138.197.151.155.22 > 38.113.181.243.53135: Flags [P.], seq 10060:10216, ack 1, win 501, length 156
21:37:57.812816 IP 138.197.151.155.22 > 38.113.181.243.53135: Flags [P.], seq 10216:10252, ack 1, win 501, length 36
21:37:57.812845 IP 138.197.151.155.22 > 38.113.181.243.53135: Flags [P.], seq 10252:10400, ack 1, win 501, length 148
21:37:57.812873 IP 138.197.151.155.22 > 38.113.181.243.53135: Flags [P.], seq 10400:10436, ack 1, win 501, length 36
21:37:57.812907 IP 138.197.151.155.22 > 38.113.181.243.53135: Flags [P.], seq 10436:10592, ack 1, win 501, length 156
21:37:57.812935 IP 138.197.151.155.22 > 38.113.181.243.53135: Flags [P.], seq 10592:10628, ack 1, win 501, length 36
21:37:57.812968 IP 138.197.151.155.22 > 38.113.181.243.53135: Flags [P.], seq 10628:10776, ack 1, win 501, length 148
21:37:57.812996 IP 138.197.151.155.22 > 38.113.181.243.53135: Flags [P.], seq 10776:10812, ack 1, win 501, length 36
21:37:57.838996 IP 38.113.181.243.53135 > 138.197.151.155.22: Flags [.], ack 7988, win 8246, length 0
21:37:57.839053 IP 138.197.151.155.22 > 38.113.181.243.53135: Flags [P.], seq 10812:13732, ack 1, win 501, length 2920
21:37:57.839119 IP 138.197.151.155.22 > 38.113.181.243.53135: Flags [P.], seq 13732:14052, ack 1, win 501, length 320
21:37:57.839201 IP 38.113.181.243.53135 > 138.197.151.155.22: Flags [.], ack 8336, win 8245, length 0
21:37:57.839225 IP 138.197.151.155.22 > 38.113.181.243.53135: Flags [P.], seq 14052:14192, ack 1, win 501, length 140
21:37:57.839262 IP 138.197.151.155.22 > 38.113.181.243.53135: Flags [P.], seq 14192:14228, ack 1, win 501, length 36
21:37:57.839303 IP 138.197.151.155.22 > 38.113.181.243.53135: Flags [P.], seq 14228:14384, ack 1, win 501, length 156
21:37:57.839331 IP 138.197.151.155.22 > 38.113.181.243.53135: Flags [P.], seq 14384:14420, ack 1, win 501, length 36
21:37:57.839365 IP 138.197.151.155.22 > 38.113.181.243.53135: Flags [P.], seq 14420:14576, ack 1, win 501, length 156
21:37:57.839393 IP 138.197.151.155.22 > 38.113.181.243.53135: Flags [P.], seq 14576:14612, ack 1, win 501, length 36
21:37:57.839436 IP 138.197.151.155.22 > 38.113.181.243.53135: Flags [P.], seq 14612:14752, ack 1, win 501, length 140
21:37:57.839463 IP 138.197.151.155.22 > 38.113.181.243.53135: Flags [P.], seq 14752:14788, ack 1, win 501, length 36
21:37:57.839498 IP 138.197.151.155.22 > 38.113.181.243.53135: Flags [P.], seq 14788:14944, ack 1, win 501, length 156
21:37:57.839539 IP 138.197.151.155.22 > 38.113.181.243.53135: Flags [P.], seq 14944:15136, ack 1, win 501, length 192
21:37:57.839600 IP 138.197.151.155.22 > 38.113.181.243.53135: Flags [P.], seq 15136:15172, ack 1, win 501, length 36
21:37:57.839610 IP 138.197.151.155.22 > 38.113.181.243.53135: Flags [P.], seq 15172:15328, ack 1, win 501, length 156
21:37:57.839645 IP 138.197.151.155.22 > 38.113.181.243.53135: Flags [P.], seq 15328:15364, ack 1, win 501, length 36
21:37:57.839677 IP 138.197.151.155.22 > 38.113.181.243.53135: Flags [P.], seq 15364:15520, ack 1, win 501, length 156
21:37:57.839720 IP 138.197.151.155.22 > 38.113.181.243.53135: Flags [P.], seq 15520:15712, ack 1, win 501, length 192
21:37:57.839751 IP 138.197.151.155.22 > 38.113.181.243.53135: Flags [P.], seq 15712:15748, ack 1, win 501, length 36
21:37:57.839786 IP 138.197.151.155.22 > 38.113.181.243.53135: Flags [P.], seq 15748:15904, ack 1, win 501, length 156
21:37:57.839811 IP 138.197.151.155.22 > 38.113.181.243.53135: Flags [P.], seq 15904:15940, ack 1, win 501, length 36
21:37:57.839844 IP 138.197.151.155.22 > 38.113.181.243.53135: Flags [P.], seq 15940:16096, ack 1, win 501, length 156
21:37:57.839874 IP 138.197.151.155.22 > 38.113.181.243.53135: Flags [P.], seq 16096:16132, ack 1, win 501, length 36
21:37:57.839920 IP 138.197.151.155.22 > 38.113.181.243.53135: Flags [P.], seq 16132:16288, ack 1, win 501, length 156
21:37:57.839956 IP 138.197.151.155.22 > 38.113.181.243.53135: Flags [P.], seq 16288:16324, ack 1, win 501, length 36
21:37:57.839993 IP 138.197.151.155.22 > 38.113.181.243.53135: Flags [P.], seq 16324:16480, ack 1, win 501, length 156
21:37:57.840019 IP 138.197.151.155.22 > 38.113.181.243.53135: Flags [P.], seq 16480:16516, ack 1, win 501, length 36
21:37:57.840052 IP 138.197.151.155.22 > 38.113.181.243.53135: Flags [P.], seq 16516:16672, ack 1, win 501, length 156
21:37:57.840233 IP 38.113.181.243.53135 > 138.197.151.155.22: Flags [.], ack 10812, win 8246, length 0
21:37:57.840255 IP 138.197.151.155.22 > 38.113.181.243.53135: Flags [P.], seq 16672:17476, ack 1, win 501, length 804
21:38:12.307244 IP 138.197.151.155.22 > 38.113.181.243.53135: Flags [P.], seq 186348:186504, ack 73, win 501, length 156
21:38:12.307281 IP 138.197.151.155.22 > 38.113.181.243.53135: Flags [P.], seq 186504:186660, ack 73, win 501, length 156
21:38:12.307318 IP 138.197.151.155.22 > 38.113.181.243.53135: Flags [P.], seq 186660:186816, ack 73, win 501, length 156
21:38:12.307355 IP 138.197.151.155.22 > 38.113.181.243.53135: Flags [P.], seq 186816:186972, ack 73, win 501, length 156
21:38:12.307391 IP 138.197.151.155.22 > 38.113.181.243.53135: Flags [P.], seq 186972:187128, ack 73, win 501, length 156
21:38:12.307428 IP 138.197.151.155.22 > 38.113.181.243.53135: Flags [P.], seq 187128:187284, ack 73, win 501, length 156
21:38:12.307466 IP 138.197.151.155.22 > 38.113.181.243.53135: Flags [P.], seq 187284:187440, ack 73, win 501, length 156
21:38:12.307502 IP 138.197.151.155.22 > 38.113.181.243.53135: Flags [P.], seq 187440:187596, ack 73, win 501, length 156
21:38:12.307537 IP 138.197.151.155.22 > 38.113.181.243.53135: Flags [P.], seq 187596:187752, ack 73, win 501, length 156
21:38:12.307586 IP 138.197.151.155.22 > 38.113.181.243.53135: Flags [P.], seq 187752:187908, ack 73, win 501, length 156
21:38:12.307626 IP 138.197.151.155.22 > 38.113.181.243.53135: Flags [P.], seq 187908:188064, ack 73, win 501, length 156
21:38:12.307662 IP 138.197.151.155.22 > 38.113.181.243.53135: Flags [P.], seq 188064:188220, ack 73, win 501, length 156
21:38:12.307700 IP 138.197.151.155.22 > 38.113.181.243.53135: Flags [P.], seq 188220:188376, ack 73, win 501, length 156
21:38:12.307736 IP 138.197.151.155.22 > 38.113.181.243.53135: Flags [P.], seq 188376:188532, ack 73, win 501, length 156
21:38:12.307773 IP 138.197.151.155.22 > 38.113.181.243.53135: Flags [P.], seq 188532:188688, ack 73, win 501, length 156
21:38:12.307810 IP 138.197.151.155.22 > 38.113.181.243.53135: Flags [P.], seq 188688:188844, ack 73, win 501, length 156
21:38:12.307855 IP 138.197.151.155.22 > 38.113.181.243.53135: Flags [P.], seq 188844:189000, ack 73, win 501, length 156
21:38:12.307908 IP 138.197.151.155.22 > 38.113.181.243.53135: Flags [P.], seq 189000:189156, ack 73, win 501, length 156
21:38:12.307947 IP 138.197.151.155.22 > 38.113.181.243.53135: Flags [P.], seq 189156:189312, ack 73, win 501, length 156
21:38:12.307985 IP 138.197.151.155.22 > 38.113.181.243.53135: Flags [P.], seq 189312:189468, ack 73, win 501, length 156
21:38:12.308035 IP 138.197.151.155.22 > 38.113.181.243.53135: Flags [P.], seq 189468:189624, ack 73, win 501, length 156
21:38:12.308078 IP 138.197.151.155.22 > 38.113.181.243.53135: Flags [P.], seq 189624:189780, ack 73, win 501, length 156
21:38:12.308115 IP 138.197.151.155.22 > 38.113.181.243.53135: Flags [P.], seq 189780:189936, ack 73, win 501, length 156
21:38:12.308152 IP 138.197.151.155.22 > 38.113.181.243.53135: Flags [P.], seq 189936:190092, ack 73, win 501, length 156
21:38:12.308191 IP 138.197.151.155.22 > 38.113.181.243.53135: Flags [P.], seq 190092:190248, ack 73, win 501, length 156
21:38:12.308227 IP 138.197.151.155.22 > 38.113.181.243.53135: Flags [P.], seq 190248:190404, ack 73, win 501, length 156
21:38:12.321036 IP 38.113.181.243.53135 > 138.197.151.155.22: Flags [.], ack 156792, win 8246, length 0
21:38:12.321036 IP 38.113.181.243.53135 > 138.197.151.155.22: Flags [P.], seq 73:109, ack 156792, win 8246, length 36
21:38:12.321036 IP 38.113.181.243.53135 > 138.197.151.155.22: Flags [.], ack 161696, win 8246, length 0
21:38:12.321118 IP 138.197.151.155.22 > 38.113.181.243.53135: Flags [P.], seq 190404:190560, ack 73, win 501, length 156
21:38:12.321321 IP 138.197.151.155.22 > 38.113.181.243.53135: Flags [.], ack 109, win 501, length 0
^C
1225 packets captured
1226 packets received by filter
1 packet dropped by kernel
root@lamp-ubuntu-s-1vcpu-1gb-tor1-01:~#
