root@lamp-ubuntu-s-1vcpu-1gb-tor1-01:~# tcpdump -i eth0
tcpdump: verbose output suppressed, use -v or -vv for full protocol decode
listening on eth0, link-type EN10MB (Ethernet), capture size 262144 bytes
21:22:07.291833 IP lamp-ubuntu-s-1vcpu-1gb-tor1-01.ssh > 38.113.181.243.53135: Flags [P.], seq 1801976525:1801976633, ack 2209472948, win 501, length 108
21:22:07.291891 IP lamp-ubuntu-s-1vcpu-1gb-tor1-01.ssh > 38.113.181.243.53135: Flags [P.], seq 108:252, ack 1, win 501, length 144
21:22:07.291937 IP lamp-ubuntu-s-1vcpu-1gb-tor1-01.ssh > 38.113.181.243.53135: Flags [P.], seq 252:288, ack 1, win 501, length 36
21:22:07.292530 IP lamp-ubuntu-s-1vcpu-1gb-tor1-01.38654 > 67.207.67.2.domain: 25459+ [1au] PTR? 243.181.113.38.in-addr.arpa. (56)
21:22:07.292577 IP lamp-ubuntu-s-1vcpu-1gb-tor1-01.41768 > 67.207.67.2.domain: 57111+ [1au] PTR? 243.181.113.38.in-addr.arpa. (56)
21:22:07.292618 IP lamp-ubuntu-s-1vcpu-1gb-tor1-01.37786 > 67.207.67.2.domain: 1383+ [1au] PTR? 243.181.113.38.in-addr.arpa. (56)
21:22:07.297826 IP 67.207.67.2.domain > lamp-ubuntu-s-1vcpu-1gb-tor1-01.41768: 57111 ServFail 0/0/1 (56)
21:22:07.297826 IP 67.207.67.2.domain > lamp-ubuntu-s-1vcpu-1gb-tor1-01.38654: 25459 ServFail 0/0/1 (56)
21:22:07.297965 IP lamp-ubuntu-s-1vcpu-1gb-tor1-01.41768 > 67.207.67.2.domain: 57111+ PTR? 243.181.113.38.in-addr.arpa. (45)
21:22:07.298071 IP lamp-ubuntu-s-1vcpu-1gb-tor1-01.38654 > 67.207.67.2.domain: 25459+ PTR? 243.181.113.38.in-addr.arpa. (45)
21:22:07.298257 IP 67.207.67.2.domain > lamp-ubuntu-s-1vcpu-1gb-tor1-01.37786: 1383 ServFail 0/0/1 (56)
21:22:07.298292 IP lamp-ubuntu-s-1vcpu-1gb-tor1-01.37786 > 67.207.67.2.domain: 1383+ PTR? 243.181.113.38.in-addr.arpa. (45)
21:22:07.298925 IP 67.207.67.2.domain > lamp-ubuntu-s-1vcpu-1gb-tor1-01.38654: 25459 ServFail 0/0/0 (45)
21:22:07.298925 IP 67.207.67.2.domain > lamp-ubuntu-s-1vcpu-1gb-tor1-01.41768: 57111 ServFail 0/0/0 (45)
21:22:07.299232 IP lamp-ubuntu-s-1vcpu-1gb-tor1-01.52871 > 67.207.67.3.domain: 25459+ [1au] PTR? 243.181.113.38.in-addr.arpa. (56)
21:22:07.299314 IP lamp-ubuntu-s-1vcpu-1gb-tor1-01.43511 > 67.207.67.3.domain: 57111+ [1au] PTR? 243.181.113.38.in-addr.arpa. (56)
21:22:07.299327 IP 67.207.67.2.domain > lamp-ubuntu-s-1vcpu-1gb-tor1-01.37786: 1383 ServFail 0/0/0 (45)
21:22:07.299394 IP lamp-ubuntu-s-1vcpu-1gb-tor1-01.51533 > 67.207.67.3.domain: 1383+ [1au] PTR? 243.181.113.38.in-addr.arpa. (56)
21:22:07.299631 IP 67.207.67.3.domain > lamp-ubuntu-s-1vcpu-1gb-tor1-01.43511: 57111 ServFail 0/0/1 (56)
21:22:07.299648 IP 67.207.67.3.domain > lamp-ubuntu-s-1vcpu-1gb-tor1-01.51533: 1383 ServFail 0/0/1 (56)
21:22:07.299663 IP lamp-ubuntu-s-1vcpu-1gb-tor1-01.43511 > 67.207.67.3.domain: 57111+ PTR? 243.181.113.38.in-addr.arpa. (45)
21:22:07.299684 IP lamp-ubuntu-s-1vcpu-1gb-tor1-01.51533 > 67.207.67.3.domain: 1383+ PTR? 243.181.113.38.in-addr.arpa. (45)
21:22:07.299726 IP 67.207.67.3.domain > lamp-ubuntu-s-1vcpu-1gb-tor1-01.52871: 25459 ServFail 0/0/1 (56)
21:22:07.299810 IP lamp-ubuntu-s-1vcpu-1gb-tor1-01.52871 > 67.207.67.3.domain: 25459+ PTR? 243.181.113.38.in-addr.arpa. (45)
21:22:07.299904 IP 67.207.67.3.domain > lamp-ubuntu-s-1vcpu-1gb-tor1-01.43511: 57111 ServFail 0/0/0 (45)
21:22:07.299941 IP 67.207.67.3.domain > lamp-ubuntu-s-1vcpu-1gb-tor1-01.51533: 1383 ServFail 0/0/0 (45)
21:22:07.300114 IP 67.207.67.3.domain > lamp-ubuntu-s-1vcpu-1gb-tor1-01.52871: 25459 ServFail 0/0/0 (45)
21:22:07.300547 IP lamp-ubuntu-s-1vcpu-1gb-tor1-01.41391 > 67.207.67.3.domain: 21138+ [1au] PTR? 243.181.113.38.in-addr.arpa. (56)
21:22:07.300598 IP lamp-ubuntu-s-1vcpu-1gb-tor1-01.41765 > 67.207.67.3.domain: 39835+ [1au] PTR? 243.181.113.38.in-addr.arpa. (56)
21:22:07.300636 IP lamp-ubuntu-s-1vcpu-1gb-tor1-01.53675 > 67.207.67.3.domain: 1708+ [1au] PTR? 243.181.113.38.in-addr.arpa. (56)
21:22:07.300895 IP 67.207.67.3.domain > lamp-ubuntu-s-1vcpu-1gb-tor1-01.41765: 39835 ServFail 0/0/1 (56)
21:22:07.300921 IP lamp-ubuntu-s-1vcpu-1gb-tor1-01.41765 > 67.207.67.3.domain: 39835+ PTR? 243.181.113.38.in-addr.arpa. (45)
21:22:07.303694 IP lamp-ubuntu-s-1vcpu-1gb-tor1-01.ssh > 38.113.181.243.53135: Flags [P.], seq 512:676, ack 1, win 501, length 164
21:22:07.303772 IP lamp-ubuntu-s-1vcpu-1gb-tor1-01.ssh > 38.113.181.243.53135: Flags [P.], seq 712:876, ack 1, win 501, length 164
21:22:07.304126 IP lamp-ubuntu-s-1vcpu-1gb-tor1-01.53267 > 67.207.67.2.domain: 50338+ [1au] PTR? 2.67.207.67.in-addr.arpa. (53)
21:22:07.305663 IP lamp-ubuntu-s-1vcpu-1gb-tor1-01.44195 > 67.207.67.2.domain: 55191+ [1au] PTR? 3.67.207.67.in-addr.arpa. (53)
21:22:07.305709 IP lamp-ubuntu-s-1vcpu-1gb-tor1-01.47322 > 67.207.67.2.domain: 43589+ [1au] PTR? 3.67.207.67.in-addr.arpa. (53)
21:22:07.305749 IP lamp-ubuntu-s-1vcpu-1gb-tor1-01.37427 > 67.207.67.2.domain: 6268+ [1au] PTR? 3.67.207.67.in-addr.arpa. (53)
21:22:07.305956 IP 67.207.67.2.domain > lamp-ubuntu-s-1vcpu-1gb-tor1-01.47322: 43589 NXDomain 0/1/1 (120)
21:22:07.305983 IP 67.207.67.2.domain > lamp-ubuntu-s-1vcpu-1gb-tor1-01.37427: 6268 NXDomain 0/1/1 (120)
21:22:07.306016 IP lamp-ubuntu-s-1vcpu-1gb-tor1-01.47322 > 67.207.67.2.domain: 43589+ PTR? 3.67.207.67.in-addr.arpa. (42)
21:22:07.306054 IP lamp-ubuntu-s-1vcpu-1gb-tor1-01.37427 > 67.207.67.2.domain: 6268+ PTR? 3.67.207.67.in-addr.arpa. (42)
21:22:07.306272 IP 67.207.67.2.domain > lamp-ubuntu-s-1vcpu-1gb-tor1-01.47322: 43589 NXDomain 0/1/0 (109)
21:22:07.306302 IP 67.207.67.2.domain > lamp-ubuntu-s-1vcpu-1gb-tor1-01.37427: 6268 NXDomain 0/1/0 (109)
21:22:07.306410 IP 67.207.67.2.domain > lamp-ubuntu-s-1vcpu-1gb-tor1-01.44195: 55191 NXDomain 0/1/1 (120)
21:22:07.306468 IP lamp-ubuntu-s-1vcpu-1gb-tor1-01.44195 > 67.207.67.2.domain: 55191+ PTR? 3.67.207.67.in-addr.arpa. (42)
21:22:07.318924 IP 38.113.181.243.53135 > lamp-ubuntu-s-1vcpu-1gb-tor1-01.ssh: Flags [.], ack 288, win 8244, length 0
21:22:07.318990 IP lamp-ubuntu-s-1vcpu-1gb-tor1-01.ssh > 38.113.181.243.53135: Flags [P.], seq 912:3832, ack 1, win 501, length 2920
21:22:07.319004 IP lamp-ubuntu-s-1vcpu-1gb-tor1-01.ssh > 38.113.181.243.53135: Flags [P.], seq 3832:6752, ack 1, win 501, length 2920
21:22:07.319049 IP lamp-ubuntu-s-1vcpu-1gb-tor1-01.ssh > 38.113.181.243.53135: Flags [P.], seq 6752:9056, ack 1, win 501, length 2304
21:22:07.319172 IP lamp-ubuntu-s-1vcpu-1gb-tor1-01.ssh > 38.113.181.243.53135: Flags [P.], seq 9056:9212, ack 1, win 501, length 156
21:22:07.319209 IP lamp-ubuntu-s-1vcpu-1gb-tor1-01.ssh > 38.113.181.243.53135: Flags [P.], seq 9212:9248, ack 1, win 501, length 36
21:22:07.330879 IP 38.113.181.243.53135 > lamp-ubuntu-s-1vcpu-1gb-tor1-01.ssh: Flags [.], ack 676, win 8243, length 0
21:22:07.330952 IP lamp-ubuntu-s-1vcpu-1gb-tor1-01.ssh > 38.113.181.243.53135: Flags [P.], seq 9248:10288, ack 1, win 501, length 1040
21:22:07.331075 IP 38.113.181.243.53135 > lamp-ubuntu-s-1vcpu-1gb-tor1-01.ssh: Flags [.], ack 912, win 8242, length 0
21:22:07.331170 IP lamp-ubuntu-s-1vcpu-1gb-tor1-01.ssh > 38.113.181.243.53135: Flags [P.], seq 10288:10444, ack 1, win 501, length 156
21:22:07.331233 IP lamp-ubuntu-s-1vcpu-1gb-tor1-01.ssh > 38.113.181.243.53135: Flags [P.], seq 10444:10480, ack 1, win 501, length 36
21:22:07.331305 IP lamp-ubuntu-s-1vcpu-1gb-tor1-01.ssh > 38.113.181.243.53135: Flags [P.], seq 10480:10652, ack 1, win 501, length 172
21:22:07.331345 IP lamp-ubuntu-s-1vcpu-1gb-tor1-01.ssh > 38.113.181.243.53135: Flags [P.], seq 10652:10688, ack 1, win 501, length 36
21:22:07.331397 IP lamp-ubuntu-s-1vcpu-1gb-tor1-01.ssh > 38.113.181.243.53135: Flags [P.], seq 10688:10844, ack 1, win 501, length 156
21:22:07.331434 IP lamp-ubuntu-s-1vcpu-1gb-tor1-01.ssh > 38.113.181.243.53135: Flags [P.], seq 10844:10880, ack 1, win 501, length 36
21:22:07.331482 IP lamp-ubuntu-s-1vcpu-1gb-tor1-01.ssh > 38.113.181.243.53135: Flags [P.], seq 10880:11052, ack 1, win 501, length 172
21:22:07.331517 IP lamp-ubuntu-s-1vcpu-1gb-tor1-01.ssh > 38.113.181.243.53135: Flags [P.], seq 11052:11088, ack 1, win 501, length 36
21:22:07.331566 IP lamp-ubuntu-s-1vcpu-1gb-tor1-01.ssh > 38.113.181.243.53135: Flags [P.], seq 11088:11260, ack 1, win 501, length 172
21:22:07.331605 IP lamp-ubuntu-s-1vcpu-1gb-tor1-01.ssh > 38.113.181.243.53135: Flags [P.], seq 11260:11296, ack 1, win 501, length 36
21:22:07.331655 IP lamp-ubuntu-s-1vcpu-1gb-tor1-01.ssh > 38.113.181.243.53135: Flags [P.], seq 11296:11468, ack 1, win 501, length 172
21:22:07.346578 IP 38.113.181.243.53135 > lamp-ubuntu-s-1vcpu-1gb-tor1-01.ssh: Flags [.], ack 9248, win 8246, length 0
21:22:07.346650 IP lamp-ubuntu-s-1vcpu-1gb-tor1-01.ssh > 38.113.181.243.53135: Flags [P.], seq 11468:13168, ack 1, win 501, length 1700
21:22:07.346827 IP lamp-ubuntu-s-1vcpu-1gb-tor1-01.ssh > 38.113.181.243.53135: Flags [P.], seq 13168:13324, ack 1, win 501, length 156
21:22:07.346876 IP lamp-ubuntu-s-1vcpu-1gb-tor1-01.ssh > 38.113.181.243.53135: Flags [P.], seq 13324:13360, ack 1, win 501, length 36
21:22:07.346927 IP lamp-ubuntu-s-1vcpu-1gb-tor1-01.ssh > 38.113.181.243.53135: Flags [P.], seq 13360:13532, ack 1, win 501, length 172
21:22:07.346963 IP lamp-ubuntu-s-1vcpu-1gb-tor1-01.ssh > 38.113.181.243.53135: Flags [P.], seq 13532:13568, ack 1, win 501, length 36
21:22:07.347012 IP lamp-ubuntu-s-1vcpu-1gb-tor1-01.ssh > 38.113.181.243.53135: Flags [P.], seq 13568:13740, ack 1, win 501, length 172
21:22:07.347040 IP lamp-ubuntu-s-1vcpu-1gb-tor1-01.ssh > 38.113.181.243.53135: Flags [P.], seq 13740:13776, ack 1, win 501, length 36
21:22:07.347075 IP lamp-ubuntu-s-1vcpu-1gb-tor1-01.ssh > 38.113.181.243.53135: Flags [P.], seq 13776:13948, ack 1, win 501, length 172
21:22:07.347111 IP lamp-ubuntu-s-1vcpu-1gb-tor1-01.ssh > 38.113.181.243.53135: Flags [P.], seq 13948:13984, ack 1, win 501, length 36
21:22:07.347139 IP lamp-ubuntu-s-1vcpu-1gb-tor1-01.ssh > 38.113.181.243.53135: Flags [P.], seq 13984:14156, ack 1, win 501, length 172
21:22:07.347167 IP lamp-ubuntu-s-1vcpu-1gb-tor1-01.ssh > 38.113.181.243.53135: Flags [P.], seq 14156:14192, ack 1, win 501, length 36
21:22:07.347199 IP lamp-ubuntu-s-1vcpu-1gb-tor1-01.ssh > 38.113.181.243.53135: Flags [P.], seq 14192:14364, ack 1, win 501, length 172
21:22:07.347225 IP lamp-ubuntu-s-1vcpu-1gb-tor1-01.ssh > 38.113.181.243.53135: Flags [P.], seq 14364:14400, ack 1, win 501, length 36
21:22:07.347273 IP lamp-ubuntu-s-1vcpu-1gb-tor1-01.ssh > 38.113.181.243.53135: Flags [P.], seq 14400:14572, ack 1, win 501, length 172
21:22:07.347312 IP lamp-ubuntu-s-1vcpu-1gb-tor1-01.ssh > 38.113.181.243.53135: Flags [P.], seq 14572:14608, ack 1, win 501, length 36
21:22:07.358139 IP 38.113.181.243.53135 > lamp-ubuntu-s-1vcpu-1gb-tor1-01.ssh: Flags [.], ack 10444, win 8242, length 0
21:22:07.358200 IP lamp-ubuntu-s-1vcpu-1gb-tor1-01.ssh > 38.113.181.243.53135: Flags [P.], seq 14608:16480, ack 1, win 501, length 1872
21:22:07.358362 IP lamp-ubuntu-s-1vcpu-1gb-tor1-01.ssh > 38.113.181.243.53135: Flags [P.], seq 16480:16636, ack 1, win 501, length 156
21:22:07.358409 IP 38.113.181.243.53135 > lamp-ubuntu-s-1vcpu-1gb-tor1-01.ssh: Flags [.], ack 11468, win 8246, length 0
21:22:07.358441 IP lamp-ubuntu-s-1vcpu-1gb-tor1-01.ssh > 38.113.181.243.53135: Flags [P.], seq 16636:16672, ack 1, win 501, length 36
21:22:07.358504 IP lamp-ubuntu-s-1vcpu-1gb-tor1-01.ssh > 38.113.181.243.53135: Flags [P.], seq 16672:16844, ack 1, win 501, length 172
21:22:07.358537 IP lamp-ubuntu-s-1vcpu-1gb-tor1-01.ssh > 38.113.181.243.53135: Flags [P.], seq 16844:16880, ack 1, win 501, length 36
21:22:07.358574 IP lamp-ubuntu-s-1vcpu-1gb-tor1-01.ssh > 38.113.181.243.53135: Flags [P.], seq 16880:17052, ack 1, win 501, length 172
21:22:07.358622 IP lamp-ubuntu-s-1vcpu-1gb-tor1-01.ssh > 38.113.181.243.53135: Flags [P.], seq 17052:17088, ack 1, win 501, length 36
21:22:07.358658 IP lamp-ubuntu-s-1vcpu-1gb-tor1-01.ssh > 38.113.181.243.53135: Flags [P.], seq 17088:17244, ack 1, win 501, length 156
21:22:07.358703 IP lamp-ubuntu-s-1vcpu-1gb-tor1-01.ssh > 38.113.181.243.53135: Flags [P.], seq 17244:17280, ack 1, win 501, length 36
21:22:07.358760 IP lamp-ubuntu-s-1vcpu-1gb-tor1-01.ssh > 38.113.181.243.53135: Flags [P.], seq 17280:17452, ack 1, win 501, length 172
21:22:07.358807 IP lamp-ubuntu-s-1vcpu-1gb-tor1-01.ssh > 38.113.181.243.53135: Flags [P.], seq 17452:17488, ack 1, win 501, length 36
21:22:07.358854 IP lamp-ubuntu-s-1vcpu-1gb-tor1-01.ssh > 38.113.181.243.53135: Flags [P.], seq 17488:17660, ack 1, win 501, length 172
21:22:07.358884 IP lamp-ubuntu-s-1vcpu-1gb-tor1-01.ssh > 38.113.181.243.53135: Flags [P.], seq 17660:17696, ack 1, win 501, length 36
21:22:07.358918 IP lamp-ubuntu-s-1vcpu-1gb-tor1-01.ssh > 38.113.181.243.53135: Flags [P.], seq 17696:17868, ack 1, win 501, length 172
21:22:07.358953 IP lamp-ubuntu-s-1vcpu-1gb-tor1-01.ssh > 38.113.181.243.53135: Flags [P.], seq 17868:17904, ack 1, win 501, length 36
21:22:07.358975 IP lamp-ubuntu-s-1vcpu-1gb-tor1-01.ssh > 38.113.181.243.53135: Flags [P.], seq 17904:18076, ack 1, win 501, length 172
21:22:07.359008 IP lamp-ubuntu-s-1vcpu-1gb-tor1-01.ssh > 38.113.181.243.53135: Flags [P.], seq 18076:18112, ack 1, win 501, length 36
21:22:07.359040 IP lamp-ubuntu-s-1vcpu-1gb-tor1-01.ssh > 38.113.181.243.53135: Flags [P.], seq 18112:18284, ack 1, win 501, length 172
21:22:07.359068 IP lamp-ubuntu-s-1vcpu-1gb-tor1-01.ssh > 38.113.181.243.53135: Flags [P.], seq 18284:18320, ack 1, win 501, length 36
21:22:07.359102 IP lamp-ubuntu-s-1vcpu-1gb-tor1-01.ssh > 38.113.181.243.53135: Flags [P.], seq 18320:18492, ack 1, win 501, length 172
21:22:07.359133 IP lamp-ubuntu-s-1vcpu-1gb-tor1-01.ssh > 38.113.181.243.53135: Flags [P.], seq 18492:18528, ack 1, win 501, length 36
21:22:07.359164 IP lamp-ubuntu-s-1vcpu-1gb-tor1-01.ssh > 38.113.181.243.53135: Flags [P.], seq 18528:18700, ack 1, win 501, length 172
21:22:07.359191 IP lamp-ubuntu-s-1vcpu-1gb-tor1-01.ssh > 38.113.181.243.53135: Flags [P.], seq 18700:18736, ack 1, win 501, length 36
21:22:07.374999 IP 38.113.181.243.53135 > lamp-ubuntu-s-1vcpu-1gb-tor1-01.ssh: Flags [.], ack 14608, win 8246, length 0
21:22:07.375073 IP lamp-ubuntu-s-1vcpu-1gb-tor1-01.ssh > 38.113.181.243.53135: Flags [P.], seq 18736:21648, ack 1, win 501, length 2912
21:22:07.375246 IP lamp-ubuntu-s-1vcpu-1gb-tor1-01.ssh > 38.113.181.243.53135: Flags [P.], seq 21648:21804, ack 1, win 501, length 156
21:22:07.375294 IP lamp-ubuntu-s-1vcpu-1gb-tor1-01.ssh > 38.113.181.243.53135: Flags [P.], seq 21804:21840, ack 1, win 501, length 36
21:22:07.375344 IP lamp-ubuntu-s-1vcpu-1gb-tor1-01.ssh > 38.113.181.243.53135: Flags [P.], seq 21840:22012, ack 1, win 501, length 172
21:22:07.375379 IP lamp-ubuntu-s-1vcpu-1gb-tor1-01.ssh > 38.113.181.243.53135: Flags [P.], seq 22012:22048, ack 1, win 501, length 36
21:22:07.375423 IP lamp-ubuntu-s-1vcpu-1gb-tor1-01.ssh > 38.113.181.243.53135: Flags [P.], seq 22048:22220, ack 1, win 501, length 172
21:22:07.375451 IP lamp-ubuntu-s-1vcpu-1gb-tor1-01.ssh > 38.113.181.243.53135: Flags [P.], seq 22220:22256, ack 1, win 501, length 36
21:22:07.375507 IP lamp-ubuntu-s-1vcpu-1gb-tor1-01.ssh > 38.113.181.243.53135: Flags [P.], seq 22256:22428, ack 1, win 501, length 172
21:22:07.375560 IP lamp-ubuntu-s-1vcpu-1gb-tor1-01.ssh > 38.113.181.243.53135: Flags [P.], seq 22428:22636, ack 1, win 501, length 208
21:22:07.375598 IP lamp-ubuntu-s-1vcpu-1gb-tor1-01.ssh > 38.113.181.243.53135: Flags [P.], seq 22636:22672, ack 1, win 501, length 36
21:22:07.375616 IP lamp-ubuntu-s-1vcpu-1gb-tor1-01.ssh > 38.113.181.243.53135: Flags [P.], seq 22672:22844, ack 1, win 501, length 172
21:22:07.375659 IP lamp-ubuntu-s-1vcpu-1gb-tor1-01.ssh > 38.113.181.243.53135: Flags [P.], seq 22844:22880, ack 1, win 501, length 36
21:22:07.375695 IP lamp-ubuntu-s-1vcpu-1gb-tor1-01.ssh > 38.113.181.243.53135: Flags [P.], seq 22880:23052, ack 1, win 501, length 172
21:22:07.375725 IP lamp-ubuntu-s-1vcpu-1gb-tor1-01.ssh > 38.113.181.243.53135: Flags [P.], seq 23052:23088, ack 1, win 501, length 36
21:22:07.375759 IP lamp-ubuntu-s-1vcpu-1gb-tor1-01.ssh > 38.113.181.243.53135: Flags [P.], seq 23088:23260, ack 1, win 501, length 172
21:22:07.375791 IP lamp-ubuntu-s-1vcpu-1gb-tor1-01.ssh > 38.113.181.243.53135: Flags [P.], seq 23260:23296, ack 1, win 501, length 36
21:22:07.375823 IP lamp-ubuntu-s-1vcpu-1gb-tor1-01.ssh > 38.113.181.243.53135: Flags [P.], seq 23296:23468, ack 1, win 501, length 172
21:22:07.375850 IP lamp-ubuntu-s-1vcpu-1gb-tor1-01.ssh > 38.113.181.243.53135: Flags [P.], seq 23468:23504, ack 1, win 501, length 36
21:22:07.375884 IP lamp-ubuntu-s-1vcpu-1gb-tor1-01.ssh > 38.113.181.243.53135: Flags [P.], seq 23504:23676, ack 1, win 501, length 172
21:22:07.375910 IP lamp-ubuntu-s-1vcpu-1gb-tor1-01.ssh > 38.113.181.243.53135: Flags [P.], seq 23676:23712, ack 1, win 501, length 36
21:22:07.375945 IP lamp-ubuntu-s-1vcpu-1gb-tor1-01.ssh > 38.113.181.243.53135: Flags [P.], seq 23712:23884, ack 1, win 501, length 172
21:22:07.375972 IP lamp-ubuntu-s-1vcpu-1gb-tor1-01.ssh > 38.113.181.243.53135: Flags [P.], seq 23884:23920, ack 1, win 501, length 36
21:22:07.376005 IP lamp-ubuntu-s-1vcpu-1gb-tor1-01.ssh > 38.113.181.243.53135: Flags [P.], seq 23920:24092, ack 1, win 501, length 172
21:22:07.376047 IP lamp-ubuntu-s-1vcpu-1gb-tor1-01.ssh > 38.113.181.243.53135: Flags [P.], seq 24092:24128, ack 1, win 501, length 36
21:22:07.376083 IP lamp-ubuntu-s-1vcpu-1gb-tor1-01.ssh > 38.113.181.243.53135: Flags [P.], seq 24128:24300, ack 1, win 501, length 172
21:22:07.376111 IP lamp-ubuntu-s-1vcpu-1gb-tor1-01.ssh > 38.113.181.243.53135: Flags [P.], seq 24300:24336, ack 1, win 501, length 36
21:22:07.376142 IP lamp-ubuntu-s-1vcpu-1gb-tor1-01.ssh > 38.113.181.243.53135: Flags [P.], seq 24336:24508, ack 1, win 501, length 172
21:22:07.376183 IP lamp-ubuntu-s-1vcpu-1gb-tor1-01.ssh > 38.113.181.243.53135: Flags [P.], seq 24508:24544, ack 1, win 501, length 36
21:22:07.376196 IP lamp-ubuntu-s-1vcpu-1gb-tor1-01.ssh > 38.113.181.243.53135: Flags [P.], seq 24544:24716, ack 1, win 501, length 172
21:22:07.376224 IP lamp-ubuntu-s-1vcpu-1gb-tor1-01.ssh > 38.113.181.243.53135: Flags [P.], seq 24716:24752, ack 1, win 501, length 36
21:22:07.376257 IP lamp-ubuntu-s-1vcpu-1gb-tor1-01.ssh > 38.113.181.243.53135: Flags [P.], seq 24752:24924, ack 1, win 501, length 172
21:22:07.385436 IP 38.113.181.243.53135 > lamp-ubuntu-s-1vcpu-1gb-tor1-01.ssh: Flags [.], ack 16480, win 8246, length 0
21:22:07.385505 IP lamp-ubuntu-s-1vcpu-1gb-tor1-01.ssh > 38.113.181.243.53135: Flags [P.], seq 24924:28288, ack 1, win 501, length 3364
21:22:07.385693 IP lamp-ubuntu-s-1vcpu-1gb-tor1-01.ssh > 38.113.181.243.53135: Flags [P.], seq 28288:28444, ack 1, win 501, length 156
21:22:07.386299 IP 38.113.181.243.53135 > lamp-ubuntu-s-1vcpu-1gb-tor1-01.ssh: Flags [.], ack 18736, win 8246, length 0
21:22:07.386356 IP lamp-ubuntu-s-1vcpu-1gb-tor1-01.ssh > 38.113.181.243.53135: Flags [P.], seq 28444:28896, ack 1, win 501, length 452
21:22:07.386442 IP lamp-ubuntu-s-1vcpu-1gb-tor1-01.ssh > 38.113.181.243.53135: Flags [P.], seq 28896:29052, ack 1, win 501, length 156
21:22:07.386497 IP lamp-ubuntu-s-1vcpu-1gb-tor1-01.ssh > 38.113.181.243.53135: Flags [P.], seq 29052:29260, ack 1, win 501, length 208
21:22:07.386524 IP lamp-ubuntu-s-1vcpu-1gb-tor1-01.ssh > 38.113.181.243.53135: Flags [P.], seq 29260:29296, ack 1, win 501, length 36
21:22:07.386579 IP 38.113.181.243.53135 > lamp-ubuntu-s-1vcpu-1gb-tor1-01.ssh: Flags [P.], seq 1:37, ack 18736, win 8246, length 36
21:22:07.386629 IP lamp-ubuntu-s-1vcpu-1gb-tor1-01.ssh > 38.113.181.243.53135: Flags [P.], seq 29296:29468, ack 37, win 501, length 172
21:22:07.386671 IP lamp-ubuntu-s-1vcpu-1gb-tor1-01.ssh > 38.113.181.243.53135: Flags [P.], seq 29468:29504, ack 37, win 501, length 36
21:22:07.386717 IP lamp-ubuntu-s-1vcpu-1gb-tor1-01.ssh > 38.113.181.243.53135: Flags [P.], seq 29504:29676, ack 37, win 501, length 172
21:22:07.386745 IP lamp-ubuntu-s-1vcpu-1gb-tor1-01.ssh > 38.113.181.243.53135: Flags [P.], seq 29676:29712, ack 37, win 501, length 36
21:22:07.386782 IP lamp-ubuntu-s-1vcpu-1gb-tor1-01.ssh > 38.113.181.243.53135: Flags [P.], seq 29712:29884, ack 37, win 501, length 172
21:22:07.386820 IP lamp-ubuntu-s-1vcpu-1gb-tor1-01.ssh > 38.113.181.243.53135: Flags [P.], seq 29884:29920, ack 37, win 501, length 36
21:22:07.386858 IP lamp-ubuntu-s-1vcpu-1gb-tor1-01.ssh > 38.113.181.243.53135: Flags [P.], seq 29920:30092, ack 37, win 501, length 172
21:22:07.386891 IP lamp-ubuntu-s-1vcpu-1gb-tor1-01.ssh > 38.113.181.243.53135: Flags [P.], seq 30092:30128, ack 37, win 501, length 36
21:22:07.386941 IP lamp-ubuntu-s-1vcpu-1gb-tor1-01.ssh > 38.113.181.243.53135: Flags [P.], seq 30128:30300, ack 37, win 501, length 172
21:22:07.386978 IP lamp-ubuntu-s-1vcpu-1gb-tor1-01.ssh > 38.113.181.243.53135: Flags [P.], seq 30300:30336, ack 37, win 501, length 36
21:22:07.387029 IP lamp-ubuntu-s-1vcpu-1gb-tor1-01.ssh > 38.113.181.243.53135: Flags [P.], seq 30336:30508, ack 37, win 501, length 172
21:22:07.387066 IP lamp-ubuntu-s-1vcpu-1gb-tor1-01.ssh > 38.113.181.243.53135: Flags [P.], seq 30508:30544, ack 37, win 501, length 36
21:22:07.387113 IP lamp-ubuntu-s-1vcpu-1gb-tor1-01.ssh > 38.113.181.243.53135: Flags [P.], seq 30544:30716, ack 37, win 501, length 172
21:22:07.387153 IP lamp-ubuntu-s-1vcpu-1gb-tor1-01.ssh > 38.113.181.243.53135: Flags [P.], seq 30716:30752, ack 37, win 501, length 36
21:22:07.387201 IP lamp-ubuntu-s-1vcpu-1gb-tor1-01.ssh > 38.113.181.243.53135: Flags [P.], seq 30752:30924, ack 37, win 501, length 172
21:22:07.387246 IP lamp-ubuntu-s-1vcpu-1gb-tor1-01.ssh > 38.113.181.243.53135: Flags [P.], seq 30924:30960, ack 37, win 501, length 36
21:22:07.387296 IP lamp-ubuntu-s-1vcpu-1gb-tor1-01.ssh > 38.113.181.243.53135: Flags [P.], seq 30960:31132, ack 37, win 501, length 172
21:22:07.387336 IP lamp-ubuntu-s-1vcpu-1gb-tor1-01.ssh > 38.113.181.243.53135: Flags [P.], seq 31132:31168, ack 37, win 501, length 36
21:22:07.387384 IP lamp-ubuntu-s-1vcpu-1gb-tor1-01.ssh > 38.113.181.243.53135: Flags [P.], seq 31168:31340, ack 37, win 501, length 172
21:22:07.387423 IP lamp-ubuntu-s-1vcpu-1gb-tor1-01.ssh > 38.113.181.243.53135: Flags [P.], seq 31340:31376, ack 37, win 501, length 36
21:22:07.387460 IP lamp-ubuntu-s-1vcpu-1gb-tor1-01.ssh > 38.113.181.243.53135: Flags [P.], seq 31376:31548, ack 37, win 501, length 172
21:22:07.387507 IP lamp-ubuntu-s-1vcpu-1gb-tor1-01.ssh > 38.113.181.243.53135: Flags [P.], seq 31548:31584, ack 37, win 501, length 36
21:22:07.387530 IP lamp-ubuntu-s-1vcpu-1gb-tor1-01.ssh > 38.113.181.243.53135: Flags [P.], seq 31584:31756, ack 37, win 501, length 172
21:22:07.387556 IP lamp-ubuntu-s-1vcpu-1gb-tor1-01.ssh > 38.113.181.243.53135: Flags [P.], seq 31756:31792, ack 37, win 501, length 36
21:22:07.387591 IP lamp-ubuntu-s-1vcpu-1gb-tor1-01.ssh > 38.113.181.243.53135: Flags [P.], seq 31792:31964, ack 37, win 501, length 172
21:22:07.387632 IP lamp-ubuntu-s-1vcpu-1gb-tor1-01.ssh > 38.113.181.243.53135: Flags [P.], seq 31964:32172, ack 37, win 501, length 208
21:22:07.387673 IP lamp-ubuntu-s-1vcpu-1gb-tor1-01.ssh > 38.113.181.243.53135: Flags [P.], seq 32172:32208, ack 37, win 501, length 36
21:22:07.387694 IP lamp-ubuntu-s-1vcpu-1gb-tor1-01.ssh > 38.113.181.243.53135: Flags [P.], seq 32208:32380, ack 37, win 501, length 172
21:22:07.387723 IP lamp-ubuntu-s-1vcpu-1gb-tor1-01.ssh > 38.113.181.243.53135: Flags [P.], seq 32380:32416, ack 37, win 501, length 36
21:22:07.387754 IP lamp-ubuntu-s-1vcpu-1gb-tor1-01.ssh > 38.113.181.243.53135: Flags [P.], seq 32416:32588, ack 37, win 501, length 172
21:22:07.387823 IP lamp-ubuntu-s-1vcpu-1gb-tor1-01.ssh > 38.113.181.243.53135: Flags [P.], seq 32588:33032, ack 37, win 501, length 444
21:22:07.387924 IP lamp-ubuntu-s-1vcpu-1gb-tor1-01.ssh > 38.113.181.243.53135: Flags [P.], seq 33032:33748, ack 37, win 501, length 716
21:22:07.388027 IP lamp-ubuntu-s-1vcpu-1gb-tor1-01.ssh > 38.113.181.243.53135: Flags [P.], seq 33748:34744, ack 37, win 501, length 996
21:22:07.388117 IP lamp-ubuntu-s-1vcpu-1gb-tor1-01.ssh > 38.113.181.243.53135: Flags [P.], seq 34744:35604, ack 37, win 501, length 860
21:22:07.388180 IP lamp-ubuntu-s-1vcpu-1gb-tor1-01.ssh > 38.113.181.243.53135: Flags [P.], seq 35604:35776, ack 37, win 501, length 172
21:22:07.388241 IP lamp-ubuntu-s-1vcpu-1gb-tor1-01.ssh > 38.113.181.243.53135: Flags [P.], seq 35776:35948, ack 37, win 501, length 172
21:22:07.388299 IP lamp-ubuntu-s-1vcpu-1gb-tor1-01.ssh > 38.113.181.243.53135: Flags [P.], seq 35948:36120, ack 37, win 501, length 172
21:22:07.388338 IP lamp-ubuntu-s-1vcpu-1gb-tor1-01.ssh > 38.113.181.243.53135: Flags [P.], seq 36120:36292, ack 37, win 501, length 172
21:22:07.388395 IP lamp-ubuntu-s-1vcpu-1gb-tor1-01.ssh > 38.113.181.243.53135: Flags [P.], seq 36292:36464, ack 37, win 501, length 172
21:22:07.388449 IP lamp-ubuntu-s-1vcpu-1gb-tor1-01.ssh > 38.113.181.243.53135: Flags [P.], seq 36464:36636, ack 37, win 501, length 172
21:22:07.402446 IP 38.113.181.243.53135 > lamp-ubuntu-s-1vcpu-1gb-tor1-01.ssh: Flags [.], ack 21648, win 8246, length 0
21:22:07.402503 IP lamp-ubuntu-s-1vcpu-1gb-tor1-01.ssh > 38.113.181.243.53135: Flags [P.], seq 36636:36808, ack 37, win 501, length 172
21:22:07.402703 IP lamp-ubuntu-s-1vcpu-1gb-tor1-01.ssh > 38.113.181.243.53135: Flags [P.], seq 36808:36964, ack 37, win 501, length 156
21:22:07.402810 IP lamp-ubuntu-s-1vcpu-1gb-tor1-01.ssh > 38.113.181.243.53135: Flags [P.], seq 36964:37280, ack 37, win 501, length 316
21:22:07.402875 IP lamp-ubuntu-s-1vcpu-1gb-tor1-01.ssh > 38.113.181.243.53135: Flags [P.], seq 37280:37452, ack 37, win 501, length 172
21:22:07.402940 IP 38.113.181.243.53135 > lamp-ubuntu-s-1vcpu-1gb-tor1-01.ssh: Flags [.], ack 24128, win 8246, length 0
21:22:07.402978 IP lamp-ubuntu-s-1vcpu-1gb-tor1-01.ssh > 38.113.181.243.53135: Flags [P.], seq 37452:37624, ack 37, win 501, length 172
21:22:07.403033 IP lamp-ubuntu-s-1vcpu-1gb-tor1-01.ssh > 38.113.181.243.53135: Flags [P.], seq 37624:37916, ack 37, win 501, length 292
21:22:07.403095 IP lamp-ubuntu-s-1vcpu-1gb-tor1-01.ssh > 38.113.181.243.53135: Flags [P.], seq 37916:38088, ack 37, win 501, length 172
21:22:07.403155 IP lamp-ubuntu-s-1vcpu-1gb-tor1-01.ssh > 38.113.181.243.53135: Flags [P.], seq 38088:38260, ack 37, win 501, length 172
21:22:07.403358 IP 38.113.181.243.53135 > lamp-ubuntu-s-1vcpu-1gb-tor1-01.ssh: Flags [.], ack 24924, win 8243, length 0
21:22:07.403379 IP lamp-ubuntu-s-1vcpu-1gb-tor1-01.ssh > 38.113.181.243.53135: Flags [P.], seq 38260:38432, ack 37, win 501, length 172
21:22:07.403465 IP lamp-ubuntu-s-1vcpu-1gb-tor1-01.ssh > 38.113.181.243.53135: Flags [P.], seq 38432:38724, ack 37, win 501, length 292
21:22:07.403511 IP lamp-ubuntu-s-1vcpu-1gb-tor1-01.ssh > 38.113.181.243.53135: Flags [P.], seq 38724:38896, ack 37, win 501, length 172
21:22:07.403552 IP lamp-ubuntu-s-1vcpu-1gb-tor1-01.ssh > 38.113.181.243.53135: Flags [P.], seq 38896:39068, ack 37, win 501, length 172
21:22:07.403605 IP lamp-ubuntu-s-1vcpu-1gb-tor1-01.ssh > 38.113.181.243.53135: Flags [P.], seq 39068:39240, ack 37, win 501, length 172
21:22:07.403649 IP lamp-ubuntu-s-1vcpu-1gb-tor1-01.ssh > 38.113.181.243.53135: Flags [P.], seq 39240:39412, ack 37, win 501, length 172
21:22:07.403690 IP lamp-ubuntu-s-1vcpu-1gb-tor1-01.ssh > 38.113.181.243.53135: Flags [P.], seq 39412:39584, ack 37, win 501, length 172
21:22:07.403730 IP lamp-ubuntu-s-1vcpu-1gb-tor1-01.ssh > 38.113.181.243.53135: Flags [P.], seq 39584:39756, ack 37, win 501, length 172
21:22:07.403771 IP lamp-ubuntu-s-1vcpu-1gb-tor1-01.ssh > 38.113.181.243.53135: Flags [P.], seq 39756:39928, ack 37, win 501, length 172
21:22:07.403809 IP lamp-ubuntu-s-1vcpu-1gb-tor1-01.ssh > 38.113.181.243.53135: Flags [P.], seq 39928:40100, ack 37, win 501, length 172
21:22:07.403857 IP lamp-ubuntu-s-1vcpu-1gb-tor1-01.ssh > 38.113.181.243.53135: Flags [P.], seq 40100:40272, ack 37, win 501, length 172
21:22:07.403899 IP lamp-ubuntu-s-1vcpu-1gb-tor1-01.ssh > 38.113.181.243.53135: Flags [P.], seq 40272:40444, ack 37, win 501, length 172
21:22:07.403940 IP lamp-ubuntu-s-1vcpu-1gb-tor1-01.ssh > 38.113.181.243.53135: Flags [P.], seq 40444:40616, ack 37, win 501, length 172
21:22:07.403980 IP lamp-ubuntu-s-1vcpu-1gb-tor1-01.ssh > 38.113.181.243.53135: Flags [P.], seq 40616:40788, ack 37, win 501, length 172
21:22:07.404039 IP lamp-ubuntu-s-1vcpu-1gb-tor1-01.ssh > 38.113.181.243.53135: Flags [P.], seq 40788:40960, ack 37, win 501, length 172
21:22:07.404081 IP lamp-ubuntu-s-1vcpu-1gb-tor1-01.ssh > 38.113.181.243.53135: Flags [P.], seq 40960:41132, ack 37, win 501, length 172
21:22:07.404121 IP lamp-ubuntu-s-1vcpu-1gb-tor1-01.ssh > 38.113.181.243.53135: Flags [P.], seq 41132:41304, ack 37, win 501, length 172
21:22:07.404159 IP lamp-ubuntu-s-1vcpu-1gb-tor1-01.ssh > 38.113.181.243.53135: Flags [P.], seq 41304:41476, ack 37, win 501, length 172
21:22:07.404200 IP lamp-ubuntu-s-1vcpu-1gb-tor1-01.ssh > 38.113.181.243.53135: Flags [P.], seq 41476:41648, ack 37, win 501, length 172
21:22:07.404258 IP lamp-ubuntu-s-1vcpu-1gb-tor1-01.ssh > 38.113.181.243.53135: Flags [P.], seq 41648:41820, ack 37, win 501, length 172
21:22:07.404316 IP lamp-ubuntu-s-1vcpu-1gb-tor1-01.ssh > 38.113.181.243.53135: Flags [P.], seq 41820:41992, ack 37, win 501, length 172
21:22:07.404358 IP lamp-ubuntu-s-1vcpu-1gb-tor1-01.ssh > 38.113.181.243.53135: Flags [P.], seq 41992:42164, ack 37, win 501, length 172
21:22:07.404398 IP lamp-ubuntu-s-1vcpu-1gb-tor1-01.ssh > 38.113.181.243.53135: Flags [P.], seq 42164:42336, ack 37, win 501, length 172
21:22:07.404437 IP lamp-ubuntu-s-1vcpu-1gb-tor1-01.ssh > 38.113.181.243.53135: Flags [P.], seq 42336:42508, ack 37, win 501, length 172
21:22:07.404486 IP lamp-ubuntu-s-1vcpu-1gb-tor1-01.ssh > 38.113.181.243.53135: Flags [P.], seq 42508:42680, ack 37, win 501, length 172
21:22:07.404524 IP lamp-ubuntu-s-1vcpu-1gb-tor1-01.ssh > 38.113.181.243.53135: Flags [P.], seq 42680:42852, ack 37, win 501, length 172
21:22:07.404563 IP lamp-ubuntu-s-1vcpu-1gb-tor1-01.ssh > 38.113.181.243.53135: Flags [P.], seq 42852:43024, ack 37, win 501, length 172
21:22:07.404601 IP lamp-ubuntu-s-1vcpu-1gb-tor1-01.ssh > 38.113.181.243.53135: Flags [P.], seq 43024:43196, ack 37, win 501, length 172
21:22:07.404640 IP lamp-ubuntu-s-1vcpu-1gb-tor1-01.ssh > 38.113.181.243.53135: Flags [P.], seq 43196:43368, ack 37, win 501, length 172
21:22:07.404692 IP lamp-ubuntu-s-1vcpu-1gb-tor1-01.ssh > 38.113.181.243.53135: Flags [P.], seq 43368:43540, ack 37, win 501, length 172
21:22:07.404757 IP lamp-ubuntu-s-1vcpu-1gb-tor1-01.ssh > 38.113.181.243.53135: Flags [P.], seq 43540:43712, ack 37, win 501, length 172
21:22:07.404803 IP lamp-ubuntu-s-1vcpu-1gb-tor1-01.ssh > 38.113.181.243.53135: Flags [P.], seq 43712:43884, ack 37, win 501, length 172
21:22:07.404842 IP lamp-ubuntu-s-1vcpu-1gb-tor1-01.ssh > 38.113.181.243.53135: Flags [P.], seq 43884:44056, ack 37, win 501, length 172
21:22:07.404909 IP lamp-ubuntu-s-1vcpu-1gb-tor1-01.ssh > 38.113.181.243.53135: Flags [P.], seq 44056:44228, ack 37, win 501, length 172
21:22:07.404966 IP lamp-ubuntu-s-1vcpu-1gb-tor1-01.ssh > 38.113.181.243.53135: Flags [P.], seq 44228:44400, ack 37, win 501, length 172
21:22:07.405009 IP lamp-ubuntu-s-1vcpu-1gb-tor1-01.ssh > 38.113.181.243.53135: Flags [P.], seq 44400:44572, ack 37, win 501, length 172
21:22:07.405048 IP lamp-ubuntu-s-1vcpu-1gb-tor1-01.ssh > 38.113.181.243.53135: Flags [P.], seq 44572:44744, ack 37, win 501, length 172
21:22:07.405086 IP lamp-ubuntu-s-1vcpu-1gb-tor1-01.ssh > 38.113.181.243.53135: Flags [P.], seq 44744:44916, ack 37, win 501, length 172
21:22:07.405124 IP lamp-ubuntu-s-1vcpu-1gb-tor1-01.ssh > 38.113.181.243.53135: Flags [P.], seq 44916:45088, ack 37, win 501, length 172
21:22:07.405161 IP lamp-ubuntu-s-1vcpu-1gb-tor1-01.ssh > 38.113.181.243.53135: Flags [P.], seq 45088:45260, ack 37, win 501, length 172
21:22:07.405201 IP lamp-ubuntu-s-1vcpu-1gb-tor1-01.ssh > 38.113.181.243.53135: Flags [P.], seq 45260:45432, ack 37, win 501, length 172
21:22:07.405284 IP lamp-ubuntu-s-1vcpu-1gb-tor1-01.ssh > 38.113.181.243.53135: Flags [P.], seq 45432:45604, ack 37, win 501, length 172
21:22:07.405353 IP lamp-ubuntu-s-1vcpu-1gb-tor1-01.ssh > 38.113.181.243.53135: Flags [P.], seq 45604:45776, ack 37, win 501, length 172
21:22:07.405407 IP lamp-ubuntu-s-1vcpu-1gb-tor1-01.ssh > 38.113.181.243.53135: Flags [P.], seq 45776:45948, ack 37, win 501, length 172
21:22:07.405448 IP lamp-ubuntu-s-1vcpu-1gb-tor1-01.ssh > 38.113.181.243.53135: Flags [P.], seq 45948:46120, ack 37, win 501, length 172
21:22:07.405515 IP lamp-ubuntu-s-1vcpu-1gb-tor1-01.ssh > 38.113.181.243.53135: Flags [P.], seq 46120:46292, ack 37, win 501, length 172
21:22:07.405561 IP lamp-ubuntu-s-1vcpu-1gb-tor1-01.ssh > 38.113.181.243.53135: Flags [P.], seq 46292:46464, ack 37, win 501, length 172
21:22:07.405603 IP lamp-ubuntu-s-1vcpu-1gb-tor1-01.ssh > 38.113.181.243.53135: Flags [P.], seq 46464:46636, ack 37, win 501, length 172
21:22:07.405657 IP lamp-ubuntu-s-1vcpu-1gb-tor1-01.ssh > 38.113.181.243.53135: Flags [P.], seq 46636:46808, ack 37, win 501, length 172
21:22:07.405703 IP lamp-ubuntu-s-1vcpu-1gb-tor1-01.ssh > 38.113.181.243.53135: Flags [P.], seq 46808:46980, ack 37, win 501, length 172
21:22:07.405770 IP lamp-ubuntu-s-1vcpu-1gb-tor1-01.ssh > 38.113.181.243.53135: Flags [P.], seq 46980:47152, ack 37, win 501, length 172
21:22:07.405826 IP lamp-ubuntu-s-1vcpu-1gb-tor1-01.ssh > 38.113.181.243.53135: Flags [P.], seq 47152:47324, ack 37, win 501, length 172
21:22:07.405872 IP lamp-ubuntu-s-1vcpu-1gb-tor1-01.ssh > 38.113.181.243.53135: Flags [P.], seq 47324:47496, ack 37, win 501, length 172
21:22:07.405913 IP lamp-ubuntu-s-1vcpu-1gb-tor1-01.ssh > 38.113.181.243.53135: Flags [P.], seq 47496:47668, ack 37, win 501, length 172
21:22:07.405953 IP lamp-ubuntu-s-1vcpu-1gb-tor1-01.ssh > 38.113.181.243.53135: Flags [P.], seq 47668:47840, ack 37, win 501, length 172
21:22:07.405992 IP lamp-ubuntu-s-1vcpu-1gb-tor1-01.ssh > 38.113.181.243.53135: Flags [P.], seq 47840:48012, ack 37, win 501, length 172
21:22:07.413327 IP 38.113.181.243.53135 > lamp-ubuntu-s-1vcpu-1gb-tor1-01.ssh: Flags [.], ack 27844, win 8246, length 0
21:22:07.413392 IP lamp-ubuntu-s-1vcpu-1gb-tor1-01.ssh > 38.113.181.243.53135: Flags [P.], seq 48012:48184, ack 37, win 501, length 172
21:22:07.413590 IP lamp-ubuntu-s-1vcpu-1gb-tor1-01.ssh > 38.113.181.243.53135: Flags [P.], seq 48184:48476, ack 37, win 501, length 292
21:22:07.413678 IP lamp-ubuntu-s-1vcpu-1gb-tor1-01.ssh > 38.113.181.243.53135: Flags [P.], seq 48476:48648, ack 37, win 501, length 172
21:22:07.413740 IP lamp-ubuntu-s-1vcpu-1gb-tor1-01.ssh > 38.113.181.243.53135: Flags [P.], seq 48648:48820, ack 37, win 501, length 172
21:22:07.414735 IP 38.113.181.243.53135 > lamp-ubuntu-s-1vcpu-1gb-tor1-01.ssh: Flags [.], ack 28444, win 8244, length 0
21:22:07.414774 IP lamp-ubuntu-s-1vcpu-1gb-tor1-01.ssh > 38.113.181.243.53135: Flags [P.], seq 48820:48992, ack 37, win 501, length 172
21:22:07.414915 IP lamp-ubuntu-s-1vcpu-1gb-tor1-01.ssh > 38.113.181.243.53135: Flags [P.], seq 48992:49284, ack 37, win 501, length 292
21:22:07.414963 IP lamp-ubuntu-s-1vcpu-1gb-tor1-01.ssh > 38.113.181.243.53135: Flags [P.], seq 49284:49456, ack 37, win 501, length 172
21:22:07.415007 IP lamp-ubuntu-s-1vcpu-1gb-tor1-01.ssh > 38.113.181.243.53135: Flags [P.], seq 49456:49628, ack 37, win 501, length 172
21:22:07.415745 IP 38.113.181.243.53135 > lamp-ubuntu-s-1vcpu-1gb-tor1-01.ssh: Flags [.], ack 32380, win 8246, length 0
21:22:07.415745 IP 38.113.181.243.53135 > lamp-ubuntu-s-1vcpu-1gb-tor1-01.ssh: Flags [.], ack 32588, win 8245, length 0
21:22:07.415792 IP lamp-ubuntu-s-1vcpu-1gb-tor1-01.ssh > 38.113.181.243.53135: Flags [P.], seq 49628:49800, ack 37, win 501, length 172
21:22:07.415824 IP 38.113.181.243.53135 > lamp-ubuntu-s-1vcpu-1gb-tor1-01.ssh: Flags [.], ack 35948, win 8246, length 0
21:22:07.415913 IP lamp-ubuntu-s-1vcpu-1gb-tor1-01.ssh > 38.113.181.243.53135: Flags [P.], seq 49800:50340, ack 37, win 501, length 540
21:22:07.415961 IP lamp-ubuntu-s-1vcpu-1gb-tor1-01.ssh > 38.113.181.243.53135: Flags [P.], seq 50340:50512, ack 37, win 501, length 172
21:22:07.416002 IP lamp-ubuntu-s-1vcpu-1gb-tor1-01.ssh > 38.113.181.243.53135: Flags [P.], seq 50512:50684, ack 37, win 501, length 172
21:22:07.416061 IP lamp-ubuntu-s-1vcpu-1gb-tor1-01.ssh > 38.113.181.243.53135: Flags [P.], seq 50684:50856, ack 37, win 501, length 172
21:22:07.416103 IP lamp-ubuntu-s-1vcpu-1gb-tor1-01.ssh > 38.113.181.243.53135: Flags [P.], seq 50856:51028, ack 37, win 501, length 172
21:22:07.416143 IP lamp-ubuntu-s-1vcpu-1gb-tor1-01.ssh > 38.113.181.243.53135: Flags [P.], seq 51028:51200, ack 37, win 501, length 172
21:22:07.416200 IP lamp-ubuntu-s-1vcpu-1gb-tor1-01.ssh > 38.113.181.243.53135: Flags [P.], seq 51200:51372, ack 37, win 501, length 172
21:22:07.416250 IP lamp-ubuntu-s-1vcpu-1gb-tor1-01.ssh > 38.113.181.243.53135: Flags [P.], seq 51372:51544, ack 37, win 501, length 172
21:22:07.416290 IP lamp-ubuntu-s-1vcpu-1gb-tor1-01.ssh > 38.113.181.243.53135: Flags [P.], seq 51544:51716, ack 37, win 501, length 172
21:22:07.416354 IP lamp-ubuntu-s-1vcpu-1gb-tor1-01.ssh > 38.113.181.243.53135: Flags [P.], seq 51716:51888, ack 37, win 501, length 172
21:22:07.416406 IP lamp-ubuntu-s-1vcpu-1gb-tor1-01.ssh > 38.113.181.243.53135: Flags [P.], seq 51888:52060, ack 37, win 501, length 172
21:22:07.416446 IP lamp-ubuntu-s-1vcpu-1gb-tor1-01.ssh > 38.113.181.243.53135: Flags [P.], seq 52060:52232, ack 37, win 501, length 172
21:22:07.416488 IP lamp-ubuntu-s-1vcpu-1gb-tor1-01.ssh > 38.113.181.243.53135: Flags [P.], seq 52232:52404, ack 37, win 501, length 172
21:22:07.416530 IP lamp-ubuntu-s-1vcpu-1gb-tor1-01.ssh > 38.113.181.243.53135: Flags [P.], seq 52404:52576, ack 37, win 501, length 172
21:22:07.416569 IP lamp-ubuntu-s-1vcpu-1gb-tor1-01.ssh > 38.113.181.243.53135: Flags [P.], seq 52576:52748, ack 37, win 501, length 172
21:22:07.416608 IP lamp-ubuntu-s-1vcpu-1gb-tor1-01.ssh > 38.113.181.243.53135: Flags [P.], seq 52748:52920, ack 37, win 501, length 172
21:22:07.416647 IP lamp-ubuntu-s-1vcpu-1gb-tor1-01.ssh > 38.113.181.243.53135: Flags [P.], seq 52920:53092, ack 37, win 501, length 172
21:22:07.416687 IP lamp-ubuntu-s-1vcpu-1gb-tor1-01.ssh > 38.113.181.243.53135: Flags [P.], seq 53092:53264, ack 37, win 501, length 172
21:22:07.416727 IP lamp-ubuntu-s-1vcpu-1gb-tor1-01.ssh > 38.113.181.243.53135: Flags [P.], seq 53264:53436, ack 37, win 501, length 172
21:22:07.416771 IP lamp-ubuntu-s-1vcpu-1gb-tor1-01.ssh > 38.113.181.243.53135: Flags [P.], seq 53436:53608, ack 37, win 501, length 172
21:22:07.416834 IP lamp-ubuntu-s-1vcpu-1gb-tor1-01.ssh > 38.113.181.243.53135: Flags [P.], seq 53608:53780, ack 37, win 501, length 172
21:22:07.416890 IP lamp-ubuntu-s-1vcpu-1gb-tor1-01.ssh > 38.113.181.243.53135: Flags [P.], seq 53780:53952, ack 37, win 501, length 172
21:22:07.416947 IP 38.113.181.243.53135 > lamp-ubuntu-s-1vcpu-1gb-tor1-01.ssh: Flags [.], ack 36636, win 8244, length 0
21:22:07.417005 IP lamp-ubuntu-s-1vcpu-1gb-tor1-01.ssh > 38.113.181.243.53135: Flags [P.], seq 53952:54244, ack 37, win 501, length 292
21:22:07.417055 IP lamp-ubuntu-s-1vcpu-1gb-tor1-01.ssh > 38.113.181.243.53135: Flags [P.], seq 54244:54416, ack 37, win 501, length 172
21:22:07.417112 IP lamp-ubuntu-s-1vcpu-1gb-tor1-01.ssh > 38.113.181.243.53135: Flags [P.], seq 54416:54588, ack 37, win 501, length 172
21:22:07.417173 IP lamp-ubuntu-s-1vcpu-1gb-tor1-01.ssh > 38.113.181.243.53135: Flags [P.], seq 54588:54760, ack 37, win 501, length 172
21:22:07.417230 IP lamp-ubuntu-s-1vcpu-1gb-tor1-01.ssh > 38.113.181.243.53135: Flags [P.], seq 54760:54932, ack 37, win 501, length 172
21:22:07.417282 IP lamp-ubuntu-s-1vcpu-1gb-tor1-01.ssh > 38.113.181.243.53135: Flags [P.], seq 54932:55104, ack 37, win 501, length 172
21:22:07.417321 IP lamp-ubuntu-s-1vcpu-1gb-tor1-01.ssh > 38.113.181.243.53135: Flags [P.], seq 55104:55276, ack 37, win 501, length 172
21:22:07.417360 IP lamp-ubuntu-s-1vcpu-1gb-tor1-01.ssh > 38.113.181.243.53135: Flags [P.], seq 55276:55448, ack 37, win 501, length 172
21:22:07.417397 IP lamp-ubuntu-s-1vcpu-1gb-tor1-01.ssh > 38.113.181.243.53135: Flags [P.], seq 55448:55620, ack 37, win 501, length 172
